{"baseusr":"HotFireyDeath","basepwd":"$2y$10$GKc15jFtu.1XJPDGu4k\/ke29mLvJcoors96l8YK13syyZ2e0frg\/W","serverdata":{"ip":"146.148.77.192","port":19145,"api":"1.11.0","pm-v":"1.4.1-980","servern":"Minecraft: PE Server","motd":"Minecraft: PE Server","status":"closed","currentmemory":"27","totalmemory":"512","currentcpu":"3.74","plugins":["DevTools","Specter","Glifcos-p"]},"ranks":[],"playerquery":{"total":"5","currentamount":"0","list":[]},"console":"2016-01-20 19:50:42 [INFO] Starting Minecraft: PE server version v0.10.5 alpha\n2016-01-20 19:50:42 [INFO] Loading pocketmine.yml...\n2016-01-20 19:50:42 [INFO] Loading server properties...\n2016-01-20 19:50:42 [INFO] Starting Minecraft PE server on 0.0.0.0:19142\n2016-01-20 19:50:42 [INFO] This server is running PocketMine-MP version 1.4.1-980 \"\u7d76\u597d(Zekkou)\u30b1\u30fc\u30ad(Cake)\" (API 1.11.0)\n2016-01-20 19:50:42 [INFO] PocketMine-MP is distributed under the LGPL License\n2016-01-20 19:50:42 [NOTICE] Level \"world\" not found\n2016-01-20 19:50:42 [INFO] Preparing level \"world\"\n2016-01-20 19:50:42 [NOTICE] Spawn terrain for level \"world\" is being generated in the background\n2016-01-20 19:50:42 [INFO] Starting GS4 status listener\n2016-01-20 19:50:42 [INFO] Setting query port to 19142\n2016-01-20 19:50:42 [INFO] Query running on 0.0.0.0:19142\n2016-01-20 19:50:42 [INFO] Default game type: SURVIVAL\n2016-01-20 19:50:42 [INFO] Done (33.495s)! For help, type \"help\" or \"?\"\n2016-01-20 19:51:12 [INFO] CONSOLE: Stopping the server...\n2016-01-20 19:51:12 [INFO] Unloading level \"world\"\n2016-01-20 19:51:12 [INFO] Stopping other threads\n2016-01-20 19:51:15 [INFO] Starting Minecraft: PE server version v0.10.5 alpha\n2016-01-20 19:51:15 [INFO] Loading pocketmine.yml...\n2016-01-20 19:51:15 [INFO] Loading server properties...\n2016-01-20 19:51:15 [INFO] Starting Minecraft PE server on 0.0.0.0:19142\n2016-01-20 19:51:15 [INFO] This server is running PocketMine-MP version 1.4.1-980 \"\u7d76\u597d(Zekkou)\u30b1\u30fc\u30ad(Cake)\" (API 1.11.0)\n2016-01-20 19:51:15 [INFO] PocketMine-MP is distributed under the LGPL License\n2016-01-20 19:51:15 [INFO] Loading DevTools v1.10.0\n2016-01-20 19:51:15 [INFO] Enabling DevTools v1.10.0\n2016-01-20 19:51:15 [ERROR] Could not load plugin 'Glifcos-p': API version not compatible\n2016-01-20 19:51:15 [INFO] [DevTools] Registered folder plugin loader\n2016-01-20 19:51:15 [INFO] Preparing level \"world\"\n2016-01-20 19:51:15 [INFO] Starting GS4 status listener\n2016-01-20 19:51:15 [INFO] Setting query port to 19142\n2016-01-20 19:51:15 [INFO] Query running on 0.0.0.0:19142\n2016-01-20 19:51:15 [INFO] Default game type: SURVIVAL\n2016-01-20 19:51:15 [INFO] Done (0.397s)! For help, type \"help\" or \"?\"\n2016-01-20 19:51:19 [INFO] CONSOLE: Stopping the server...\n2016-01-20 19:51:19 [INFO] Disabling DevTools v1.10.0\n2016-01-20 19:51:19 [INFO] Unloading level \"world\"\n2016-01-20 19:51:19 [INFO] Stopping other threads\n2016-01-20 19:56:53 [INFO] Starting Minecraft: PE server version v0.10.5 alpha\n2016-01-20 19:56:53 [INFO] Loading pocketmine.yml...\n2016-01-20 19:56:53 [INFO] Loading server properties...\n2016-01-20 19:56:53 [INFO] Starting Minecraft PE server on 0.0.0.0:19142\n2016-01-20 19:56:53 [INFO] This server is running PocketMine-MP version 1.4.1-980 \"\u7d76\u597d(Zekkou)\u30b1\u30fc\u30ad(Cake)\" (API 1.11.0)\n2016-01-20 19:56:53 [INFO] PocketMine-MP is distributed under the LGPL License\n2016-01-20 19:56:53 [INFO] Loading DevTools v1.10.0\n2016-01-20 19:56:53 [INFO] Enabling DevTools v1.10.0\n2016-01-20 19:56:53 [INFO] Loading source plugin Glifcos-p v1.0.0\n2016-01-20 19:56:53 [INFO] [DevTools] Registered folder plugin loader\n2016-01-20 19:56:53 [INFO] Preparing level \"world\"\n2016-01-20 19:56:53 [INFO] Enabling Glifcos-p v1.0.0\n2016-01-20 19:56:53 [WARNING] RuntimeException: \"fopen(www.domain.com\/path\/to\/your\/glifcos\/webserver\/directory\/connection.php?type=ping): failed to open stream: No such file or directory\" (E_WARNING) in \"\/glifcos-plugin\/src\/glifcos\/glifcos\" at line 45\n2016-01-20 19:56:53 [INFO] Disabling Glifcos-p v1.0.0\n2016-01-20 19:56:54 [INFO] Starting GS4 status listener\n2016-01-20 19:56:54 [INFO] Setting query port to 19142\n2016-01-20 19:56:54 [INFO] Query running on 0.0.0.0:19142\n2016-01-20 19:56:54 [INFO] Default game type: SURVIVAL\n2016-01-20 19:56:54 [INFO] Done (0.581s)! For help, type \"help\" or \"?\"\n2016-01-20 19:56:57 [INFO] CONSOLE: Stopping the server...\n2016-01-20 19:56:57 [INFO] Disabling DevTools v1.10.0\n2016-01-20 19:56:57 [INFO] Unloading level \"world\"\n2016-01-20 19:56:57 [INFO] Stopping other threads\n2016-01-20 19:57:45 [INFO] Starting Minecraft: PE server version v0.10.5 alpha\n2016-01-20 19:57:45 [INFO] Loading pocketmine.yml...\n2016-01-20 19:57:45 [INFO] Loading server properties...\n2016-01-20 19:57:45 [INFO] Starting Minecraft PE server on 0.0.0.0:19142\n2016-01-20 19:57:45 [INFO] This server is running PocketMine-MP version 1.4.1-980 \"\u7d76\u597d(Zekkou)\u30b1\u30fc\u30ad(Cake)\" (API 1.11.0)\n2016-01-20 19:57:45 [INFO] PocketMine-MP is distributed under the LGPL License\n2016-01-20 19:57:45 [INFO] Loading DevTools v1.10.0\n2016-01-20 19:57:45 [INFO] Enabling DevTools v1.10.0\n2016-01-20 19:57:45 [INFO] Loading source plugin Glifcos-p v1.0.0\n2016-01-20 19:57:45 [INFO] [DevTools] Registered folder plugin loader\n2016-01-20 19:57:45 [INFO] Preparing level \"world\"\n2016-01-20 19:57:45 [INFO] Enabling Glifcos-p v1.0.0\n2016-01-20 19:57:45 [WARNING] RuntimeException: \"fopen(): Unable to find the wrapper \"https\" - did you forget to enable it when you configured PHP?\" (E_WARNING) in \"\/glifcos-plugin\/src\/glifcos\/glifcos\" at line 45\n2016-01-20 19:57:45 [INFO] Disabling Glifcos-p v1.0.0\n2016-01-20 19:57:45 [INFO] Starting GS4 status listener\n2016-01-20 19:57:45 [INFO] Setting query port to 19142\n2016-01-20 19:57:45 [INFO] Query running on 0.0.0.0:19142\n2016-01-20 19:57:45 [INFO] Default game type: SURVIVAL\n2016-01-20 19:57:45 [INFO] Done (0.399s)! For help, type \"help\" or \"?\"\n2016-01-20 19:57:47 [INFO] CONSOLE: Stopping the server...\n2016-01-20 19:57:47 [INFO] Disabling DevTools v1.10.0\n2016-01-20 19:57:47 [INFO] Unloading level \"world\"\n2016-01-20 19:57:47 [INFO] Stopping other threads\n2016-01-20 19:57:51 [INFO] Starting Minecraft: PE server version v0.10.5 alpha\n2016-01-20 19:57:51 [INFO] Loading pocketmine.yml...\n2016-01-20 19:57:51 [INFO] Loading server properties...\n2016-01-20 19:57:51 [INFO] Starting Minecraft PE server on 0.0.0.0:19142\n2016-01-20 19:57:51 [INFO] This server is running PocketMine-MP version 1.4.1-980 \"\u7d76\u597d(Zekkou)\u30b1\u30fc\u30ad(Cake)\" (API 1.11.0)\n2016-01-20 19:57:51 [INFO] PocketMine-MP is distributed under the LGPL License\n2016-01-20 19:57:51 [INFO] Loading DevTools v1.10.0\n2016-01-20 19:57:51 [INFO] Enabling DevTools v1.10.0\n2016-01-20 19:57:51 [INFO] Loading source plugin Glifcos-p v1.0.0\n2016-01-20 19:57:51 [INFO] [DevTools] Registered folder plugin loader\n2016-01-20 19:57:51 [INFO] Preparing level \"world\"\n2016-01-20 19:57:51 [INFO] Enabling Glifcos-p v1.0.0\n2016-01-20 19:57:51 [WARNING] RuntimeException: \"fopen(): Unable to find the wrapper \"https\" - did you forget to enable it when you configured PHP?\" (E_WARNING) in \"\/glifcos-plugin\/src\/glifcos\/glifcos\" at line 45\n2016-01-20 19:57:51 [INFO] Disabling Glifcos-p v1.0.0\n2016-01-20 19:57:51 [INFO] Starting GS4 status listener\n2016-01-20 19:57:51 [INFO] Setting query port to 19142\n2016-01-20 19:57:51 [INFO] Query running on 0.0.0.0:19142\n2016-01-20 19:57:51 [INFO] Default game type: SURVIVAL\n2016-01-20 19:57:51 [INFO] Done (0.479s)! For help, type \"help\" or \"?\"\n2016-01-20 19:57:53 [INFO] CONSOLE: Stopping the server...\n2016-01-20 19:57:53 [INFO] Disabling DevTools v1.10.0\n2016-01-20 19:57:53 [INFO] Unloading level \"world\"\n2016-01-20 19:57:53 [INFO] Stopping other threads\n2016-01-20 19:58:00 [INFO] Starting Minecraft: PE server version v0.10.5 alpha\n2016-01-20 19:58:00 [INFO] Loading pocketmine.yml...\n2016-01-20 19:58:00 [INFO] Loading server properties...\n2016-01-20 19:58:00 [INFO] Starting Minecraft PE server on 0.0.0.0:19142\n2016-01-20 19:58:00 [INFO] This server is running PocketMine-MP version 1.4.1-980 \"\u7d76\u597d(Zekkou)\u30b1\u30fc\u30ad(Cake)\" (API 1.11.0)\n2016-01-20 19:58:00 [INFO] PocketMine-MP is distributed under the LGPL License\n2016-01-20 19:58:01 [INFO] Loading DevTools v1.10.0\n2016-01-20 19:58:01 [INFO] Enabling DevTools v1.10.0\n2016-01-20 19:58:01 [INFO] Loading source plugin Glifcos-p v1.0.0\n2016-01-20 19:58:01 [INFO] [DevTools] Registered folder plugin loader\n2016-01-20 19:58:01 [INFO] Preparing level \"world\"\n2016-01-20 19:58:01 [INFO] Enabling Glifcos-p v1.0.0\n2016-01-20 19:58:01 [WARNING] RuntimeException: \"file_get_contents(): Unable to find the wrapper \"https\" - did you forget to enable it when you configured PHP?\" (E_WARNING) in \"\/glifcos-plugin\/src\/glifcos\/glifcos\" at line 60\n2016-01-20 19:58:01 [INFO] Disabling Glifcos-p v1.0.0\n2016-01-20 19:58:01 [INFO] Starting GS4 status listener\n2016-01-20 19:58:01 [INFO] Setting query port to 19142\n2016-01-20 19:58:01 [INFO] Query running on 0.0.0.0:19142\n2016-01-20 19:58:01 [INFO] Default game type: SURVIVAL\n2016-01-20 19:58:01 [INFO] Done (0.63s)! For help, type \"help\" or \"?\"\n2016-01-20 19:58:05 [INFO] CONSOLE: Stopping the server...\n2016-01-20 19:58:05 [INFO] Disabling DevTools v1.10.0\n2016-01-20 19:58:05 [INFO] Unloading level \"world\"\n2016-01-20 19:58:05 [INFO] Stopping other threads\n2016-01-20 19:58:07 [INFO] Starting Minecraft: PE server version v0.10.5 alpha\n2016-01-20 19:58:07 [INFO] Loading pocketmine.yml...\n2016-01-20 19:58:07 [INFO] Loading server properties...\n2016-01-20 19:58:07 [INFO] Starting Minecraft PE server on 0.0.0.0:19142\n2016-01-20 19:58:08 [INFO] This server is running PocketMine-MP version 1.4.1-980 \"\u7d76\u597d(Zekkou)\u30b1\u30fc\u30ad(Cake)\" (API 1.11.0)\n2016-01-20 19:58:08 [INFO] PocketMine-MP is distributed under the LGPL License\n2016-01-20 19:58:08 [INFO] Loading DevTools v1.10.0\n2016-01-20 19:58:08 [INFO] Enabling DevTools v1.10.0\n2016-01-20 19:58:08 [INFO] Loading source plugin Glifcos-p v1.0.0\n2016-01-20 19:58:08 [INFO] [DevTools] Registered folder plugin loader\n2016-01-20 19:58:08 [INFO] Preparing level \"world\"\n2016-01-20 19:58:08 [INFO] Enabling Glifcos-p v1.0.0\n2016-01-20 19:58:08 [WARNING] RuntimeException: \"file_get_contents(): Unable to find the wrapper \"https\" - did you forget to enable it when you configured PHP?\" (E_WARNING) in \"\/glifcos-plugin\/src\/glifcos\/glifcos\" at line 60\n2016-01-20 19:58:08 [INFO] Disabling Glifcos-p v1.0.0\n2016-01-20 19:58:08 [INFO] Starting GS4 status listener\n2016-01-20 19:58:08 [INFO] Setting query port to 19142\n2016-01-20 19:58:08 [INFO] Query running on 0.0.0.0:19142\n2016-01-20 19:58:08 [INFO] Default game type: SURVIVAL\n2016-01-20 19:58:08 [INFO] Done (0.728s)! For help, type \"help\" or \"?\"\n2016-01-20 19:58:10 [INFO] CONSOLE: Stopping the server...\n2016-01-20 19:58:10 [INFO] Disabling DevTools v1.10.0\n2016-01-20 19:58:10 [INFO] Unloading level \"world\"\n2016-01-20 19:58:10 [INFO] Stopping other threads\n2016-01-20 19:58:24 [INFO] Starting Minecraft: PE server version v0.10.5 alpha\n2016-01-20 19:58:24 [INFO] Loading pocketmine.yml...\n2016-01-20 19:58:24 [INFO] Loading server properties...\n2016-01-20 19:58:24 [INFO] Starting Minecraft PE server on 0.0.0.0:19142\n2016-01-20 19:58:24 [INFO] This server is running PocketMine-MP version 1.4.1-980 \"\u7d76\u597d(Zekkou)\u30b1\u30fc\u30ad(Cake)\" (API 1.11.0)\n2016-01-20 19:58:24 [INFO] PocketMine-MP is distributed under the LGPL License\n2016-01-20 19:58:24 [INFO] Loading DevTools v1.10.0\n2016-01-20 19:58:24 [INFO] Enabling DevTools v1.10.0\n2016-01-20 19:58:24 [INFO] Loading source plugin Glifcos-p v1.0.0\n2016-01-20 19:58:24 [INFO] [DevTools] Registered folder plugin loader\n2016-01-20 19:58:25 [INFO] Preparing level \"world\"\n2016-01-20 19:58:25 [INFO] Enabling Glifcos-p v1.0.0\n2016-01-20 19:58:25 [WARNING] RuntimeException: \"fopen(glifcos-hotfireydeath.c9users.io\/glifcos-webserver\/connection.php?type=ping): failed to open stream: No such file or directory\" (E_WARNING) in \"\/glifcos-plugin\/src\/glifcos\/glifcos\" at line 45\n2016-01-20 19:58:25 [INFO] Disabling Glifcos-p v1.0.0\n2016-01-20 19:58:25 [INFO] Starting GS4 status listener\n2016-01-20 19:58:25 [INFO] Setting query port to 19142\n2016-01-20 19:58:25 [INFO] Query running on 0.0.0.0:19142\n2016-01-20 19:58:25 [INFO] Default game type: SURVIVAL\n2016-01-20 19:58:25 [INFO] Done (0.343s)! For help, type \"help\" or \"?\"\n2016-01-20 19:58:28 [INFO] CONSOLE: Stopping the server...\n2016-01-20 19:58:28 [INFO] Disabling DevTools v1.10.0\n2016-01-20 19:58:28 [INFO] Unloading level \"world\"\n2016-01-20 19:58:28 [INFO] Stopping other threads\n2016-01-20 19:58:38 [INFO] Starting Minecraft: PE server version v0.10.5 alpha\n2016-01-20 19:58:38 [INFO] Loading pocketmine.yml...\n2016-01-20 19:58:38 [INFO] Loading server properties...\n2016-01-20 19:58:38 [INFO] Starting Minecraft PE server on 0.0.0.0:19142\n2016-01-20 19:58:38 [INFO] This server is running PocketMine-MP version 1.4.1-980 \"\u7d76\u597d(Zekkou)\u30b1\u30fc\u30ad(Cake)\" (API 1.11.0)\n2016-01-20 19:58:38 [INFO] PocketMine-MP is distributed under the LGPL License\n2016-01-20 19:58:38 [INFO] Loading DevTools v1.10.0\n2016-01-20 19:58:38 [INFO] Enabling DevTools v1.10.0\n2016-01-20 19:58:38 [INFO] Loading source plugin Glifcos-p v1.0.0\n2016-01-20 19:58:38 [INFO] [DevTools] Registered folder plugin loader\n2016-01-20 19:58:38 [INFO] Preparing level \"world\"\n2016-01-20 19:58:38 [INFO] Enabling Glifcos-p v1.0.0\n2016-01-20 19:58:39 [WARNING] RuntimeException: \"file_get_contents(): Unable to find the wrapper \"https\" - did you forget to enable it when you configured PHP?\" (E_WARNING) in \"\/glifcos-plugin\/src\/glifcos\/glifcos\" at line 60\n2016-01-20 19:58:39 [INFO] Disabling Glifcos-p v1.0.0\n2016-01-20 19:58:39 [INFO] Starting GS4 status listener\n2016-01-20 19:58:39 [INFO] Setting query port to 19142\n2016-01-20 19:58:39 [INFO] Query running on 0.0.0.0:19142\n2016-01-20 19:58:39 [INFO] Default game type: SURVIVAL\n2016-01-20 19:58:39 [INFO] Done (0.725s)! For help, type \"help\" or \"?\"\n2016-01-20 19:58:42 [INFO] CONSOLE: Stopping the server...\n2016-01-20 19:58:42 [INFO] Disabling DevTools v1.10.0\n2016-01-20 19:58:42 [INFO] Unloading level \"world\"\n2016-01-20 19:58:42 [INFO] Stopping other threads\n2016-01-20 19:58:49 [INFO] Starting Minecraft: PE server version v0.10.5 alpha\n2016-01-20 19:58:49 [INFO] Loading pocketmine.yml...\n2016-01-20 19:58:49 [INFO] Loading server properties...\n2016-01-20 19:58:49 [INFO] Starting Minecraft PE server on 0.0.0.0:19142\n2016-01-20 19:58:49 [INFO] This server is running PocketMine-MP version 1.4.1-980 \"\u7d76\u597d(Zekkou)\u30b1\u30fc\u30ad(Cake)\" (API 1.11.0)\n2016-01-20 19:58:49 [INFO] PocketMine-MP is distributed under the LGPL License\n2016-01-20 19:58:49 [INFO] Loading DevTools v1.10.0\n2016-01-20 19:58:49 [INFO] Enabling DevTools v1.10.0\n2016-01-20 19:58:49 [INFO] Loading source plugin Glifcos-p v1.0.0\n2016-01-20 19:58:49 [INFO] [DevTools] Registered folder plugin loader\n2016-01-20 19:58:49 [INFO] Preparing level \"world\"\n2016-01-20 19:58:49 [INFO] Enabling Glifcos-p v1.0.0\n2016-01-20 19:58:49 [WARNING] RuntimeException: \"fopen(): Unable to find the wrapper \"https\" - did you forget to enable it when you configured PHP?\" (E_WARNING) in \"\/glifcos-plugin\/src\/glifcos\/glifcos\" at line 45\n2016-01-20 19:58:49 [INFO] Disabling Glifcos-p v1.0.0\n2016-01-20 19:58:49 [INFO] Starting GS4 status listener\n2016-01-20 19:58:49 [INFO] Setting query port to 19142\n2016-01-20 19:58:49 [INFO] Query running on 0.0.0.0:19142\n2016-01-20 19:58:49 [INFO] Default game type: SURVIVAL\n2016-01-20 19:58:49 [INFO] Done (0.423s)! For help, type \"help\" or \"?\"\n2016-01-20 19:58:57 [INFO] CONSOLE: Stopping the server...\n2016-01-20 19:58:57 [INFO] Disabling DevTools v1.10.0\n2016-01-20 19:58:57 [INFO] Unloading level \"world\"\n2016-01-20 19:58:57 [INFO] Stopping other threads\n2016-01-20 19:59:11 [INFO] Starting Minecraft: PE server version v0.10.5 alpha\n2016-01-20 19:59:11 [INFO] Loading pocketmine.yml...\n2016-01-20 19:59:11 [INFO] Loading server properties...\n2016-01-20 19:59:11 [INFO] Starting Minecraft PE server on 0.0.0.0:19142\n2016-01-20 19:59:11 [INFO] This server is running PocketMine-MP version 1.4.1-980 \"\u7d76\u597d(Zekkou)\u30b1\u30fc\u30ad(Cake)\" (API 1.11.0)\n2016-01-20 19:59:11 [INFO] PocketMine-MP is distributed under the LGPL License\n2016-01-20 19:59:11 [INFO] Loading DevTools v1.10.0\n2016-01-20 19:59:12 [INFO] Enabling DevTools v1.10.0\n2016-01-20 19:59:12 [INFO] Loading source plugin Glifcos-p v1.0.0\n2016-01-20 19:59:12 [INFO] [DevTools] Registered folder plugin loader\n2016-01-20 19:59:12 [INFO] Preparing level \"world\"\n2016-01-20 19:59:12 [INFO] Enabling Glifcos-p v1.0.0\n2016-01-20 19:59:12 [WARNING] RuntimeException: \"fopen(): Unable to find the wrapper \"https\" - did you forget to enable it when you configured PHP?\" (E_WARNING) in \"\/glifcos-plugin\/src\/glifcos\/glifcos\" at line 45\n2016-01-20 19:59:12 [INFO] Disabling Glifcos-p v1.0.0\n2016-01-20 19:59:12 [INFO] Starting GS4 status listener\n2016-01-20 19:59:12 [INFO] Setting query port to 19142\n2016-01-20 19:59:12 [INFO] Query running on 0.0.0.0:19142\n2016-01-20 19:59:12 [INFO] Default game type: SURVIVAL\n2016-01-20 19:59:12 [INFO] Done (0.626s)! For help, type \"help\" or \"?\"\n2016-01-20 19:59:45 [INFO] CONSOLE: Stopping the server...\n2016-01-20 19:59:45 [INFO] Disabling DevTools v1.10.0\n2016-01-20 19:59:45 [INFO] Unloading level \"world\"\n2016-01-20 19:59:45 [INFO] Stopping other threads\n2016-01-20 19:59:52 [INFO] Starting Minecraft: PE server version v0.10.5 alpha\n2016-01-20 19:59:52 [INFO] Loading pocketmine.yml...\n2016-01-20 19:59:52 [INFO] Loading server properties...\n2016-01-20 19:59:52 [INFO] Starting Minecraft PE server on 0.0.0.0:19142\n2016-01-20 19:59:52 [INFO] This server is running PocketMine-MP version 1.4.1-980 \"\u7d76\u597d(Zekkou)\u30b1\u30fc\u30ad(Cake)\" (API 1.11.0)\n2016-01-20 19:59:52 [INFO] PocketMine-MP is distributed under the LGPL License\n2016-01-20 19:59:52 [INFO] Loading DevTools v1.10.0\n2016-01-20 19:59:52 [INFO] Enabling DevTools v1.10.0\n2016-01-20 19:59:52 [INFO] Loading source plugin Glifcos-p v1.0.0\n2016-01-20 19:59:52 [INFO] [DevTools] Registered folder plugin loader\n2016-01-20 19:59:52 [INFO] Preparing level \"world\"\n2016-01-20 19:59:52 [INFO] Enabling Glifcos-p v1.0.0\n2016-01-20 19:59:52 [WARNING] RuntimeException: \"fopen(): Unable to find the wrapper \"https\" - did you forget to enable it when you configured PHP?\" (E_WARNING) in \"\/glifcos-plugin\/src\/glifcos\/glifcos\" at line 45\n2016-01-20 19:59:52 [INFO] Disabling Glifcos-p v1.0.0\n2016-01-20 19:59:52 [INFO] Starting GS4 status listener\n2016-01-20 19:59:52 [INFO] Setting query port to 19142\n2016-01-20 19:59:52 [INFO] Query running on 0.0.0.0:19142\n2016-01-20 19:59:52 [INFO] Default game type: SURVIVAL\n2016-01-20 19:59:52 [INFO] Done (0.541s)! For help, type \"help\" or \"?\"\n2016-01-20 19:59:53 [INFO] CONSOLE: Stopping the server...\n2016-01-20 19:59:53 [INFO] Disabling DevTools v1.10.0\n2016-01-20 19:59:53 [INFO] Unloading level \"world\"\n2016-01-20 19:59:53 [INFO] Stopping other threads\n2016-01-20 20:01:21 [INFO] Starting Minecraft: PE server version v0.10.5 alpha\n2016-01-20 20:01:21 [INFO] Loading pocketmine.yml...\n2016-01-20 20:01:21 [INFO] Loading server properties...\n2016-01-20 20:01:21 [INFO] Starting Minecraft PE server on 0.0.0.0:19142\n2016-01-20 20:01:21 [INFO] This server is running PocketMine-MP version 1.4.1-980 \"\u7d76\u597d(Zekkou)\u30b1\u30fc\u30ad(Cake)\" (API 1.11.0)\n2016-01-20 20:01:21 [INFO] PocketMine-MP is distributed under the LGPL License\n2016-01-20 20:01:21 [INFO] Loading DevTools v1.10.0\n2016-01-20 20:01:21 [INFO] Enabling DevTools v1.10.0\n2016-01-20 20:01:21 [INFO] Loading source plugin Glifcos-p v1.0.0\n2016-01-20 20:01:21 [INFO] [DevTools] Registered folder plugin loader\n2016-01-20 20:01:21 [INFO] Preparing level \"world\"\n2016-01-20 20:01:21 [INFO] Enabling Glifcos-p v1.0.0\n2016-01-20 20:01:21 [WARNING] RuntimeException: \"fopen(): Unable to find the wrapper \"https\" - did you forget to enable it when you configured PHP?\" (E_WARNING) in \"\/glifcos-plugin\/src\/glifcos\/glifcos\" at line 45\n2016-01-20 20:01:21 [INFO] Disabling Glifcos-p v1.0.0\n2016-01-20 20:01:21 [INFO] Starting GS4 status listener\n2016-01-20 20:01:21 [INFO] Setting query port to 19142\n2016-01-20 20:01:21 [INFO] Query running on 0.0.0.0:19142\n2016-01-20 20:01:21 [INFO] Default game type: SURVIVAL\n2016-01-20 20:01:21 [INFO] Done (0.396s)! For help, type \"help\" or \"?\"\n2016-01-20 20:01:23 [INFO] CONSOLE: Stopping the server...\n2016-01-20 20:01:23 [INFO] Disabling DevTools v1.10.0\n2016-01-20 20:01:23 [INFO] Unloading level \"world\"\n2016-01-20 20:01:23 [INFO] Stopping other threads\n2016-01-20 20:01:28 [INFO] Starting Minecraft: PE server version v0.10.5 alpha\n2016-01-20 20:01:28 [INFO] Loading pocketmine.yml...\n2016-01-20 20:01:28 [INFO] Loading server properties...\n2016-01-20 20:01:28 [INFO] Starting Minecraft PE server on 0.0.0.0:19142\n2016-01-20 20:01:29 [INFO] This server is running PocketMine-MP version 1.4.1-980 \"\u7d76\u597d(Zekkou)\u30b1\u30fc\u30ad(Cake)\" (API 1.11.0)\n2016-01-20 20:01:29 [INFO] PocketMine-MP is distributed under the LGPL License\n2016-01-20 20:01:29 [INFO] Loading DevTools v1.10.0\n2016-01-20 20:01:29 [INFO] Enabling DevTools v1.10.0\n2016-01-20 20:01:29 [INFO] Loading source plugin Glifcos-p v1.0.0\n2016-01-20 20:01:29 [INFO] [DevTools] Registered folder plugin loader\n2016-01-20 20:01:29 [INFO] Preparing level \"world\"\n2016-01-20 20:01:29 [INFO] Enabling Glifcos-p v1.0.0\n2016-01-20 20:01:29 [WARNING] RuntimeException: \"fopen(): Unable to find the wrapper \"https\" - did you forget to enable it when you configured PHP?\" (E_WARNING) in \"\/glifcos-plugin\/src\/glifcos\/glifcos\" at line 45\n2016-01-20 20:01:29 [INFO] Disabling Glifcos-p v1.0.0\n2016-01-20 20:01:29 [INFO] Starting GS4 status listener\n2016-01-20 20:01:29 [INFO] Setting query port to 19142\n2016-01-20 20:01:29 [INFO] Query running on 0.0.0.0:19142\n2016-01-20 20:01:29 [INFO] Default game type: SURVIVAL\n2016-01-20 20:01:29 [INFO] Done (0.427s)! For help, type \"help\" or \"?\"\n2016-01-20 20:01:30 [INFO] CONSOLE: Stopping the server...\n2016-01-20 20:01:30 [INFO] Disabling DevTools v1.10.0\n2016-01-20 20:01:30 [INFO] Unloading level \"world\"\n2016-01-20 20:01:30 [INFO] Stopping other threads\n2016-01-21 03:17:44 [INFO] Starting Minecraft: PE server version v0.10.5 alpha\n2016-01-21 03:17:44 [INFO] Loading pocketmine.yml...\n2016-01-21 03:17:44 [INFO] Loading server properties...\n2016-01-21 03:17:44 [INFO] Starting Minecraft PE server on 0.0.0.0:19142\n2016-01-21 03:17:44 [INFO] This server is running PocketMine-MP version 1.4.1-980 \"\u7d76\u597d(Zekkou)\u30b1\u30fc\u30ad(Cake)\" (API 1.11.0)\n2016-01-21 03:17:44 [INFO] PocketMine-MP is distributed under the LGPL License\n2016-01-21 03:17:44 [INFO] Loading DevTools v1.10.0\n2016-01-21 03:17:44 [INFO] Enabling DevTools v1.10.0\n2016-01-21 03:17:44 [INFO] Loading source plugin Glifcos-p v1.0.0\n2016-01-21 03:17:44 [INFO] [DevTools] Registered folder plugin loader\n2016-01-21 03:17:44 [INFO] Preparing level \"world\"\n2016-01-21 03:17:44 [INFO] Enabling Glifcos-p v1.0.0\n2016-01-21 03:17:44 [WARNING] RuntimeException: \"fopen(): Unable to find the wrapper \"https\" - did you forget to enable it when you configured PHP?\" (E_WARNING) in \"\/glifcos-plugin\/src\/glifcos\/glifcos\" at line 45\n2016-01-21 03:17:44 [INFO] Disabling Glifcos-p v1.0.0\n2016-01-21 03:17:44 [INFO] Starting GS4 status listener\n2016-01-21 03:17:44 [INFO] Setting query port to 19142\n2016-01-21 03:17:44 [INFO] Query running on 0.0.0.0:19142\n2016-01-21 03:17:44 [INFO] Default game type: SURVIVAL\n2016-01-21 03:17:44 [INFO] Done (0.874s)! For help, type \"help\" or \"?\"\n2016-01-21 03:17:47 [INFO] CONSOLE: Stopping the server...\n2016-01-21 03:17:47 [INFO] Disabling DevTools v1.10.0\n2016-01-21 03:17:47 [INFO] Unloading level \"world\"\n2016-01-21 03:17:47 [INFO] Stopping other threads\n2016-01-21 03:18:21 [INFO] Starting Minecraft: PE server version v0.10.5 alpha\n2016-01-21 03:18:21 [INFO] Loading pocketmine.yml...\n2016-01-21 03:18:21 [INFO] Loading server properties...\n2016-01-21 03:18:21 [INFO] Starting Minecraft PE server on 0.0.0.0:19142\n2016-01-21 03:18:21 [INFO] This server is running PocketMine-MP version 1.4.1-980 \"\u7d76\u597d(Zekkou)\u30b1\u30fc\u30ad(Cake)\" (API 1.11.0)\n2016-01-21 03:18:21 [INFO] PocketMine-MP is distributed under the LGPL License\n2016-01-21 03:18:22 [INFO] Loading DevTools v1.10.0\n2016-01-21 03:18:22 [INFO] Enabling DevTools v1.10.0\n2016-01-21 03:18:22 [INFO] Loading source plugin Glifcos-p v1.0.0\n2016-01-21 03:18:22 [INFO] [DevTools] Registered folder plugin loader\n2016-01-21 03:18:22 [INFO] Preparing level \"world\"\n2016-01-21 03:18:22 [INFO] Enabling Glifcos-p v1.0.0\n2016-01-21 03:18:22 [WARNING] RuntimeException: \"fopen(): Unable to find the wrapper \"https\" - did you forget to enable it when you configured PHP?\" (E_WARNING) in \"\/glifcos-plugin\/src\/glifcos\/glifcos\" at line 45\n2016-01-21 03:18:22 [INFO] Disabling Glifcos-p v1.0.0\n2016-01-21 03:18:22 [INFO] Starting GS4 status listener\n2016-01-21 03:18:22 [INFO] Setting query port to 19142\n2016-01-21 03:18:22 [INFO] Query running on 0.0.0.0:19142\n2016-01-21 03:18:22 [INFO] Default game type: SURVIVAL\n2016-01-21 03:18:22 [INFO] Done (0.942s)! For help, type \"help\" or \"?\"\n2016-01-21 03:18:25 [INFO] CONSOLE: Stopping the server...\n2016-01-21 03:18:25 [INFO] Disabling DevTools v1.10.0\n2016-01-21 03:18:25 [INFO] Unloading level \"world\"\n2016-01-21 03:18:25 [INFO] Stopping other threads\n2016-01-21 03:23:59 [INFO] Starting Minecraft: PE server version v0.10.5 alpha\n2016-01-21 03:23:59 [INFO] Loading pocketmine.yml...\n2016-01-21 03:23:59 [INFO] Loading server properties...\n2016-01-21 03:23:59 [INFO] Starting Minecraft PE server on 0.0.0.0:19142\n2016-01-21 03:23:59 [INFO] This server is running PocketMine-MP version 1.4.1-980 \"\u7d76\u597d(Zekkou)\u30b1\u30fc\u30ad(Cake)\" (API 1.11.0)\n2016-01-21 03:23:59 [INFO] PocketMine-MP is distributed under the LGPL License\n2016-01-21 03:24:00 [INFO] Loading DevTools v1.10.0\n2016-01-21 03:24:00 [INFO] Enabling DevTools v1.10.0\n2016-01-21 03:24:00 [ERROR] Could not load plugin 'Glifcos-p': API version not compatible\n2016-01-21 03:24:00 [INFO] [DevTools] Registered folder plugin loader\n2016-01-21 03:24:00 [INFO] Preparing level \"world\"\n2016-01-21 03:24:00 [INFO] Starting GS4 status listener\n2016-01-21 03:24:00 [INFO] Setting query port to 19142\n2016-01-21 03:24:00 [INFO] Query running on 0.0.0.0:19142\n2016-01-21 03:24:00 [INFO] Default game type: SURVIVAL\n2016-01-21 03:24:00 [INFO] Done (0.587s)! For help, type \"help\" or \"?\"\n2016-01-21 03:24:04 [INFO] CONSOLE: Stopping the server...\n2016-01-21 03:24:04 [INFO] Disabling DevTools v1.10.0\n2016-01-21 03:24:04 [INFO] Unloading level \"world\"\n2016-01-21 03:24:04 [INFO] Stopping other threads\n2016-01-21 03:24:31 [INFO] Starting Minecraft: PE server version v0.10.5 alpha\n2016-01-21 03:24:31 [INFO] Loading pocketmine.yml...\n2016-01-21 03:24:31 [INFO] Loading server properties...\n2016-01-21 03:24:31 [INFO] Starting Minecraft PE server on 0.0.0.0:19142\n2016-01-21 03:24:31 [INFO] This server is running PocketMine-MP version 1.4.1-980 \"\u7d76\u597d(Zekkou)\u30b1\u30fc\u30ad(Cake)\" (API 1.11.0)\n2016-01-21 03:24:31 [INFO] PocketMine-MP is distributed under the LGPL License\n2016-01-21 03:24:31 [INFO] Loading DevTools v1.10.0\n2016-01-21 03:24:31 [INFO] Enabling DevTools v1.10.0\n2016-01-21 03:24:31 [INFO] Loading source plugin Glifcos-p v1.0.0\n2016-01-21 03:24:31 [INFO] [DevTools] Registered folder plugin loader\n2016-01-21 03:24:31 [INFO] Preparing level \"world\"\n2016-01-21 03:24:31 [INFO] Enabling Glifcos-p v1.0.0\n2016-01-21 03:24:31 [WARNING] RuntimeException: \"fopen(): Unable to find the wrapper \"https\" - did you forget to enable it when you configured PHP?\" (E_WARNING) in \"\/glifcos-plugin.1\/src\/glifcos\/glifcos\" at line 48\n2016-01-21 03:24:31 [INFO] Disabling Glifcos-p v1.0.0\n2016-01-21 03:24:31 [INFO] Starting GS4 status listener\n2016-01-21 03:24:31 [INFO] Setting query port to 19142\n2016-01-21 03:24:31 [INFO] Query running on 0.0.0.0:19142\n2016-01-21 03:24:31 [INFO] Default game type: SURVIVAL\n2016-01-21 03:24:31 [INFO] Done (0.47s)! For help, type \"help\" or \"?\"\n2016-01-21 03:24:37 [INFO] CONSOLE: Stopping the server...\n2016-01-21 03:24:37 [INFO] Disabling DevTools v1.10.0\n2016-01-21 03:24:37 [INFO] Unloading level \"world\"\n2016-01-21 03:24:37 [INFO] Stopping other threads\n2016-01-21 03:30:40 [INFO] Starting Minecraft: PE server version v0.10.5 alpha\n2016-01-21 03:30:40 [INFO] Loading pocketmine.yml...\n2016-01-21 03:30:40 [INFO] Loading server properties...\n2016-01-21 03:30:40 [INFO] Starting Minecraft PE server on 0.0.0.0:19142\n2016-01-21 03:30:40 [INFO] This server is running PocketMine-MP version 1.4.1-980 \"\u7d76\u597d(Zekkou)\u30b1\u30fc\u30ad(Cake)\" (API 1.11.0)\n2016-01-21 03:30:40 [INFO] PocketMine-MP is distributed under the LGPL License\n2016-01-21 03:30:41 [INFO] Loading DevTools v1.10.0\n2016-01-21 13:38:18 [INFO] Starting Minecraft: PE server version v0.10.5 alpha\n2016-01-21 13:38:18 [INFO] Loading pocketmine.yml...\n2016-01-21 13:38:18 [INFO] Loading server properties...\n2016-01-21 13:38:18 [INFO] Starting Minecraft PE server on 0.0.0.0:19142\n2016-01-21 13:38:18 [INFO] This server is running PocketMine-MP version 1.4.1-980 \"\u7d76\u597d(Zekkou)\u30b1\u30fc\u30ad(Cake)\" (API 1.11.0)\n2016-01-21 13:38:18 [INFO] PocketMine-MP is distributed under the LGPL License\n2016-01-21 13:38:18 [INFO] Loading DevTools v1.10.0\n2016-01-21 13:38:18 [INFO] Enabling DevTools v1.10.0\n2016-01-21 13:38:18 [INFO] Loading source plugin Glifcos-p v1.0.0\n2016-01-21 13:38:18 [INFO] [DevTools] Registered folder plugin loader\n2016-01-21 13:39:11 [INFO] Starting Minecraft: PE server version v0.10.5 alpha\n2016-01-21 13:39:11 [INFO] Loading pocketmine.yml...\n2016-01-21 13:39:11 [INFO] Loading server properties...\n2016-01-21 13:39:11 [INFO] Starting Minecraft PE server on 0.0.0.0:19142\n2016-01-21 13:39:11 [INFO] This server is running PocketMine-MP version 1.4.1-980 \"\u7d76\u597d(Zekkou)\u30b1\u30fc\u30ad(Cake)\" (API 1.11.0)\n2016-01-21 13:39:11 [INFO] PocketMine-MP is distributed under the LGPL License\n2016-01-21 13:39:11 [INFO] Loading DevTools v1.10.0\n2016-01-21 13:39:12 [INFO] Enabling DevTools v1.10.0\n2016-01-21 13:39:12 [INFO] Loading source plugin Glifcos-p v1.0.0\n2016-01-21 13:39:12 [INFO] [DevTools] Registered folder plugin loader\n2016-01-21 13:39:12 [INFO] Preparing level \"world\"\n2016-01-21 13:39:12 [INFO] Enabling Glifcos-p v1.0.0\n2016-01-21 13:39:12 [WARNING] RuntimeException: \"fopen(): Unable to find the wrapper \"https\" - did you forget to enable it when you configured PHP?\" (E_WARNING) in \"\/glifcos-plugin.1\/src\/glifcos\/glifcos\" at line 45\n2016-01-21 13:39:12 [INFO] Disabling Glifcos-p v1.0.0\n2016-01-21 13:39:12 [INFO] Starting GS4 status listener\n2016-01-21 13:39:12 [INFO] Setting query port to 19142\n2016-01-21 13:39:12 [INFO] Query running on 0.0.0.0:19142\n2016-01-21 13:39:12 [INFO] Default game type: SURVIVAL\n2016-01-21 13:39:12 [INFO] Done (0.491s)! For help, type \"help\" or \"?\"\n2016-01-21 13:39:14 [INFO] CONSOLE: Stopping the server...\n2016-01-21 13:39:14 [INFO] Disabling DevTools v1.10.0\n2016-01-21 13:39:14 [INFO] Unloading level \"world\"\n2016-01-21 13:39:14 [INFO] Stopping other threads\n2016-01-21 13:40:42 [INFO] Starting Minecraft: PE server version v0.10.5 alpha\n2016-01-21 13:40:42 [INFO] Loading pocketmine.yml...\n2016-01-21 13:40:42 [INFO] Loading server properties...\n2016-01-21 13:40:42 [INFO] Starting Minecraft PE server on 0.0.0.0:19142\n2016-01-21 13:40:42 [INFO] This server is running PocketMine-MP version 1.4.1-980 \"\u7d76\u597d(Zekkou)\u30b1\u30fc\u30ad(Cake)\" (API 1.11.0)\n2016-01-21 13:40:42 [INFO] PocketMine-MP is distributed under the LGPL License\n2016-01-21 13:40:42 [INFO] Loading DevTools v1.10.0\n2016-01-21 13:40:42 [INFO] Enabling DevTools v1.10.0\n2016-01-21 13:40:42 [INFO] Loading source plugin Glifcos-p v1.0.0\n2016-01-21 13:40:42 [INFO] [DevTools] Registered folder plugin loader\n2016-01-21 13:40:42 [INFO] Preparing level \"world\"\n2016-01-21 13:40:42 [INFO] Enabling Glifcos-p v1.0.0\n2016-01-21 13:40:42 [WARNING] RuntimeException: \"fopen(): Unable to find the wrapper \"https\" - did you forget to enable it when you configured PHP?\" (E_WARNING) in \"\/glifcos-plugin.1\/src\/glifcos\/glifcos\" at line 46\n2016-01-21 13:40:42 [INFO] Disabling Glifcos-p v1.0.0\n2016-01-21 13:40:42 [INFO] Starting GS4 status listener\n2016-01-21 13:40:42 [INFO] Setting query port to 19142\n2016-01-21 13:40:42 [INFO] Query running on 0.0.0.0:19142\n2016-01-21 13:40:42 [INFO] Default game type: SURVIVAL\n2016-01-21 13:40:42 [INFO] Done (0.499s)! For help, type \"help\" or \"?\"\n2016-01-21 13:40:46 [INFO] CONSOLE: Stopping the server...\n2016-01-21 13:40:46 [INFO] Disabling DevTools v1.10.0\n2016-01-21 13:40:46 [INFO] Unloading level \"world\"\n2016-01-21 13:40:46 [INFO] Stopping other threads\n2016-01-21 13:41:22 [INFO] Starting Minecraft: PE server version v0.10.5 alpha\n2016-01-21 13:41:22 [INFO] Loading pocketmine.yml...\n2016-01-21 13:41:22 [INFO] Loading server properties...\n2016-01-21 13:41:22 [INFO] Starting Minecraft PE server on 0.0.0.0:19142\n2016-01-21 13:41:22 [INFO] This server is running PocketMine-MP version 1.4.1-980 \"\u7d76\u597d(Zekkou)\u30b1\u30fc\u30ad(Cake)\" (API 1.11.0)\n2016-01-21 13:41:22 [INFO] PocketMine-MP is distributed under the LGPL License\n2016-01-21 13:41:23 [INFO] Loading DevTools v1.10.0\n2016-01-21 13:41:23 [INFO] Enabling DevTools v1.10.0\n2016-01-21 13:41:23 [INFO] Loading source plugin Glifcos-p v1.0.0\n2016-01-21 13:41:23 [INFO] [DevTools] Registered folder plugin loader\n2016-01-21 13:41:23 [INFO] Preparing level \"world\"\n2016-01-21 13:41:23 [INFO] Enabling Glifcos-p v1.0.0\n2016-01-21 13:41:23 [WARNING] RuntimeException: \"file_get_contents(): Unable to find the wrapper \"https\" - did you forget to enable it when you configured PHP?\" (E_WARNING) in \"\/glifcos-plugin.1\/src\/glifcos\/glifcos\" at line 61\n2016-01-21 13:41:23 [INFO] Disabling Glifcos-p v1.0.0\n2016-01-21 13:41:23 [INFO] Starting GS4 status listener\n2016-01-21 13:41:23 [INFO] Setting query port to 19142\n2016-01-21 13:41:23 [INFO] Query running on 0.0.0.0:19142\n2016-01-21 13:41:23 [INFO] Default game type: SURVIVAL\n2016-01-21 13:41:23 [INFO] Done (0.835s)! For help, type \"help\" or \"?\"\n2016-01-21 13:41:30 [INFO] CONSOLE: Stopping the server...\n2016-01-21 13:41:30 [INFO] Disabling DevTools v1.10.0\n2016-01-21 13:41:30 [INFO] Unloading level \"world\"\n2016-01-21 13:41:30 [INFO] Stopping other threads\n2016-01-21 13:41:47 [INFO] Starting Minecraft: PE server version v0.10.5 alpha\n2016-01-21 13:41:47 [INFO] Loading pocketmine.yml...\n2016-01-21 13:41:47 [INFO] Loading server properties...\n2016-01-21 13:41:47 [INFO] Starting Minecraft PE server on 0.0.0.0:19142\n2016-01-21 13:41:47 [INFO] This server is running PocketMine-MP version 1.4.1-980 \"\u7d76\u597d(Zekkou)\u30b1\u30fc\u30ad(Cake)\" (API 1.11.0)\n2016-01-21 13:41:47 [INFO] PocketMine-MP is distributed under the LGPL License\n2016-01-21 13:41:48 [INFO] Loading DevTools v1.10.0\n2016-01-21 13:41:48 [INFO] Enabling DevTools v1.10.0\n2016-01-21 13:41:48 [INFO] Loading source plugin Glifcos-p v1.0.0\n2016-01-21 13:41:48 [INFO] [DevTools] Registered folder plugin loader\n2016-01-21 13:41:48 [INFO] Preparing level \"world\"\n2016-01-21 13:41:48 [INFO] Enabling Glifcos-p v1.0.0\n2016-01-21 13:41:48 [INFO] [Glifcos-p] Datasync sent to webserver.\n2016-01-21 13:41:48 [INFO] Starting GS4 status listener\n2016-01-21 13:41:48 [INFO] Setting query port to 19142\n2016-01-21 13:41:48 [INFO] Query running on 0.0.0.0:19142\n2016-01-21 13:41:48 [INFO] Default game type: SURVIVAL\n2016-01-21 13:41:48 [INFO] Done (0.86s)! For help, type \"help\" or \"?\"\n2016-01-21 13:42:27 [INFO] CONSOLE: Stopping the server...\n2016-01-21 13:42:27 [INFO] Disabling DevTools v1.10.0\n2016-01-21 13:42:27 [INFO] Disabling Glifcos-p v1.0.0\n2016-01-21 13:42:27 [INFO] Unloading level \"world\"\n2016-01-21 13:42:27 [INFO] Stopping other threads\n2016-01-21 13:42:29 [INFO] Starting Minecraft: PE server version v0.10.5 alpha\n2016-01-21 13:42:29 [INFO] Loading pocketmine.yml...\n2016-01-21 13:42:29 [INFO] Loading server properties...\n2016-01-21 13:42:29 [INFO] Starting Minecraft PE server on 0.0.0.0:19142\n2016-01-21 13:42:29 [INFO] This server is running PocketMine-MP version 1.4.1-980 \"\u7d76\u597d(Zekkou)\u30b1\u30fc\u30ad(Cake)\" (API 1.11.0)\n2016-01-21 13:42:29 [INFO] PocketMine-MP is distributed under the LGPL License\n2016-01-21 13:42:30 [INFO] Loading DevTools v1.10.0\n2016-01-21 13:42:30 [INFO] Enabling DevTools v1.10.0\n2016-01-21 13:42:30 [INFO] Loading source plugin Glifcos-p v1.0.0\n2016-01-21 13:42:30 [INFO] [DevTools] Registered folder plugin loader\n2016-01-21 13:42:30 [INFO] Preparing level \"world\"\n2016-01-21 13:42:30 [INFO] Enabling Glifcos-p v1.0.0\n2016-01-21 13:42:30 [INFO] [Glifcos-p] Datasync sent to webserver.\n2016-01-21 13:42:30 [INFO] Starting GS4 status listener\n2016-01-21 13:42:30 [INFO] Setting query port to 19142\n2016-01-21 13:42:30 [INFO] Query running on 0.0.0.0:19142\n2016-01-21 13:42:30 [INFO] Default game type: SURVIVAL\n2016-01-21 13:42:30 [INFO] Done (0.943s)! For help, type \"help\" or \"?\"\n2016-01-21 13:42:31 [INFO] CONSOLE: Stopping the server...\n2016-01-21 13:42:32 [INFO] Disabling DevTools v1.10.0\n2016-01-21 13:42:32 [INFO] Disabling Glifcos-p v1.0.0\n2016-01-21 13:42:32 [INFO] Unloading level \"world\"\n2016-01-21 13:42:32 [INFO] Stopping other threads\n2016-01-21 13:43:06 [INFO] Starting Minecraft: PE server version v0.10.5 alpha\n2016-01-21 13:43:06 [INFO] Loading pocketmine.yml...\n2016-01-21 13:43:06 [INFO] Loading server properties...\n2016-01-21 13:43:06 [INFO] Starting Minecraft PE server on 0.0.0.0:19145\n2016-01-21 13:43:06 [INFO] This server is running PocketMine-MP version 1.4.1-980 \"\u7d76\u597d(Zekkou)\u30b1\u30fc\u30ad(Cake)\" (API 1.11.0)\n2016-01-21 13:43:06 [INFO] PocketMine-MP is distributed under the LGPL License\n2016-01-21 13:43:06 [INFO] Loading DevTools v1.10.0\n2016-01-21 13:43:06 [INFO] Enabling DevTools v1.10.0\n2016-01-21 13:43:06 [INFO] Loading source plugin Glifcos-p v1.0.0\n2016-01-21 13:43:06 [INFO] [DevTools] Registered folder plugin loader\n2016-01-21 13:43:06 [INFO] Preparing level \"world\"\n2016-01-21 13:43:06 [INFO] Enabling Glifcos-p v1.0.0\n2016-01-21 13:43:06 [INFO] [Glifcos-p] Datasync sent to webserver.\n2016-01-21 13:43:07 [INFO] Starting GS4 status listener\n2016-01-21 13:43:07 [INFO] Setting query port to 19145\n2016-01-21 13:43:07 [INFO] Query running on 0.0.0.0:19145\n2016-01-21 13:43:07 [INFO] Default game type: SURVIVAL\n2016-01-21 13:43:07 [INFO] Done (29.593s)! For help, type \"help\" or \"?\"\n2016-01-21 13:43:34 [INFO] CONSOLE: Stopping the server...\n2016-01-21 13:43:34 [INFO] Disabling DevTools v1.10.0\n2016-01-21 13:43:34 [INFO] Disabling Glifcos-p v1.0.0\n2016-01-21 13:43:34 [INFO] Unloading level \"world\"\n2016-01-21 13:43:34 [INFO] Stopping other threads\n2016-01-21 14:04:17 [INFO] Starting Minecraft: PE server version v0.10.5 alpha\n2016-01-21 14:04:17 [INFO] Loading pocketmine.yml...\n2016-01-21 14:04:17 [INFO] Loading server properties...\n2016-01-21 14:04:17 [INFO] Starting Minecraft PE server on 0.0.0.0:19145\n2016-01-21 14:04:17 [INFO] This server is running PocketMine-MP version 1.4.1-980 \"\u7d76\u597d(Zekkou)\u30b1\u30fc\u30ad(Cake)\" (API 1.11.0)\n2016-01-21 14:04:17 [INFO] PocketMine-MP is distributed under the LGPL License\n2016-01-21 14:04:17 [INFO] Loading DevTools v1.10.0\n2016-01-21 14:04:17 [INFO] Enabling DevTools v1.10.0\n2016-01-21 14:04:17 [INFO] Loading source plugin Glifcos-p v1.0.0\n2016-01-21 14:04:17 [INFO] [DevTools] Registered folder plugin loader\n2016-01-21 14:04:17 [INFO] Preparing level \"world\"\n2016-01-21 14:04:17 [INFO] Enabling Glifcos-p v1.0.0\n2016-01-21 14:04:18 [INFO] [Glifcos-p] Datasync sent to webserver.\n2016-01-21 14:04:18 [INFO] Starting GS4 status listener\n2016-01-21 14:04:18 [INFO] Setting query port to 19145\n2016-01-21 14:04:18 [INFO] Query running on 0.0.0.0:19145\n2016-01-21 14:04:18 [INFO] Default game type: SURVIVAL\n2016-01-21 14:04:18 [INFO] Done (0.923s)! For help, type \"help\" or \"?\"\n2016-01-21 14:04:44 [INFO] CONSOLE: Stopping the server...\n2016-01-21 14:04:44 [INFO] Disabling DevTools v1.10.0\n2016-01-21 14:04:44 [INFO] Disabling Glifcos-p v1.0.0\n2016-01-21 14:04:44 [INFO] Unloading level \"world\"\n2016-01-21 14:04:44 [INFO] Stopping other threads\n2016-01-23 17:05:59 [INFO] Starting Minecraft: PE server version v0.10.5 alpha\n2016-01-23 17:05:59 [INFO] Loading pocketmine.yml...\n2016-01-23 17:05:59 [INFO] Loading server properties...\n2016-01-23 17:05:59 [INFO] Starting Minecraft PE server on 0.0.0.0:19145\n2016-01-23 17:05:59 [INFO] This server is running PocketMine-MP version 1.4.1-980 \"\u7d76\u597d(Zekkou)\u30b1\u30fc\u30ad(Cake)\" (API 1.11.0)\n2016-01-23 17:05:59 [INFO] PocketMine-MP is distributed under the LGPL License\n2016-01-23 17:05:59 [INFO] Loading DevTools v1.10.0\n2016-01-23 17:05:59 [INFO] Enabling DevTools v1.10.0\n2016-01-23 17:05:59 [INFO] Loading source plugin Glifcos-p v1.0.0\n2016-01-23 17:05:59 [INFO] [DevTools] Registered folder plugin loader\n2016-01-23 17:05:59 [INFO] Preparing level \"world\"\n2016-01-23 17:05:59 [INFO] Enabling Glifcos-p v1.0.0\n2016-01-23 17:05:59 [INFO] [Glifcos-p] Datasync sent to webserver.\n2016-01-23 17:06:00 [INFO] Starting GS4 status listener\n2016-01-23 17:06:00 [INFO] Setting query port to 19145\n2016-01-23 17:06:00 [INFO] Query running on 0.0.0.0:19145\n2016-01-23 17:06:00 [INFO] Default game type: SURVIVAL\n2016-01-23 17:06:00 [INFO] Done (1.017s)! For help, type \"help\" or \"?\"\n2016-01-23 17:06:09 [INFO] CONSOLE: Stopping the server...\n2016-01-23 17:06:09 [INFO] Disabling DevTools v1.10.0\n2016-01-23 17:06:09 [INFO] Disabling Glifcos-p v1.0.0\n2016-01-23 17:06:09 [INFO] Unloading level \"world\"\n2016-01-23 17:06:09 [INFO] Stopping other threads\n2016-01-23 17:10:43 [INFO] Starting Minecraft: PE server version v0.10.5 alpha\n2016-01-23 17:10:43 [INFO] Loading pocketmine.yml...\n2016-01-23 17:10:43 [INFO] Loading server properties...\n2016-01-23 17:10:43 [INFO] Starting Minecraft PE server on 0.0.0.0:19145\n2016-01-23 17:10:43 [INFO] This server is running PocketMine-MP version 1.4.1-980 \"\u7d76\u597d(Zekkou)\u30b1\u30fc\u30ad(Cake)\" (API 1.11.0)\n2016-01-23 17:10:43 [INFO] PocketMine-MP is distributed under the LGPL License\n2016-01-23 17:11:01 [INFO] Starting Minecraft: PE server version v0.10.5 alpha\n2016-01-23 17:11:01 [INFO] Loading pocketmine.yml...\n2016-01-23 17:11:01 [INFO] Loading server properties...\n2016-01-23 17:11:01 [INFO] Starting Minecraft PE server on 0.0.0.0:19145\n2016-01-23 17:11:01 [INFO] This server is running PocketMine-MP version 1.4.1-980 \"\u7d76\u597d(Zekkou)\u30b1\u30fc\u30ad(Cake)\" (API 1.11.0)\n2016-01-23 17:11:01 [INFO] PocketMine-MP is distributed under the LGPL License\n2016-01-23 17:11:02 [INFO] Loading DevTools v1.10.0\n2016-01-23 17:11:02 [INFO] Enabling DevTools v1.10.0\n2016-01-23 17:11:02 [INFO] Loading source plugin Glifcos-p v1.0.0\n2016-01-23 17:11:02 [INFO] [DevTools] Registered folder plugin loader\n2016-01-23 17:11:02 [INFO] Preparing level \"world\"\n2016-01-23 17:11:02 [INFO] Enabling Glifcos-p v1.0.0\n2016-01-23 17:11:03 [INFO] [Glifcos-p] Datasync sent to webserver.\n2016-01-23 17:11:03 [INFO] Starting GS4 status listener\n2016-01-23 17:11:03 [INFO] Setting query port to 19145\n2016-01-23 17:11:03 [INFO] Query running on 0.0.0.0:19145\n2016-01-23 17:11:03 [INFO] Default game type: SURVIVAL\n2016-01-23 17:11:03 [INFO] Done (1.265s)! For help, type \"help\" or \"?\"\n2016-01-23 17:12:06 [INFO] CONSOLE: Stopping the server...\n2016-01-23 17:12:07 [INFO] Disabling DevTools v1.10.0\n2016-01-23 17:12:07 [INFO] Disabling Glifcos-p v1.0.0\n2016-01-23 17:12:07 [INFO] Unloading level \"world\"\n2016-01-23 17:12:07 [INFO] Stopping other threads\n2016-01-23 17:12:13 [INFO] Starting Minecraft: PE server version v0.10.5 alpha\n2016-01-23 17:12:13 [INFO] Loading pocketmine.yml...\n2016-01-23 17:12:13 [INFO] Loading server properties...\n2016-01-23 17:12:13 [INFO] Starting Minecraft PE server on 0.0.0.0:19145\n2016-01-23 17:12:13 [INFO] This server is running PocketMine-MP version 1.4.1-980 \"\u7d76\u597d(Zekkou)\u30b1\u30fc\u30ad(Cake)\" (API 1.11.0)\n2016-01-23 17:12:13 [INFO] PocketMine-MP is distributed under the LGPL License\n2016-01-23 17:12:13 [INFO] Loading DevTools v1.10.0\n2016-01-23 17:12:14 [INFO] Enabling DevTools v1.10.0\n2016-01-23 17:12:14 [INFO] Loading source plugin Glifcos-p v1.0.0\n2016-01-23 17:12:14 [INFO] [DevTools] Registered folder plugin loader\n2016-01-23 17:12:14 [INFO] Preparing level \"world\"\n2016-01-23 17:12:14 [INFO] Enabling Glifcos-p v1.0.0\n2016-01-23 17:12:14 [INFO] [Glifcos-p] Datasync sent to webserver.\n2016-01-23 17:12:14 [INFO] Starting GS4 status listener\n2016-01-23 17:12:14 [INFO] Setting query port to 19145\n2016-01-23 17:12:14 [INFO] Query running on 0.0.0.0:19145\n2016-01-23 17:12:14 [INFO] Default game type: SURVIVAL\n2016-01-23 17:12:14 [INFO] Done (1.193s)! For help, type \"help\" or \"?\"\n2016-01-24 05:38:59 [INFO] CONSOLE: Stopping the server...\n2016-01-24 05:38:59 [INFO] Disabling DevTools v1.10.0\n2016-01-24 05:38:59 [INFO] Disabling Glifcos-p v1.0.0\n2016-01-24 05:38:59 [INFO] Unloading level \"world\"\n2016-01-24 05:38:59 [INFO] Stopping other threads\n2016-01-26 22:02:24 [INFO] Starting Minecraft: PE server version v0.10.5 alpha\n2016-01-26 22:02:24 [INFO] Loading pocketmine.yml...\n2016-01-26 22:02:24 [INFO] Loading server properties...\n2016-01-26 22:02:24 [INFO] Starting Minecraft PE server on 0.0.0.0:19145\n2016-01-26 22:02:24 [INFO] This server is running PocketMine-MP version 1.4.1-980 \"\u7d76\u597d(Zekkou)\u30b1\u30fc\u30ad(Cake)\" (API 1.11.0)\n2016-01-26 22:02:24 [INFO] PocketMine-MP is distributed under the LGPL License\n2016-01-26 22:02:24 [INFO] Loading DevTools v1.10.0\n2016-01-26 22:02:24 [INFO] Enabling DevTools v1.10.0\n2016-01-26 22:02:24 [INFO] Loading source plugin Glifcos-p v1.0.0\n2016-01-26 22:02:24 [INFO] [DevTools] Registered folder plugin loader\n2016-01-26 22:02:24 [INFO] Preparing level \"world\"\n2016-01-26 22:02:24 [INFO] Enabling Glifcos-p v1.0.0\n2016-01-26 22:02:24 [WARNING] RuntimeException: \"file_get_contents(): Unable to find the wrapper \"https\" - did you forget to enable it when you configured PHP?\" (E_WARNING) in \"\/glifcos-plugin\/src\/glifcos\/glifcos\" at line 60\n2016-01-26 22:02:24 [INFO] Disabling Glifcos-p v1.0.0\n2016-01-26 22:02:25 [INFO] Starting GS4 status listener\n2016-01-26 22:02:25 [INFO] Setting query port to 19145\n2016-01-26 22:02:25 [INFO] Query running on 0.0.0.0:19145\n2016-01-26 22:02:25 [INFO] Default game type: SURVIVAL\n2016-01-26 22:02:25 [INFO] Done (0.958s)! For help, type \"help\" or \"?\"\n2016-01-26 22:03:00 [INFO] CONSOLE: Stopping the server...\n2016-01-26 22:03:00 [INFO] Disabling DevTools v1.10.0\n2016-01-26 22:03:00 [INFO] Unloading level \"world\"\n2016-01-26 22:03:00 [INFO] Stopping other threads\n2016-01-26 22:03:02 [INFO] Starting Minecraft: PE server version v0.10.5 alpha\n2016-01-26 22:03:02 [INFO] Loading pocketmine.yml...\n2016-01-26 22:03:02 [INFO] Loading server properties...\n2016-01-26 22:03:02 [INFO] Starting Minecraft PE server on 0.0.0.0:19145\n2016-01-26 22:03:02 [INFO] This server is running PocketMine-MP version 1.4.1-980 \"\u7d76\u597d(Zekkou)\u30b1\u30fc\u30ad(Cake)\" (API 1.11.0)\n2016-01-26 22:03:02 [INFO] PocketMine-MP is distributed under the LGPL License\n2016-01-26 22:03:02 [INFO] Loading DevTools v1.10.0\n2016-01-26 22:03:02 [INFO] Enabling DevTools v1.10.0\n2016-01-26 22:03:02 [INFO] Loading source plugin Glifcos-p v1.0.0\n2016-01-26 22:03:02 [INFO] [DevTools] Registered folder plugin loader\n2016-01-26 22:03:02 [INFO] Preparing level \"world\"\n2016-01-26 22:03:02 [INFO] Enabling Glifcos-p v1.0.0\n2016-01-26 22:03:03 [INFO] [Glifcos-p] Datasync sent to webserver.\n2016-01-26 22:03:03 [INFO] Starting GS4 status listener\n2016-01-26 22:03:03 [INFO] Setting query port to 19145\n2016-01-26 22:03:03 [INFO] Query running on 0.0.0.0:19145\n2016-01-26 22:03:03 [INFO] Default game type: SURVIVAL\n2016-01-26 22:03:03 [INFO] Done (1.078s)! For help, type \"help\" or \"?\"\n2016-01-26 22:04:07 [INFO] CONSOLE: Stopping the server...\n2016-01-26 22:04:07 [INFO] Disabling DevTools v1.10.0\n2016-01-26 22:04:07 [INFO] Disabling Glifcos-p v1.0.0\n2016-01-26 22:04:07 [INFO] Unloading level \"world\"\n2016-01-26 22:04:07 [INFO] Stopping other threads\n2016-01-26 22:04:09 [INFO] Starting Minecraft: PE server version v0.10.5 alpha\n2016-01-26 22:04:09 [INFO] Loading pocketmine.yml...\n2016-01-26 22:04:09 [INFO] Loading server properties...\n2016-01-26 22:04:09 [INFO] Starting Minecraft PE server on 0.0.0.0:19145\n2016-01-26 22:04:10 [INFO] This server is running PocketMine-MP version 1.4.1-980 \"\u7d76\u597d(Zekkou)\u30b1\u30fc\u30ad(Cake)\" (API 1.11.0)\n2016-01-26 22:04:10 [INFO] PocketMine-MP is distributed under the LGPL License\n2016-01-26 22:04:10 [INFO] Loading DevTools v1.10.0\n2016-01-26 22:04:10 [INFO] Enabling DevTools v1.10.0\n2016-01-26 22:04:10 [INFO] Loading source plugin Glifcos-p v1.0.0\n2016-01-26 22:04:10 [INFO] [DevTools] Registered folder plugin loader\n2016-01-26 22:04:10 [INFO] Preparing level \"world\"\n2016-01-26 22:04:10 [INFO] Enabling Glifcos-p v1.0.0\n2016-01-26 22:04:35 [INFO] Starting Minecraft: PE server version v0.10.5 alpha\n2016-01-26 22:04:35 [INFO] Loading pocketmine.yml...\n2016-01-26 22:04:35 [INFO] Loading server properties...\n2016-01-26 22:04:35 [INFO] Starting Minecraft PE server on 0.0.0.0:19145\n2016-01-26 22:04:35 [INFO] This server is running PocketMine-MP version 1.4.1-980 \"\u7d76\u597d(Zekkou)\u30b1\u30fc\u30ad(Cake)\" (API 1.11.0)\n2016-01-26 22:04:35 [INFO] PocketMine-MP is distributed under the LGPL License\n2016-01-26 22:04:35 [INFO] Loading DevTools v1.10.0\n2016-01-26 22:04:36 [INFO] Enabling DevTools v1.10.0\n2016-01-26 22:04:36 [INFO] Loading source plugin Glifcos-p v1.0.0\n2016-01-26 22:04:36 [INFO] [DevTools] Registered folder plugin loader\n2016-01-26 22:04:36 [INFO] Preparing level \"world\"\n2016-01-26 22:04:36 [INFO] Enabling Glifcos-p v1.0.0\n2016-01-26 22:05:26 [INFO] Starting Minecraft: PE server version v0.10.5 alpha\n2016-01-26 22:05:26 [INFO] Loading pocketmine.yml...\n2016-01-26 22:05:26 [INFO] Loading server properties...\n2016-01-26 22:05:26 [INFO] Starting Minecraft PE server on 0.0.0.0:19145\n2016-01-26 22:05:26 [INFO] This server is running PocketMine-MP version 1.4.1-980 \"\u7d76\u597d(Zekkou)\u30b1\u30fc\u30ad(Cake)\" (API 1.11.0)\n2016-01-26 22:05:26 [INFO] PocketMine-MP is distributed under the LGPL License\n2016-01-26 22:05:26 [INFO] Loading DevTools v1.10.0\n2016-01-26 22:05:27 [INFO] Enabling DevTools v1.10.0\n2016-01-26 22:05:27 [INFO] Loading source plugin Glifcos-p v1.0.0\n2016-01-26 22:05:27 [INFO] [DevTools] Registered folder plugin loader\n2016-01-26 22:05:27 [INFO] Preparing level \"world\"\n2016-01-26 22:05:27 [INFO] Enabling Glifcos-p v1.0.0\n2016-01-26 22:05:27 [INFO] [Glifcos-p] Datasync sent to webserver.\n2016-01-26 22:05:27 [INFO] Starting GS4 status listener\n2016-01-26 22:05:27 [INFO] Setting query port to 19145\n2016-01-26 22:05:27 [INFO] Query running on 0.0.0.0:19145\n2016-01-26 22:05:27 [INFO] Default game type: SURVIVAL\n2016-01-26 22:05:27 [INFO] Done (1.165s)! For help, type \"help\" or \"?\"\n2016-01-26 22:05:28 [INFO] [Glifcos-p] hi\n2016-01-26 22:05:29 [INFO] [Glifcos-p] hi\n2016-01-26 22:05:30 [INFO] [Glifcos-p] hi\n2016-01-26 22:05:31 [INFO] [Glifcos-p] hi\n2016-01-26 22:05:32 [INFO] CONSOLE: Stopping the server...\n2016-01-26 22:05:32 [INFO] Disabling DevTools v1.10.0\n2016-01-26 22:05:32 [INFO] Disabling Glifcos-p v1.0.0\n2016-01-26 22:05:32 [INFO] Unloading level \"world\"\n2016-01-26 22:05:32 [INFO] Stopping other threads\n2016-01-26 22:07:00 [INFO] Starting Minecraft: PE server version v0.10.5 alpha\n2016-01-26 22:07:00 [INFO] Loading pocketmine.yml...\n2016-01-26 22:07:00 [INFO] Loading server properties...\n2016-01-26 22:07:00 [INFO] Starting Minecraft PE server on 0.0.0.0:19145\n2016-01-26 22:07:01 [INFO] This server is running PocketMine-MP version 1.4.1-980 \"\u7d76\u597d(Zekkou)\u30b1\u30fc\u30ad(Cake)\" (API 1.11.0)\n2016-01-26 22:07:01 [INFO] PocketMine-MP is distributed under the LGPL License\n2016-01-26 22:07:01 [INFO] Loading DevTools v1.10.0\n2016-01-26 22:07:01 [INFO] Enabling DevTools v1.10.0\n2016-01-26 22:07:01 [INFO] Loading source plugin Glifcos-p v1.0.0\n2016-01-26 22:07:01 [INFO] [DevTools] Registered folder plugin loader\n2016-01-26 22:07:01 [INFO] Preparing level \"world\"\n2016-01-26 22:07:01 [INFO] Enabling Glifcos-p v1.0.0\n2016-01-26 22:07:01 [INFO] [Glifcos-p] Datasync sent to webserver.\n2016-01-26 22:07:02 [INFO] Starting GS4 status listener\n2016-01-26 22:07:02 [INFO] Setting query port to 19145\n2016-01-26 22:07:02 [INFO] Query running on 0.0.0.0:19145\n2016-01-26 22:07:02 [INFO] Default game type: SURVIVAL\n2016-01-26 22:07:02 [INFO] Done (1.1s)! For help, type \"help\" or \"?\"\n2016-01-26 22:07:11 [INFO] CONSOLE: Stopping the server...\n2016-01-26 22:07:11 [INFO] Disabling DevTools v1.10.0\n2016-01-26 22:07:11 [INFO] Disabling Glifcos-p v1.0.0\n2016-01-26 22:07:11 [INFO] Unloading level \"world\"\n2016-01-26 22:07:11 [INFO] Stopping other threads\n2016-01-26 22:07:24 [INFO] Starting Minecraft: PE server version v0.10.5 alpha\n2016-01-26 22:07:24 [INFO] Loading pocketmine.yml...\n2016-01-26 22:07:24 [INFO] Loading server properties...\n2016-01-26 22:07:24 [INFO] Starting Minecraft PE server on 0.0.0.0:19145\n2016-01-26 22:07:24 [INFO] This server is running PocketMine-MP version 1.4.1-980 \"\u7d76\u597d(Zekkou)\u30b1\u30fc\u30ad(Cake)\" (API 1.11.0)\n2016-01-26 22:07:24 [INFO] PocketMine-MP is distributed under the LGPL License\n2016-01-26 22:07:24 [INFO] Loading DevTools v1.10.0\n2016-01-26 22:07:25 [INFO] Enabling DevTools v1.10.0\n2016-01-26 22:07:25 [INFO] Loading source plugin Glifcos-p v1.0.0\n2016-01-26 22:07:25 [INFO] [DevTools] Registered folder plugin loader\n2016-01-26 22:07:25 [INFO] Preparing level \"world\"\n2016-01-26 22:07:25 [INFO] Enabling Glifcos-p v1.0.0\n2016-01-26 22:07:25 [INFO] [Glifcos-p] Datasync sent to webserver.\n2016-01-26 22:07:25 [INFO] Starting GS4 status listener\n2016-01-26 22:07:25 [INFO] Setting query port to 19145\n2016-01-26 22:07:25 [INFO] Query running on 0.0.0.0:19145\n2016-01-26 22:07:25 [INFO] Default game type: SURVIVAL\n2016-01-26 22:07:25 [INFO] Done (1.05s)! For help, type \"help\" or \"?\"\n2016-01-26 22:07:29 [INFO] CONSOLE: Stopping the server...\n2016-01-26 22:07:29 [INFO] Disabling DevTools v1.10.0\n2016-01-26 22:07:29 [INFO] Disabling Glifcos-p v1.0.0\n2016-01-26 22:07:29 [INFO] Unloading level \"world\"\n2016-01-26 22:07:29 [INFO] Stopping other threads\n2016-01-26 22:08:46 [INFO] Starting Minecraft: PE server version v0.10.5 alpha\n2016-01-26 22:08:46 [INFO] Loading pocketmine.yml...\n2016-01-26 22:08:46 [INFO] Loading server properties...\n2016-01-26 22:08:46 [INFO] Starting Minecraft PE server on 0.0.0.0:19145\n2016-01-26 22:08:46 [INFO] This server is running PocketMine-MP version 1.4.1-980 \"\u7d76\u597d(Zekkou)\u30b1\u30fc\u30ad(Cake)\" (API 1.11.0)\n2016-01-26 22:08:46 [INFO] PocketMine-MP is distributed under the LGPL License\n2016-01-26 22:08:47 [INFO] Loading DevTools v1.10.0\n2016-01-26 22:08:47 [INFO] Enabling DevTools v1.10.0\n2016-01-26 22:08:47 [INFO] Loading source plugin Glifcos-p v1.0.0\n2016-01-26 22:08:47 [INFO] [DevTools] Registered folder plugin loader\n2016-01-26 22:08:47 [INFO] Preparing level \"world\"\n2016-01-26 22:08:47 [INFO] Enabling Glifcos-p v1.0.0\n2016-01-26 22:08:47 [INFO] [Glifcos-p] Datasync sent to webserver.\n2016-01-26 22:08:48 [INFO] Starting GS4 status listener\n2016-01-26 22:08:48 [INFO] Setting query port to 19145\n2016-01-26 22:08:48 [INFO] Query running on 0.0.0.0:19145\n2016-01-26 22:08:48 [INFO] Default game type: SURVIVAL\n2016-01-26 22:08:48 [INFO] Done (1.135s)! For help, type \"help\" or \"?\"\n2016-01-26 22:09:23 [INFO] Starting Minecraft: PE server version v0.10.5 alpha\n2016-01-26 22:09:23 [INFO] Loading pocketmine.yml...\n2016-01-26 22:09:23 [INFO] Loading server properties...\n2016-01-26 22:09:23 [INFO] Starting Minecraft PE server on 0.0.0.0:19145\n2016-01-26 22:09:23 [INFO] This server is running PocketMine-MP version 1.4.1-980 \"\u7d76\u597d(Zekkou)\u30b1\u30fc\u30ad(Cake)\" (API 1.11.0)\n2016-01-26 22:09:23 [INFO] PocketMine-MP is distributed under the LGPL License\n2016-01-26 22:09:24 [INFO] Loading DevTools v1.10.0\n2016-01-26 22:09:24 [INFO] Enabling DevTools v1.10.0\n2016-01-26 22:09:24 [INFO] Loading source plugin Glifcos-p v1.0.0\n2016-01-26 22:09:24 [INFO] [DevTools] Registered folder plugin loader\n2016-01-26 22:09:24 [INFO] Preparing level \"world\"\n2016-01-26 22:09:24 [INFO] Enabling Glifcos-p v1.0.0\n2016-01-26 22:09:24 [INFO] [Glifcos-p] Datasync sent to webserver.\n2016-01-26 22:09:24 [INFO] Starting GS4 status listener\n2016-01-26 22:09:24 [INFO] Setting query port to 19145\n2016-01-26 22:09:24 [INFO] Query running on 0.0.0.0:19145\n2016-01-26 22:09:24 [INFO] Default game type: SURVIVAL\n2016-01-26 22:09:24 [INFO] Done (0.993s)! For help, type \"help\" or \"?\"\n2016-01-26 22:09:31 [INFO] CONSOLE: Stopping the server...\n2016-01-26 22:09:32 [INFO] Disabling DevTools v1.10.0\n2016-01-26 22:09:32 [INFO] Disabling Glifcos-p v1.0.0\n2016-01-26 22:09:32 [INFO] Unloading level \"world\"\n2016-01-26 22:09:32 [INFO] Stopping other threads\n2016-01-26 22:10:23 [INFO] Starting Minecraft: PE server version v0.10.5 alpha\n2016-01-26 22:10:23 [INFO] Loading pocketmine.yml...\n2016-01-26 22:10:23 [INFO] Loading server properties...\n2016-01-26 22:10:23 [INFO] Starting Minecraft PE server on 0.0.0.0:19145\n2016-01-26 22:10:23 [INFO] This server is running PocketMine-MP version 1.4.1-980 \"\u7d76\u597d(Zekkou)\u30b1\u30fc\u30ad(Cake)\" (API 1.11.0)\n2016-01-26 22:10:23 [INFO] PocketMine-MP is distributed under the LGPL License\n2016-01-26 22:10:24 [INFO] Loading DevTools v1.10.0\n2016-01-26 22:10:24 [INFO] Enabling DevTools v1.10.0\n2016-01-26 22:10:24 [INFO] Loading source plugin Glifcos-p v1.0.0\n2016-01-26 22:10:24 [INFO] [DevTools] Registered folder plugin loader\n2016-01-26 22:10:24 [INFO] Preparing level \"world\"\n2016-01-26 22:10:24 [INFO] Enabling Glifcos-p v1.0.0\n2016-01-26 22:10:24 [INFO] [Glifcos-p] Datasync sent to webserver.\n2016-01-26 22:10:24 [INFO] Starting GS4 status listener\n2016-01-26 22:10:24 [INFO] Setting query port to 19145\n2016-01-26 22:10:24 [INFO] Query running on 0.0.0.0:19145\n2016-01-26 22:10:24 [INFO] Default game type: SURVIVAL\n2016-01-26 22:10:24 [INFO] Done (1.004s)! For help, type \"help\" or \"?\"\n2016-01-26 22:10:32 [INFO] CONSOLE: Reloading server...\n2016-01-26 22:10:32 [INFO] Saving levels...\n2016-01-26 22:10:32 [INFO] Disabling DevTools v1.10.0\n2016-01-26 22:10:32 [INFO] Disabling Glifcos-p v1.0.0\n2016-01-26 22:10:32 [INFO] Reloading properties...\n2016-01-26 22:10:32 [INFO] Loading DevTools v1.10.0\n2016-01-26 22:10:32 [INFO] Enabling DevTools v1.10.0\n2016-01-26 22:10:32 [INFO] CONSOLE: Reload complete.\n2016-01-26 22:10:35 [INFO] CONSOLE: Stopping the server...\n2016-01-26 22:10:35 [INFO] Disabling DevTools v1.10.0\n2016-01-26 22:10:35 [INFO] Unloading level \"world\"\n2016-01-26 22:10:35 [INFO] Stopping other threads\n2016-01-26 22:10:36 [INFO] Starting Minecraft: PE server version v0.10.5 alpha\n2016-01-26 22:10:36 [INFO] Loading pocketmine.yml...\n2016-01-26 22:10:36 [INFO] Loading server properties...\n2016-01-26 22:10:36 [INFO] Starting Minecraft PE server on 0.0.0.0:19145\n2016-01-26 22:10:36 [INFO] This server is running PocketMine-MP version 1.4.1-980 \"\u7d76\u597d(Zekkou)\u30b1\u30fc\u30ad(Cake)\" (API 1.11.0)\n2016-01-26 22:10:36 [INFO] PocketMine-MP is distributed under the LGPL License\n2016-01-26 22:10:37 [INFO] Loading DevTools v1.10.0\n2016-01-26 22:10:37 [INFO] Enabling DevTools v1.10.0\n2016-01-26 22:10:37 [INFO] Loading source plugin Glifcos-p v1.0.0\n2016-01-26 22:10:37 [INFO] [DevTools] Registered folder plugin loader\n2016-01-26 22:10:37 [INFO] Preparing level \"world\"\n2016-01-26 22:10:37 [INFO] Enabling Glifcos-p v1.0.0\n2016-01-26 22:10:37 [INFO] [Glifcos-p] Datasync sent to webserver.\n2016-01-26 22:10:37 [INFO] Starting GS4 status listener\n2016-01-26 22:10:37 [INFO] Setting query port to 19145\n2016-01-26 22:10:37 [INFO] Query running on 0.0.0.0:19145\n2016-01-26 22:10:37 [INFO] Default game type: SURVIVAL\n2016-01-26 22:10:37 [INFO] Done (0.895s)! For help, type \"help\" or \"?\"\n2016-01-26 22:11:30 [INFO] CONSOLE: Stopping the server...\n2016-01-26 22:11:31 [INFO] Disabling DevTools v1.10.0\n2016-01-26 22:11:31 [INFO] Disabling Glifcos-p v1.0.0\n2016-01-26 22:11:31 [INFO] Unloading level \"world\"\n2016-01-26 22:11:31 [INFO] Stopping other threads\n2016-01-26 22:11:33 [INFO] Starting Minecraft: PE server version v0.10.5 alpha\n2016-01-26 22:11:33 [INFO] Loading pocketmine.yml...\n2016-01-26 22:11:33 [INFO] Loading server properties...\n2016-01-26 22:11:33 [INFO] Starting Minecraft PE server on 0.0.0.0:19145\n2016-01-26 22:11:33 [INFO] This server is running PocketMine-MP version 1.4.1-980 \"\u7d76\u597d(Zekkou)\u30b1\u30fc\u30ad(Cake)\" (API 1.11.0)\n2016-01-26 22:11:33 [INFO] PocketMine-MP is distributed under the LGPL License\n2016-01-26 22:11:33 [INFO] Loading DevTools v1.10.0\n2016-01-26 22:11:33 [INFO] Enabling DevTools v1.10.0\n2016-01-26 22:11:33 [INFO] Loading source plugin Glifcos-p v1.0.0\n2016-01-26 22:11:33 [INFO] [DevTools] Registered folder plugin loader\n2016-01-26 22:11:33 [INFO] Preparing level \"world\"\n2016-01-26 22:11:33 [INFO] Enabling Glifcos-p v1.0.0\n2016-01-26 22:11:34 [INFO] [Glifcos-p] Datasync sent to webserver.\n2016-01-26 22:11:34 [INFO] Starting GS4 status listener\n2016-01-26 22:11:34 [INFO] Setting query port to 19145\n2016-01-26 22:11:34 [INFO] Query running on 0.0.0.0:19145\n2016-01-26 22:11:34 [INFO] Default game type: SURVIVAL\n2016-01-26 22:11:34 [INFO] Done (1.067s)! For help, type \"help\" or \"?\"\n2016-01-26 22:12:24 [INFO] CONSOLE: Stopping the server...\n2016-01-26 22:12:24 [INFO] Disabling DevTools v1.10.0\n2016-01-26 22:12:24 [INFO] Disabling Glifcos-p v1.0.0\n2016-01-26 22:12:24 [INFO] Unloading level \"world\"\n2016-01-26 22:12:24 [INFO] Stopping other threads\n2016-01-26 22:12:26 [INFO] Starting Minecraft: PE server version v0.10.5 alpha\n2016-01-26 22:12:26 [INFO] Loading pocketmine.yml...\n2016-01-26 22:12:26 [INFO] Loading server properties...\n2016-01-26 22:12:26 [INFO] Starting Minecraft PE server on 0.0.0.0:19145\n2016-01-26 22:12:26 [INFO] This server is running PocketMine-MP version 1.4.1-980 \"\u7d76\u597d(Zekkou)\u30b1\u30fc\u30ad(Cake)\" (API 1.11.0)\n2016-01-26 22:12:26 [INFO] PocketMine-MP is distributed under the LGPL License\n2016-01-26 22:12:27 [INFO] Loading DevTools v1.10.0\n2016-01-26 22:12:27 [INFO] Enabling DevTools v1.10.0\n2016-01-26 22:12:27 [INFO] Loading source plugin Glifcos-p v1.0.0\n2016-01-26 22:12:27 [INFO] [DevTools] Registered folder plugin loader\n2016-01-26 22:12:27 [INFO] Preparing level \"world\"\n2016-01-26 22:12:27 [INFO] Enabling Glifcos-p v1.0.0\n2016-01-26 22:12:27 [INFO] [Glifcos-p] Datasync sent to webserver.\n2016-01-26 22:12:27 [INFO] Starting GS4 status listener\n2016-01-26 22:12:27 [INFO] Setting query port to 19145\n2016-01-26 22:12:27 [INFO] Query running on 0.0.0.0:19145\n2016-01-26 22:12:27 [INFO] Default game type: SURVIVAL\n2016-01-26 22:12:27 [INFO] Done (1.069s)! For help, type \"help\" or \"?\"\n2016-01-26 22:12:36 [INFO] CONSOLE: Stopping the server...\n2016-01-26 22:12:36 [INFO] Disabling DevTools v1.10.0\n2016-01-26 22:12:36 [INFO] Disabling Glifcos-p v1.0.0\n2016-01-26 22:12:36 [INFO] Unloading level \"world\"\n2016-01-26 22:12:36 [INFO] Stopping other threads\n2016-01-26 22:16:11 [INFO] Starting Minecraft: PE server version v0.10.5 alpha\n2016-01-26 22:16:11 [INFO] Loading pocketmine.yml...\n2016-01-26 22:16:11 [INFO] Loading server properties...\n2016-01-26 22:16:11 [INFO] Starting Minecraft PE server on 0.0.0.0:19145\n2016-01-26 22:16:11 [INFO] This server is running PocketMine-MP version 1.4.1-980 \"\u7d76\u597d(Zekkou)\u30b1\u30fc\u30ad(Cake)\" (API 1.11.0)\n2016-01-26 22:16:11 [INFO] PocketMine-MP is distributed under the LGPL License\n2016-01-26 22:16:12 [INFO] Loading DevTools v1.10.0\n2016-01-26 22:16:12 [INFO] Enabling DevTools v1.10.0\n2016-01-26 22:16:12 [INFO] Loading source plugin Glifcos-p v1.0.0\n2016-01-26 22:16:12 [INFO] [DevTools] Registered folder plugin loader\n2016-01-26 22:16:12 [INFO] Preparing level \"world\"\n2016-01-26 22:16:12 [INFO] Enabling Glifcos-p v1.0.0\n2016-01-26 22:16:12 [INFO] [Glifcos-p] Datasync sent to webserver.\n2016-01-26 22:16:13 [INFO] Starting GS4 status listener\n2016-01-26 22:16:13 [INFO] Setting query port to 19145\n2016-01-26 22:16:13 [INFO] Query running on 0.0.0.0:19145\n2016-01-26 22:16:13 [INFO] Default game type: SURVIVAL\n2016-01-26 22:16:13 [INFO] Done (1.182s)! For help, type \"help\" or \"?\"\n2016-01-26 22:16:21 [INFO] CONSOLE: Stopping the server...\n2016-01-26 22:16:21 [INFO] Disabling DevTools v1.10.0\n2016-01-26 22:16:21 [INFO] Disabling Glifcos-p v1.0.0\n2016-01-26 22:16:21 [INFO] Unloading level \"world\"\n2016-01-26 22:16:21 [INFO] Stopping other threads\n2016-01-26 22:18:00 [INFO] Starting Minecraft: PE server version v0.10.5 alpha\n2016-01-26 22:18:00 [INFO] Loading pocketmine.yml...\n2016-01-26 22:18:00 [INFO] Loading server properties...\n2016-01-26 22:18:00 [INFO] Starting Minecraft PE server on 0.0.0.0:19145\n2016-01-26 22:18:00 [INFO] This server is running PocketMine-MP version 1.4.1-980 \"\u7d76\u597d(Zekkou)\u30b1\u30fc\u30ad(Cake)\" (API 1.11.0)\n2016-01-26 22:18:00 [INFO] PocketMine-MP is distributed under the LGPL License\n2016-01-26 22:18:00 [INFO] Loading DevTools v1.10.0\n2016-01-26 22:18:01 [INFO] Enabling DevTools v1.10.0\n2016-01-26 22:18:01 [INFO] Loading source plugin Glifcos-p v1.0.0\n2016-01-26 22:18:01 [INFO] [DevTools] Registered folder plugin loader\n2016-01-26 22:18:01 [INFO] Preparing level \"world\"\n2016-01-26 22:18:01 [INFO] Enabling Glifcos-p v1.0.0\n2016-01-26 22:18:01 [INFO] [Glifcos-p] Datasync sent to webserver.\n2016-01-26 22:18:01 [INFO] Starting GS4 status listener\n2016-01-26 22:18:01 [INFO] Setting query port to 19145\n2016-01-26 22:18:01 [INFO] Query running on 0.0.0.0:19145\n2016-01-26 22:18:01 [INFO] Default game type: SURVIVAL\n2016-01-26 22:18:01 [INFO] Done (1.086s)! For help, type \"help\" or \"?\"\n2016-01-26 22:18:05 [INFO] CONSOLE: Stopping the server...\n2016-01-26 22:18:05 [INFO] Disabling DevTools v1.10.0\n2016-01-26 22:18:05 [INFO] Disabling Glifcos-p v1.0.0\n2016-01-26 22:18:05 [INFO] Unloading level \"world\"\n2016-01-26 22:18:05 [INFO] Stopping other threads\n2016-01-26 22:19:33 [INFO] Starting Minecraft: PE server version v0.10.5 alpha\n2016-01-26 22:19:33 [INFO] Loading pocketmine.yml...\n2016-01-26 22:19:33 [INFO] Loading server properties...\n2016-01-26 22:19:33 [INFO] Starting Minecraft PE server on 0.0.0.0:19145\n2016-01-26 22:19:33 [INFO] This server is running PocketMine-MP version 1.4.1-980 \"\u7d76\u597d(Zekkou)\u30b1\u30fc\u30ad(Cake)\" (API 1.11.0)\n2016-01-26 22:19:33 [INFO] PocketMine-MP is distributed under the LGPL License\n2016-01-26 22:19:33 [INFO] Loading DevTools v1.10.0\n2016-01-26 22:19:34 [INFO] Enabling DevTools v1.10.0\n2016-01-26 22:19:34 [INFO] Loading source plugin Glifcos-p v1.0.0\n2016-01-26 22:19:34 [INFO] [DevTools] Registered folder plugin loader\n2016-01-26 22:19:34 [INFO] Preparing level \"world\"\n2016-01-26 22:19:34 [INFO] Enabling Glifcos-p v1.0.0\n2016-01-26 22:19:34 [INFO] [Glifcos-p] Datasync sent to webserver.\n2016-01-26 22:19:34 [INFO] Starting GS4 status listener\n2016-01-26 22:19:34 [INFO] Setting query port to 19145\n2016-01-26 22:19:34 [INFO] Query running on 0.0.0.0:19145\n2016-01-26 22:19:34 [INFO] Default game type: SURVIVAL\n2016-01-26 22:19:34 [INFO] Done (1.042s)! For help, type \"help\" or \"?\"\n2016-01-26 22:19:42 [INFO] CONSOLE: Stopping the server...\n2016-01-26 22:19:42 [INFO] Disabling DevTools v1.10.0\n2016-01-26 22:19:42 [INFO] Disabling Glifcos-p v1.0.0\n2016-01-26 22:19:42 [INFO] Unloading level \"world\"\n2016-01-26 22:19:42 [INFO] Stopping other threads\n2016-01-26 22:22:41 [INFO] Starting Minecraft: PE server version v0.10.5 alpha\n2016-01-26 22:22:41 [INFO] Loading pocketmine.yml...\n2016-01-26 22:22:41 [INFO] Loading server properties...\n2016-01-26 22:22:41 [INFO] Starting Minecraft PE server on 0.0.0.0:19145\n2016-01-26 22:22:41 [INFO] This server is running PocketMine-MP version 1.4.1-980 \"\u7d76\u597d(Zekkou)\u30b1\u30fc\u30ad(Cake)\" (API 1.11.0)\n2016-01-26 22:22:41 [INFO] PocketMine-MP is distributed under the LGPL License\n2016-01-26 22:22:41 [INFO] Loading DevTools v1.10.0\n2016-01-26 22:22:42 [INFO] Enabling DevTools v1.10.0\n2016-01-26 22:22:42 [INFO] Loading source plugin Glifcos-p v1.0.0\n2016-01-26 22:22:42 [INFO] [DevTools] Registered folder plugin loader\n2016-01-26 22:22:42 [INFO] Preparing level \"world\"\n2016-01-26 22:22:42 [INFO] Enabling Glifcos-p v1.0.0\n2016-01-26 22:22:42 [INFO] [Glifcos-p] Datasync sent to webserver.\n2016-01-26 22:22:42 [INFO] Starting GS4 status listener\n2016-01-26 22:22:42 [INFO] Setting query port to 19145\n2016-01-26 22:22:42 [INFO] Query running on 0.0.0.0:19145\n2016-01-26 22:22:42 [INFO] Default game type: SURVIVAL\n2016-01-26 22:22:42 [INFO] Done (1.117s)! For help, type \"help\" or \"?\"\n2016-01-26 22:22:43 [CRITICAL] Could not execute task glifcos\\mainw\\synctask: yaml_parse(): scanning error encountered during parsing: mapping values are not allowed in this context (line 13, column 15)\n2016-01-26 22:22:43 [WARNING] RuntimeException: \"yaml_parse(): scanning error encountered during parsing: mapping values are not allowed in this context (line 13, column 15)\" (E_WARNING) in \"\/glifcos-plugin\/src\/glifcos\/mainw\/synctask\" at line 17\n2016-01-26 22:22:44 [CRITICAL] Could not execute task glifcos\\mainw\\synctask: yaml_parse(): scanning error encountered during parsing: mapping values are not allowed in this context (line 13, column 15)\n2016-01-26 22:22:44 [WARNING] RuntimeException: \"yaml_parse(): scanning error encountered during parsing: mapping values are not allowed in this context (line 13, column 15)\" (E_WARNING) in \"\/glifcos-plugin\/src\/glifcos\/mainw\/synctask\" at line 17\n2016-01-26 22:22:45 [CRITICAL] Could not execute task glifcos\\mainw\\synctask: yaml_parse(): scanning error encountered during parsing: mapping values are not allowed in this context (line 13, column 15)\n2016-01-26 22:22:45 [WARNING] RuntimeException: \"yaml_parse(): scanning error encountered during parsing: mapping values are not allowed in this context (line 13, column 15)\" (E_WARNING) in \"\/glifcos-plugin\/src\/glifcos\/mainw\/synctask\" at line 17\n2016-01-26 22:22:46 [CRITICAL] Could not execute task glifcos\\mainw\\synctask: yaml_parse(): scanning error encountered during parsing: mapping values are not allowed in this context (line 13, column 15)\n2016-01-26 22:22:46 [WARNING] RuntimeException: \"yaml_parse(): scanning error encountered during parsing: mapping values are not allowed in this context (line 13, column 15)\" (E_WARNING) in \"\/glifcos-plugin\/src\/glifcos\/mainw\/synctask\" at line 17\n2016-01-26 22:22:47 [CRITICAL] Could not execute task glifcos\\mainw\\synctask: yaml_parse(): scanning error encountered during parsing: mapping values are not allowed in this context (line 13, column 15)\n2016-01-26 22:22:47 [WARNING] RuntimeException: \"yaml_parse(): scanning error encountered during parsing: mapping values are not allowed in this context (line 13, column 15)\" (E_WARNING) in \"\/glifcos-plugin\/src\/glifcos\/mainw\/synctask\" at line 17\n2016-01-26 22:22:48 [CRITICAL] Could not execute task glifcos\\mainw\\synctask: yaml_parse(): scanning error encountered during parsing: mapping values are not allowed in this context (line 13, column 15)\n2016-01-26 22:22:48 [WARNING] RuntimeException: \"yaml_parse(): scanning error encountered during parsing: mapping values are not allowed in this context (line 13, column 15)\" (E_WARNING) in \"\/glifcos-plugin\/src\/glifcos\/mainw\/synctask\" at line 17\n2016-01-26 22:22:49 [INFO] CONSOLE: Stopping the server...\n2016-01-26 22:22:49 [INFO] Disabling DevTools v1.10.0\n2016-01-26 22:22:49 [INFO] Disabling Glifcos-p v1.0.0\n2016-01-26 22:22:49 [INFO] Unloading level \"world\"\n2016-01-26 22:22:49 [INFO] Stopping other threads\n2016-01-26 22:30:33 [INFO] Starting Minecraft: PE server version v0.10.5 alpha\n2016-01-26 22:30:33 [INFO] Loading pocketmine.yml...\n2016-01-26 22:30:33 [INFO] Loading server properties...\n2016-01-26 22:30:33 [INFO] Starting Minecraft PE server on 0.0.0.0:19145\n2016-01-26 22:30:33 [INFO] This server is running PocketMine-MP version 1.4.1-980 \"\u7d76\u597d(Zekkou)\u30b1\u30fc\u30ad(Cake)\" (API 1.11.0)\n2016-01-26 22:30:33 [INFO] PocketMine-MP is distributed under the LGPL License\n2016-01-26 22:30:33 [INFO] Loading DevTools v1.10.0\n2016-01-26 22:30:33 [INFO] Enabling DevTools v1.10.0\n2016-01-26 22:30:33 [INFO] Loading source plugin Glifcos-p v1.0.0\n2016-01-26 22:30:33 [INFO] [DevTools] Registered folder plugin loader\n2016-01-26 22:30:33 [INFO] Preparing level \"world\"\n2016-01-26 22:30:33 [INFO] Enabling Glifcos-p v1.0.0\n2016-01-26 22:30:34 [INFO] [Glifcos-p] Datasync sent to webserver.\n2016-01-26 22:30:34 [INFO] Starting GS4 status listener\n2016-01-26 22:30:34 [INFO] Setting query port to 19145\n2016-01-26 22:30:34 [INFO] Query running on 0.0.0.0:19145\n2016-01-26 22:30:34 [INFO] Default game type: SURVIVAL\n2016-01-26 22:30:34 [INFO] Done (1.269s)! For help, type \"help\" or \"?\"\n2016-01-26 22:30:38 [INFO] CONSOLE: Stopping the server...\n2016-01-26 22:30:39 [INFO] Disabling DevTools v1.10.0\n2016-01-26 22:30:39 [INFO] Disabling Glifcos-p v1.0.0\n2016-01-26 22:30:39 [INFO] Unloading level \"world\"\n2016-01-26 22:30:39 [INFO] Stopping other threads\n2016-01-26 22:31:04 [INFO] Starting Minecraft: PE server version v0.10.5 alpha\n2016-01-26 22:31:04 [INFO] Loading pocketmine.yml...\n2016-01-26 22:31:04 [INFO] Loading server properties...\n2016-01-26 22:31:04 [INFO] Starting Minecraft PE server on 0.0.0.0:19145\n2016-01-26 22:31:04 [INFO] This server is running PocketMine-MP version 1.4.1-980 \"\u7d76\u597d(Zekkou)\u30b1\u30fc\u30ad(Cake)\" (API 1.11.0)\n2016-01-26 22:31:04 [INFO] PocketMine-MP is distributed under the LGPL License\n2016-01-26 22:31:04 [INFO] Loading DevTools v1.10.0\n2016-01-26 22:31:04 [INFO] Enabling DevTools v1.10.0\n2016-01-26 22:31:04 [INFO] Loading source plugin Glifcos-p v1.0.0\n2016-01-26 22:31:04 [INFO] [DevTools] Registered folder plugin loader\n2016-01-26 22:31:04 [INFO] Preparing level \"world\"\n2016-01-26 22:31:04 [INFO] Enabling Glifcos-p v1.0.0\n2016-01-26 22:31:04 [INFO] [Glifcos-p] Datasync sent to webserver.\n2016-01-26 22:31:05 [INFO] Starting GS4 status listener\n2016-01-26 22:31:05 [INFO] Setting query port to 19145\n2016-01-26 22:31:05 [INFO] Query running on 0.0.0.0:19145\n2016-01-26 22:31:05 [INFO] Default game type: SURVIVAL\n2016-01-26 22:31:05 [INFO] Done (1.044s)! For help, type \"help\" or \"?\"\n2016-01-26 22:31:08 [INFO] CONSOLE: Stopping the server...\n2016-01-26 22:31:08 [INFO] Disabling DevTools v1.10.0\n2016-01-26 22:31:08 [INFO] Disabling Glifcos-p v1.0.0\n2016-01-26 22:31:08 [INFO] Unloading level \"world\"\n2016-01-26 22:31:08 [INFO] Stopping other threads\n2016-01-26 22:31:29 [INFO] Starting Minecraft: PE server version v0.10.5 alpha\n2016-01-26 22:31:29 [INFO] Loading pocketmine.yml...\n2016-01-26 22:31:29 [INFO] Loading server properties...\n2016-01-26 22:31:29 [INFO] Starting Minecraft PE server on 0.0.0.0:19145\n2016-01-26 22:31:29 [INFO] This server is running PocketMine-MP version 1.4.1-980 \"\u7d76\u597d(Zekkou)\u30b1\u30fc\u30ad(Cake)\" (API 1.11.0)\n2016-01-26 22:31:29 [INFO] PocketMine-MP is distributed under the LGPL License\n2016-01-26 22:31:30 [INFO] Loading DevTools v1.10.0\n2016-01-26 22:31:30 [INFO] Enabling DevTools v1.10.0\n2016-01-26 22:31:30 [INFO] Loading source plugin Glifcos-p v1.0.0\n2016-01-26 22:31:30 [INFO] [DevTools] Registered folder plugin loader\n2016-01-26 22:31:30 [INFO] Preparing level \"world\"\n2016-01-26 22:31:30 [INFO] Enabling Glifcos-p v1.0.0\n2016-01-26 22:31:32 [INFO] [Glifcos-p] Datasync sent to webserver.\n2016-01-26 22:31:32 [INFO] Starting GS4 status listener\n2016-01-26 22:31:32 [INFO] Setting query port to 19145\n2016-01-26 22:31:32 [INFO] Query running on 0.0.0.0:19145\n2016-01-26 22:31:32 [INFO] Default game type: SURVIVAL\n2016-01-26 22:31:32 [INFO] Done (2.683s)! For help, type \"help\" or \"?\"\n2016-01-26 22:31:40 [INFO] CONSOLE: Stopping the server...\n2016-01-26 22:31:40 [INFO] Disabling DevTools v1.10.0\n2016-01-26 22:31:40 [INFO] Disabling Glifcos-p v1.0.0\n2016-01-26 22:31:40 [INFO] Unloading level \"world\"\n2016-01-26 22:31:40 [INFO] Stopping other threads\n2016-01-26 22:33:14 [INFO] Starting Minecraft: PE server version v0.10.5 alpha\n2016-01-26 22:33:14 [INFO] Loading pocketmine.yml...\n2016-01-26 22:33:14 [INFO] Loading server properties...\n2016-01-26 22:33:14 [INFO] Starting Minecraft PE server on 0.0.0.0:19145\n2016-01-26 22:33:14 [INFO] This server is running PocketMine-MP version 1.4.1-980 \"\u7d76\u597d(Zekkou)\u30b1\u30fc\u30ad(Cake)\" (API 1.11.0)\n2016-01-26 22:33:14 [INFO] PocketMine-MP is distributed under the LGPL License\n2016-01-26 22:33:14 [INFO] Loading DevTools v1.10.0\n2016-01-26 22:33:15 [INFO] Enabling DevTools v1.10.0\n2016-01-26 22:33:15 [INFO] Loading source plugin Glifcos-p v1.0.0\n2016-01-26 22:33:15 [INFO] [DevTools] Registered folder plugin loader\n2016-01-26 22:33:15 [INFO] Preparing level \"world\"\n2016-01-26 22:33:15 [INFO] Enabling Glifcos-p v1.0.0\n2016-01-26 22:33:15 [INFO] [Glifcos-p] Datasync sent to webserver.\n2016-01-26 22:33:15 [WARNING] InvalidArgumentException: \"fclose() expects parameter 1 to be resource, string given\" (E_WARNING) in \"\/glifcos-plugin\/src\/glifcos\/glifcos\" at line 52\n2016-01-26 22:33:15 [INFO] Disabling Glifcos-p v1.0.0\n2016-01-26 22:33:15 [INFO] Starting GS4 status listener\n2016-01-26 22:33:15 [INFO] Setting query port to 19145\n2016-01-26 22:33:15 [INFO] Query running on 0.0.0.0:19145\n2016-01-26 22:33:15 [INFO] Default game type: SURVIVAL\n2016-01-26 22:33:15 [INFO] Done (1.088s)! For help, type \"help\" or \"?\"\n2016-01-26 22:33:26 [INFO] CONSOLE: Stopping the server...\n2016-01-26 22:33:26 [INFO] Disabling DevTools v1.10.0\n2016-01-26 22:33:26 [INFO] Unloading level \"world\"\n2016-01-26 22:33:26 [INFO] Stopping other threads\n2016-01-26 22:33:48 [INFO] Starting Minecraft: PE server version v0.10.5 alpha\n2016-01-26 22:33:48 [INFO] Loading pocketmine.yml...\n2016-01-26 22:33:48 [INFO] Loading server properties...\n2016-01-26 22:33:48 [INFO] Starting Minecraft PE server on 0.0.0.0:19145\n2016-01-26 22:33:48 [INFO] This server is running PocketMine-MP version 1.4.1-980 \"\u7d76\u597d(Zekkou)\u30b1\u30fc\u30ad(Cake)\" (API 1.11.0)\n2016-01-26 22:33:48 [INFO] PocketMine-MP is distributed under the LGPL License\n2016-01-26 22:33:49 [INFO] Loading DevTools v1.10.0\n2016-01-26 22:33:49 [INFO] Enabling DevTools v1.10.0\n2016-01-26 22:33:49 [INFO] Loading source plugin Glifcos-p v1.0.0\n2016-01-26 22:33:49 [INFO] [DevTools] Registered folder plugin loader\n2016-01-26 22:33:49 [INFO] Preparing level \"world\"\n2016-01-26 22:33:49 [INFO] Enabling Glifcos-p v1.0.0\n2016-01-26 22:33:49 [INFO] [Glifcos-p] Datasync sent to webserver.\n2016-01-26 22:33:49 [WARNING] InvalidArgumentException: \"fclose() expects parameter 1 to be resource, string given\" (E_WARNING) in \"\/glifcos-plugin\/src\/glifcos\/glifcos\" at line 52\n2016-01-26 22:33:49 [INFO] Disabling Glifcos-p v1.0.0\n2016-01-26 22:33:49 [INFO] Starting GS4 status listener\n2016-01-26 22:33:49 [INFO] Setting query port to 19145\n2016-01-26 22:33:49 [INFO] Query running on 0.0.0.0:19145\n2016-01-26 22:33:49 [INFO] Default game type: SURVIVAL\n2016-01-26 22:33:49 [INFO] Done (1.063s)! For help, type \"help\" or \"?\"\n2016-01-26 22:34:38 [INFO] Unknown command. Type \"help\" for help.\n2016-01-26 22:34:39 [INFO] CONSOLE: Stopping the server...\n2016-01-26 22:34:39 [INFO] Disabling DevTools v1.10.0\n2016-01-26 22:34:39 [INFO] Unloading level \"world\"\n2016-01-26 22:34:39 [INFO] Stopping other threads\n2016-01-26 22:34:40 [INFO] Starting Minecraft: PE server version v0.10.5 alpha\n2016-01-26 22:34:40 [INFO] Loading pocketmine.yml...\n2016-01-26 22:34:40 [INFO] Loading server properties...\n2016-01-26 22:34:40 [INFO] Starting Minecraft PE server on 0.0.0.0:19145\n2016-01-26 22:34:40 [INFO] This server is running PocketMine-MP version 1.4.1-980 \"\u7d76\u597d(Zekkou)\u30b1\u30fc\u30ad(Cake)\" (API 1.11.0)\n2016-01-26 22:34:40 [INFO] PocketMine-MP is distributed under the LGPL License\n2016-01-26 22:34:40 [INFO] Loading DevTools v1.10.0\n2016-01-26 22:34:41 [INFO] Enabling DevTools v1.10.0\n2016-01-26 22:34:41 [INFO] Loading source plugin Glifcos-p v1.0.0\n2016-01-26 22:34:41 [INFO] [DevTools] Registered folder plugin loader\n2016-01-26 22:34:41 [INFO] Preparing level \"world\"\n2016-01-26 22:34:41 [INFO] Enabling Glifcos-p v1.0.0\n2016-01-26 22:34:41 [INFO] [Glifcos-p] Datasync sent to webserver.\n2016-01-26 22:34:41 [INFO] Starting GS4 status listener\n2016-01-26 22:34:41 [INFO] Setting query port to 19145\n2016-01-26 22:34:41 [INFO] Query running on 0.0.0.0:19145\n2016-01-26 22:34:41 [INFO] Default game type: SURVIVAL\n2016-01-26 22:34:41 [INFO] Done (0.983s)! For help, type \"help\" or \"?\"\n2016-01-26 22:35:55 [INFO] CONSOLE: Stopping the server...\n2016-01-26 22:35:55 [INFO] Disabling DevTools v1.10.0\n2016-01-26 22:35:55 [INFO] Disabling Glifcos-p v1.0.0\n2016-01-26 22:35:55 [INFO] Unloading level \"world\"\n2016-01-26 22:35:55 [INFO] Stopping other threads\n2016-01-26 22:46:45 [INFO] Starting Minecraft: PE server version v0.10.5 alpha\n2016-01-26 22:46:45 [INFO] Loading pocketmine.yml...\n2016-01-26 22:46:45 [INFO] Loading server properties...\n2016-01-26 22:46:45 [INFO] Starting Minecraft PE server on 0.0.0.0:19145\n2016-01-26 22:46:45 [INFO] This server is running PocketMine-MP version 1.4.1-980 \"\u7d76\u597d(Zekkou)\u30b1\u30fc\u30ad(Cake)\" (API 1.11.0)\n2016-01-26 22:46:45 [INFO] PocketMine-MP is distributed under the LGPL License\n2016-01-26 22:46:45 [INFO] Loading DevTools v1.10.0\n2016-01-26 22:46:45 [INFO] Enabling DevTools v1.10.0\n2016-01-26 22:46:45 [INFO] Loading source plugin Glifcos-p v1.0.0\n2016-01-26 22:46:45 [INFO] [DevTools] Registered folder plugin loader\n2016-01-26 22:46:45 [INFO] Preparing level \"world\"\n2016-01-26 22:46:45 [INFO] Enabling Glifcos-p v1.0.0\n2016-01-26 22:46:46 [INFO] [Glifcos-p] Datasync sent to webserver.\n2016-01-26 22:46:47 [INFO] Starting GS4 status listener\n2016-01-26 22:46:47 [INFO] Setting query port to 19145\n2016-01-26 22:46:47 [INFO] Query running on 0.0.0.0:19145\n2016-01-26 22:46:47 [INFO] Default game type: SURVIVAL\n2016-01-26 22:46:47 [INFO] Done (1.807s)! For help, type \"help\" or \"?\"\n2016-01-26 22:46:56 [INFO] CONSOLE: Stopping the server...\n2016-01-26 22:46:56 [INFO] Disabling DevTools v1.10.0\n2016-01-26 22:46:56 [INFO] Disabling Glifcos-p v1.0.0\n2016-01-26 22:46:56 [INFO] Unloading level \"world\"\n2016-01-26 22:46:56 [INFO] Stopping other threads\n2016-01-26 22:56:51 [INFO] Starting Minecraft: PE server version v0.10.5 alpha\n2016-01-26 22:56:51 [INFO] Loading pocketmine.yml...\n2016-01-26 22:56:51 [INFO] Loading server properties...\n2016-01-26 22:56:51 [INFO] Starting Minecraft PE server on 0.0.0.0:19145\n2016-01-26 22:56:51 [INFO] This server is running PocketMine-MP version 1.4.1-980 \"\u7d76\u597d(Zekkou)\u30b1\u30fc\u30ad(Cake)\" (API 1.11.0)\n2016-01-26 22:56:51 [INFO] PocketMine-MP is distributed under the LGPL License\n2016-01-26 22:56:51 [INFO] Loading DevTools v1.10.0\n2016-01-26 22:56:51 [INFO] Enabling DevTools v1.10.0\n2016-01-26 22:56:51 [INFO] Loading source plugin Glifcos-p v1.0.0\n2016-01-26 22:56:51 [INFO] [DevTools] Registered folder plugin loader\n2016-01-26 22:56:52 [INFO] Preparing level \"world\"\n2016-01-26 22:56:52 [INFO] Enabling Glifcos-p v1.0.0\n2016-01-26 22:56:52 [INFO] [Glifcos-p] Datasync sent to webserver.\n2016-01-26 22:56:53 [INFO] Starting GS4 status listener\n2016-01-26 22:56:53 [INFO] Setting query port to 19145\n2016-01-26 22:56:53 [INFO] Query running on 0.0.0.0:19145\n2016-01-26 22:56:53 [INFO] Default game type: SURVIVAL\n2016-01-26 22:56:53 [INFO] Done (1.566s)! For help, type \"help\" or \"?\"\n2016-01-26 22:56:55 [CRITICAL] Could not execute task glifcos\\mainw\\synctask: Array to string conversion\n2016-01-26 22:56:55 [NOTICE] RuntimeException: \"Array to string conversion\" (E_NOTICE) in \"\/glifcos-plugin\/src\/glifcos\/mainw\/synctask\" at line 20\n2016-01-26 22:56:57 [CRITICAL] Could not execute task glifcos\\mainw\\synctask: Array to string conversion\n2016-01-26 22:56:57 [NOTICE] RuntimeException: \"Array to string conversion\" (E_NOTICE) in \"\/glifcos-plugin\/src\/glifcos\/mainw\/synctask\" at line 20\n2016-01-26 22:57:00 [CRITICAL] Could not execute task glifcos\\mainw\\synctask: Array to string conversion\n2016-01-26 22:57:00 [NOTICE] RuntimeException: \"Array to string conversion\" (E_NOTICE) in \"\/glifcos-plugin\/src\/glifcos\/mainw\/synctask\" at line 20\n2016-01-26 22:57:02 [CRITICAL] Could not execute task glifcos\\mainw\\synctask: Array to string conversion\n2016-01-26 22:57:02 [NOTICE] RuntimeException: \"Array to string conversion\" (E_NOTICE) in \"\/glifcos-plugin\/src\/glifcos\/mainw\/synctask\" at line 20\n2016-01-26 22:57:03 [INFO] CONSOLE: Stopping the server...\n2016-01-26 22:57:03 [INFO] Disabling DevTools v1.10.0\n2016-01-26 22:57:03 [INFO] Disabling Glifcos-p v1.0.0\n2016-01-26 22:57:03 [INFO] Unloading level \"world\"\n2016-01-26 22:57:03 [INFO] Stopping other threads\n2016-01-26 22:58:09 [INFO] Starting Minecraft: PE server version v0.10.5 alpha\n2016-01-26 22:58:09 [INFO] Loading pocketmine.yml...\n2016-01-26 22:58:09 [INFO] Loading server properties...\n2016-01-26 22:58:09 [INFO] Starting Minecraft PE server on 0.0.0.0:19145\n2016-01-26 22:58:09 [INFO] This server is running PocketMine-MP version 1.4.1-980 \"\u7d76\u597d(Zekkou)\u30b1\u30fc\u30ad(Cake)\" (API 1.11.0)\n2016-01-26 22:58:09 [INFO] PocketMine-MP is distributed under the LGPL License\n2016-01-26 22:58:09 [INFO] Loading DevTools v1.10.0\n2016-01-26 22:58:09 [INFO] Enabling DevTools v1.10.0\n2016-01-26 22:58:09 [INFO] Loading source plugin Glifcos-p v1.0.0\n2016-01-26 22:58:09 [INFO] [DevTools] Registered folder plugin loader\n2016-01-26 22:58:09 [INFO] Preparing level \"world\"\n2016-01-26 22:58:09 [INFO] Enabling Glifcos-p v1.0.0\n2016-01-26 22:58:10 [INFO] [Glifcos-p] Datasync sent to webserver.\n2016-01-26 22:58:10 [INFO] Starting GS4 status listener\n2016-01-26 22:58:10 [INFO] Setting query port to 19145\n2016-01-26 22:58:10 [INFO] Query running on 0.0.0.0:19145\n2016-01-26 22:58:10 [INFO] Default game type: SURVIVAL\n2016-01-26 22:58:10 [INFO] Done (1.099s)! For help, type \"help\" or \"?\"\n2016-01-26 22:58:12 [CRITICAL] Could not execute task glifcos\\mainw\\synctask: Array to string conversion\n2016-01-26 22:58:12 [NOTICE] RuntimeException: \"Array to string conversion\" (E_NOTICE) in \"\/glifcos-plugin\/src\/glifcos\/mainw\/synctask\" at line 20\n2016-01-26 22:58:15 [CRITICAL] Could not execute task glifcos\\mainw\\synctask: Array to string conversion\n2016-01-26 22:58:15 [NOTICE] RuntimeException: \"Array to string conversion\" (E_NOTICE) in \"\/glifcos-plugin\/src\/glifcos\/mainw\/synctask\" at line 20\n2016-01-26 22:58:15 [INFO] CONSOLE: Stopping the server...\n2016-01-26 22:58:15 [INFO] Disabling DevTools v1.10.0\n2016-01-26 22:58:15 [INFO] Disabling Glifcos-p v1.0.0\n2016-01-26 22:58:15 [INFO] Unloading level \"world\"\n2016-01-26 22:58:15 [INFO] Stopping other threads\n2016-01-26 22:59:17 [INFO] Starting Minecraft: PE server version v0.10.5 alpha\n2016-01-26 22:59:17 [INFO] Loading pocketmine.yml...\n2016-01-26 22:59:17 [INFO] Loading server properties...\n2016-01-26 22:59:17 [INFO] Starting Minecraft PE server on 0.0.0.0:19145\n2016-01-26 22:59:17 [INFO] This server is running PocketMine-MP version 1.4.1-980 \"\u7d76\u597d(Zekkou)\u30b1\u30fc\u30ad(Cake)\" (API 1.11.0)\n2016-01-26 22:59:17 [INFO] PocketMine-MP is distributed under the LGPL License\n2016-01-26 22:59:17 [INFO] Loading DevTools v1.10.0\n2016-01-26 22:59:17 [INFO] Enabling DevTools v1.10.0\n2016-01-26 22:59:17 [INFO] Loading source plugin Glifcos-p v1.0.0\n2016-01-26 22:59:17 [INFO] [DevTools] Registered folder plugin loader\n2016-01-26 22:59:18 [INFO] Preparing level \"world\"\n2016-01-26 22:59:18 [INFO] Enabling Glifcos-p v1.0.0\n2016-01-26 22:59:18 [INFO] [Glifcos-p] Datasync sent to webserver.\n2016-01-26 22:59:18 [INFO] Starting GS4 status listener\n2016-01-26 22:59:18 [INFO] Setting query port to 19145\n2016-01-26 22:59:18 [INFO] Query running on 0.0.0.0:19145\n2016-01-26 22:59:18 [INFO] Default game type: SURVIVAL\n2016-01-26 22:59:18 [INFO] Done (1.1s)! For help, type \"help\" or \"?\"\n2016-01-26 22:59:21 [INFO] CONSOLE: Stopping the server...\n2016-01-26 22:59:21 [INFO] Disabling DevTools v1.10.0\n2016-01-26 22:59:21 [INFO] Disabling Glifcos-p v1.0.0\n2016-01-26 22:59:21 [INFO] Unloading level \"world\"\n2016-01-26 22:59:21 [INFO] Stopping other threads\n2016-01-26 23:16:29 [INFO] Starting Minecraft: PE server version v0.10.5 alpha\n2016-01-26 23:16:29 [INFO] Loading pocketmine.yml...\n2016-01-26 23:16:29 [INFO] Loading server properties...\n2016-01-26 23:16:29 [INFO] Starting Minecraft PE server on 0.0.0.0:19145\n2016-01-26 23:16:29 [INFO] This server is running PocketMine-MP version 1.4.1-980 \"\u7d76\u597d(Zekkou)\u30b1\u30fc\u30ad(Cake)\" (API 1.11.0)\n2016-01-26 23:16:29 [INFO] PocketMine-MP is distributed under the LGPL License\n2016-01-26 23:16:29 [INFO] Loading DevTools v1.10.0\n2016-01-26 23:16:29 [INFO] Enabling DevTools v1.10.0\n2016-01-26 23:16:29 [INFO] Loading source plugin Glifcos-p v1.0.0\n2016-01-26 23:16:29 [INFO] [DevTools] Registered folder plugin loader\n2016-01-26 23:16:29 [INFO] Preparing level \"world\"\n2016-01-26 23:16:29 [INFO] Enabling Glifcos-p v1.0.0\n2016-01-26 23:16:30 [INFO] [Glifcos-p] Datasync sent to webserver.\n2016-01-26 23:16:30 [INFO] Starting GS4 status listener\n2016-01-26 23:16:30 [INFO] Setting query port to 19145\n2016-01-26 23:16:30 [INFO] Query running on 0.0.0.0:19145\n2016-01-26 23:16:30 [INFO] Default game type: SURVIVAL\n2016-01-26 23:16:30 [INFO] Done (1.234s)! For help, type \"help\" or \"?\"\n2016-01-26 23:16:41 [INFO] Starting Minecraft: PE server version v0.10.5 alpha\n2016-01-26 23:16:41 [INFO] Loading pocketmine.yml...\n2016-01-26 23:16:41 [INFO] Loading server properties...\n2016-01-26 23:16:41 [INFO] Starting Minecraft PE server on 0.0.0.0:19145\n2016-01-26 23:16:41 [INFO] This server is running PocketMine-MP version 1.4.1-980 \"\u7d76\u597d(Zekkou)\u30b1\u30fc\u30ad(Cake)\" (API 1.11.0)\n2016-01-26 23:16:41 [INFO] PocketMine-MP is distributed under the LGPL License\n2016-01-26 23:16:41 [INFO] Loading DevTools v1.10.0\n2016-01-26 23:16:41 [INFO] Enabling DevTools v1.10.0\n2016-01-26 23:16:41 [INFO] Loading source plugin Glifcos-p v1.0.0\n2016-01-26 23:16:41 [INFO] [DevTools] Registered folder plugin loader\n2016-01-26 23:16:41 [INFO] Preparing level \"world\"\n2016-01-26 23:16:41 [INFO] Enabling Glifcos-p v1.0.0\n2016-01-26 23:16:42 [INFO] [Glifcos-p] Datasync sent to webserver.\n2016-01-26 23:16:42 [INFO] Starting GS4 status listener\n2016-01-26 23:16:42 [INFO] Setting query port to 19145\n2016-01-26 23:16:42 [INFO] Query running on 0.0.0.0:19145\n2016-01-26 23:16:42 [INFO] Default game type: SURVIVAL\n2016-01-26 23:16:42 [INFO] Done (1.075s)! For help, type \"help\" or \"?\"\n2016-01-26 23:16:46 [INFO] CONSOLE: Stopping the server...\n2016-01-26 23:16:46 [INFO] Disabling DevTools v1.10.0\n2016-01-26 23:16:46 [INFO] Disabling Glifcos-p v1.0.0\n2016-01-26 23:16:46 [INFO] Unloading level \"world\"\n2016-01-26 23:16:46 [INFO] Stopping other threads\n2016-01-26 23:23:27 [INFO] Starting Minecraft: PE server version v0.10.5 alpha\n2016-01-26 23:23:27 [INFO] Loading pocketmine.yml...\n2016-01-26 23:23:27 [INFO] Loading server properties...\n2016-01-26 23:23:27 [INFO] Starting Minecraft PE server on 0.0.0.0:19145\n2016-01-26 23:23:27 [INFO] This server is running PocketMine-MP version 1.4.1-980 \"\u7d76\u597d(Zekkou)\u30b1\u30fc\u30ad(Cake)\" (API 1.11.0)\n2016-01-26 23:23:27 [INFO] PocketMine-MP is distributed under the LGPL License\n2016-01-26 23:23:27 [INFO] Loading DevTools v1.10.0\n2016-01-26 23:23:27 [INFO] Enabling DevTools v1.10.0\n2016-01-26 23:23:27 [INFO] Loading source plugin Glifcos-p v1.0.0\n2016-01-26 23:23:27 [INFO] [DevTools] Registered folder plugin loader\n2016-01-26 23:23:27 [INFO] Preparing level \"world\"\n2016-01-26 23:23:27 [INFO] Enabling Glifcos-p v1.0.0\n2016-01-26 23:23:29 [INFO] [Glifcos-p] Datasync sent to webserver.\n2016-01-26 23:23:29 [INFO] Starting GS4 status listener\n2016-01-26 23:23:29 [INFO] Setting query port to 19145\n2016-01-26 23:23:29 [INFO] Query running on 0.0.0.0:19145\n2016-01-26 23:23:29 [INFO] Default game type: SURVIVAL\n2016-01-26 23:23:29 [INFO] Done (2.41s)! For help, type \"help\" or \"?\"\n2016-01-26 23:23:30 [CRITICAL] Could not execute task glifcos\\mainw\\synctask: fopen() expects at least 2 parameters, 1 given\n2016-01-26 23:23:30 [WARNING] RuntimeException: \"fopen() expects at least 2 parameters, 1 given\" (E_WARNING) in \"\/glifcos-plugin\/src\/glifcos\/mainw\/synctask\" at line 21\n2016-01-26 23:23:31 [CRITICAL] Could not execute task glifcos\\mainw\\synctask: fopen() expects at least 2 parameters, 1 given\n2016-01-26 23:23:31 [WARNING] RuntimeException: \"fopen() expects at least 2 parameters, 1 given\" (E_WARNING) in \"\/glifcos-plugin\/src\/glifcos\/mainw\/synctask\" at line 21\n2016-01-26 23:23:32 [CRITICAL] Could not execute task glifcos\\mainw\\synctask: fopen() expects at least 2 parameters, 1 given\n2016-01-26 23:23:32 [WARNING] RuntimeException: \"fopen() expects at least 2 parameters, 1 given\" (E_WARNING) in \"\/glifcos-plugin\/src\/glifcos\/mainw\/synctask\" at line 21\n2016-01-26 23:23:33 [CRITICAL] Could not execute task glifcos\\mainw\\synctask: fopen() expects at least 2 parameters, 1 given\n2016-01-26 23:23:33 [WARNING] RuntimeException: \"fopen() expects at least 2 parameters, 1 given\" (E_WARNING) in \"\/glifcos-plugin\/src\/glifcos\/mainw\/synctask\" at line 21\n2016-01-26 23:23:33 [INFO] CONSOLE: Stopping the server...\n2016-01-26 23:23:33 [INFO] Disabling DevTools v1.10.0\n2016-01-26 23:23:33 [INFO] Disabling Glifcos-p v1.0.0\n2016-01-26 23:23:33 [INFO] Unloading level \"world\"\n2016-01-26 23:23:33 [INFO] Stopping other threads\n2016-01-26 23:23:40 [INFO] Starting Minecraft: PE server version v0.10.5 alpha\n2016-01-26 23:23:40 [INFO] Loading pocketmine.yml...\n2016-01-26 23:23:40 [INFO] Loading server properties...\n2016-01-26 23:23:40 [INFO] Starting Minecraft PE server on 0.0.0.0:19145\n2016-01-26 23:23:40 [INFO] This server is running PocketMine-MP version 1.4.1-980 \"\u7d76\u597d(Zekkou)\u30b1\u30fc\u30ad(Cake)\" (API 1.11.0)\n2016-01-26 23:23:40 [INFO] PocketMine-MP is distributed under the LGPL License\n2016-01-26 23:23:40 [INFO] Loading DevTools v1.10.0\n2016-01-26 23:23:41 [INFO] Enabling DevTools v1.10.0\n2016-01-26 23:23:41 [INFO] Loading source plugin Glifcos-p v1.0.0\n2016-01-26 23:23:41 [INFO] [DevTools] Registered folder plugin loader\n2016-01-26 23:23:41 [INFO] Preparing level \"world\"\n2016-01-26 23:23:41 [INFO] Enabling Glifcos-p v1.0.0\n2016-01-26 23:23:41 [INFO] [Glifcos-p] Datasync sent to webserver.\n2016-01-26 23:23:41 [INFO] Starting GS4 status listener\n2016-01-26 23:23:41 [INFO] Setting query port to 19145\n2016-01-26 23:23:41 [INFO] Query running on 0.0.0.0:19145\n2016-01-26 23:23:41 [INFO] Default game type: SURVIVAL\n2016-01-26 23:23:41 [INFO] Done (0.977s)! For help, type \"help\" or \"?\"\n2016-01-26 23:23:47 [INFO] CONSOLE: Stopping the server...\n2016-01-26 23:23:47 [INFO] Disabling DevTools v1.10.0\n2016-01-26 23:23:47 [INFO] Disabling Glifcos-p v1.0.0\n2016-01-26 23:23:47 [INFO] Unloading level \"world\"\n2016-01-26 23:23:47 [INFO] Stopping other threads\n2016-01-26 23:27:19 [INFO] Starting Minecraft: PE server version v0.10.5 alpha\n2016-01-26 23:27:19 [INFO] Loading pocketmine.yml...\n2016-01-26 23:27:19 [INFO] Loading server properties...\n2016-01-26 23:27:19 [INFO] Starting Minecraft PE server on 0.0.0.0:19145\n2016-01-26 23:27:19 [INFO] This server is running PocketMine-MP version 1.4.1-980 \"\u7d76\u597d(Zekkou)\u30b1\u30fc\u30ad(Cake)\" (API 1.11.0)\n2016-01-26 23:27:19 [INFO] PocketMine-MP is distributed under the LGPL License\n2016-01-26 23:27:19 [INFO] Loading DevTools v1.10.0\n2016-01-26 23:27:20 [INFO] Enabling DevTools v1.10.0\n2016-01-26 23:27:20 [INFO] Loading source plugin Glifcos-p v1.0.0\n2016-01-26 23:27:20 [INFO] [DevTools] Registered folder plugin loader\n2016-01-26 23:27:20 [INFO] Preparing level \"world\"\n2016-01-26 23:27:20 [INFO] Enabling Glifcos-p v1.0.0\n2016-01-26 23:27:20 [INFO] [Glifcos-p] Datasync sent to webserver.\n2016-01-26 23:27:20 [INFO] Starting GS4 status listener\n2016-01-26 23:27:20 [INFO] Setting query port to 19145\n2016-01-26 23:27:20 [INFO] Query running on 0.0.0.0:19145\n2016-01-26 23:27:20 [INFO] Default game type: SURVIVAL\n2016-01-26 23:27:20 [INFO] Done (1.115s)! For help, type \"help\" or \"?\"\n2016-01-27 03:21:56 [CRITICAL] Could not execute task glifcos\\mainw\\synctask: fopen(http:\/\/www.glifcos-hotfireydeath.c9users.io\/glifcos-webserver\/connection.php?type=memsync&cm=27&tm=512): failed to open stream: HTTP request failed! HTTP\/1.1 503 Service Unavailable\r\n\n2016-01-27 03:21:56 [WARNING] RuntimeException: \"fopen(http:\/\/www.glifcos-hotfireydeath.c9users.io\/glifcos-webserver\/connection.php?type=memsync&cm=27&tm=512): failed to open stream: HTTP request failed! HTTP\/1.1 503 Service Unavailable\r\" (E_WARNING) in \"\/glifcos-plugin\/src\/glifcos\/mainw\/synctask\" at line 21\n2016-01-27 03:22:08 [INFO] CONSOLE: Stopping the server...\n2016-01-27 03:22:08 [INFO] Disabling DevTools v1.10.0\n2016-01-27 03:22:08 [INFO] Disabling Glifcos-p v1.0.0\n2016-01-27 03:22:08 [INFO] Unloading level \"world\"\n2016-01-27 03:22:08 [INFO] Stopping other threads\n2016-01-27 03:38:55 [INFO] Starting Minecraft: PE server version v0.10.5 alpha\n2016-01-27 03:38:55 [INFO] Loading pocketmine.yml...\n2016-01-27 03:38:55 [INFO] Loading server properties...\n2016-01-27 03:38:55 [INFO] Starting Minecraft PE server on 0.0.0.0:19145\n2016-01-27 03:38:55 [INFO] This server is running PocketMine-MP version 1.4.1-980 \"\u7d76\u597d(Zekkou)\u30b1\u30fc\u30ad(Cake)\" (API 1.11.0)\n2016-01-27 03:38:55 [INFO] PocketMine-MP is distributed under the LGPL License\n2016-01-27 03:38:55 [INFO] Loading DevTools v1.10.0\n2016-01-27 03:38:55 [INFO] Enabling DevTools v1.10.0\n2016-01-27 03:38:55 [INFO] Loading source plugin Glifcos-p v1.0.0\n2016-01-27 03:38:55 [INFO] [DevTools] Registered folder plugin loader\n2016-01-27 03:38:55 [INFO] Preparing level \"world\"\n2016-01-27 03:38:55 [INFO] Enabling Glifcos-p v1.0.0\n2016-01-27 03:38:56 [INFO] [Glifcos-p] Datasync sent to webserver.\n2016-01-27 03:38:56 [INFO] Starting GS4 status listener\n2016-01-27 03:38:56 [INFO] Setting query port to 19145\n2016-01-27 03:38:56 [INFO] Query running on 0.0.0.0:19145\n2016-01-27 03:38:56 [INFO] Default game type: SURVIVAL\n2016-01-27 03:38:56 [INFO] Done (1.156s)! For help, type \"help\" or \"?\"\n2016-01-27 03:45:57 [INFO] CONSOLE: Stopping the server...\n2016-01-27 03:45:57 [INFO] Disabling DevTools v1.10.0\n2016-01-27 03:45:57 [INFO] Disabling Glifcos-p v1.0.0\n2016-01-27 03:45:57 [INFO] [Glifcos-p] Datasync sent to webserver.\n2016-01-27 03:45:57 [INFO] Unloading level \"world\"\n2016-01-27 03:45:57 [INFO] Stopping other threads\n2016-01-27 03:46:04 [INFO] Starting Minecraft: PE server version v0.10.5 alpha\n2016-01-27 03:46:04 [INFO] Loading pocketmine.yml...\n2016-01-27 03:46:04 [INFO] Loading server properties...\n2016-01-27 03:46:04 [INFO] Starting Minecraft PE server on 0.0.0.0:19145\n2016-01-27 03:46:04 [INFO] This server is running PocketMine-MP version 1.4.1-980 \"\u7d76\u597d(Zekkou)\u30b1\u30fc\u30ad(Cake)\" (API 1.11.0)\n2016-01-27 03:46:04 [INFO] PocketMine-MP is distributed under the LGPL License\n2016-01-27 03:46:05 [INFO] Loading DevTools v1.10.0\n2016-01-27 03:46:05 [INFO] Enabling DevTools v1.10.0\n2016-01-27 03:46:05 [INFO] Loading source plugin Glifcos-p v1.0.0\n2016-01-27 03:46:05 [INFO] [DevTools] Registered folder plugin loader\n2016-01-27 03:46:05 [INFO] Preparing level \"world\"\n2016-01-27 03:46:05 [INFO] Enabling Glifcos-p v1.0.0\n2016-01-27 03:46:06 [INFO] [Glifcos-p] Datasync sent to webserver.\n2016-01-27 03:46:06 [INFO] Starting GS4 status listener\n2016-01-27 03:46:06 [INFO] Setting query port to 19145\n2016-01-27 03:46:06 [INFO] Query running on 0.0.0.0:19145\n2016-01-27 03:46:06 [INFO] Default game type: SURVIVAL\n2016-01-27 03:46:06 [INFO] Done (1.614s)! For help, type \"help\" or \"?\"\n2016-01-27 03:46:08 [INFO] CONSOLE: Stopping the server...\n2016-01-27 03:46:08 [INFO] Disabling DevTools v1.10.0\n2016-01-27 03:46:08 [INFO] Disabling Glifcos-p v1.0.0\n2016-01-27 03:46:08 [INFO] [Glifcos-p] Datasync sent to webserver.\n2016-01-27 03:46:08 [INFO] Unloading level \"world\"\n2016-01-27 03:46:08 [INFO] Stopping other threads\n2016-01-27 03:48:07 [INFO] Starting Minecraft: PE server version v0.10.5 alpha\n2016-01-27 03:48:07 [INFO] Loading pocketmine.yml...\n2016-01-27 03:48:07 [INFO] Loading server properties...\n2016-01-27 03:48:07 [INFO] Starting Minecraft PE server on 0.0.0.0:19145\n2016-01-27 03:48:07 [INFO] This server is running PocketMine-MP version 1.4.1-980 \"\u7d76\u597d(Zekkou)\u30b1\u30fc\u30ad(Cake)\" (API 1.11.0)\n2016-01-27 03:48:07 [INFO] PocketMine-MP is distributed under the LGPL License\n2016-01-27 03:48:08 [INFO] Loading DevTools v1.10.0\n2016-01-27 03:48:08 [INFO] Enabling DevTools v1.10.0\n2016-01-27 03:48:08 [INFO] Loading source plugin Glifcos-p v1.0.0\n2016-01-27 03:48:08 [INFO] [DevTools] Registered folder plugin loader\n2016-01-27 03:48:08 [INFO] Preparing level \"world\"\n2016-01-27 03:48:08 [INFO] Enabling Glifcos-p v1.0.0\n2016-01-27 03:48:08 [INFO] [Glifcos-p] Datasync sent to webserver.\n2016-01-27 03:48:09 [INFO] Starting GS4 status listener\n2016-01-27 03:48:09 [INFO] Setting query port to 19145\n2016-01-27 03:48:09 [INFO] Query running on 0.0.0.0:19145\n2016-01-27 03:48:09 [INFO] Default game type: SURVIVAL\n2016-01-27 03:48:09 [INFO] Done (1.123s)! For help, type \"help\" or \"?\"\n2016-01-27 03:48:20 [INFO] CONSOLE: Stopping the server...\n2016-01-27 03:48:20 [INFO] Disabling DevTools v1.10.0\n2016-01-27 03:48:20 [INFO] Disabling Glifcos-p v1.0.0\n2016-01-27 03:48:20 [INFO] [Glifcos-p] Datasync sent to webserver.\n2016-01-27 03:48:25 [INFO] Unloading level \"world\"\n2016-01-27 03:48:25 [INFO] Stopping other threads\n2016-01-27 03:57:57 [INFO] Starting Minecraft: PE server version v0.10.5 alpha\n2016-01-27 03:57:57 [INFO] Loading pocketmine.yml...\n2016-01-27 03:57:57 [INFO] Loading server properties...\n2016-01-27 03:57:57 [INFO] Starting Minecraft PE server on 0.0.0.0:19145\n2016-01-27 03:57:57 [INFO] This server is running PocketMine-MP version 1.4.1-980 \"\u7d76\u597d(Zekkou)\u30b1\u30fc\u30ad(Cake)\" (API 1.11.0)\n2016-01-27 03:57:57 [INFO] PocketMine-MP is distributed under the LGPL License\n2016-01-27 03:57:57 [INFO] Loading DevTools v1.10.0\n2016-01-27 03:57:57 [INFO] Enabling DevTools v1.10.0\n2016-01-27 03:57:57 [INFO] Loading source plugin Glifcos-p v1.0.0\n2016-01-27 03:57:57 [INFO] [DevTools] Registered folder plugin loader\n2016-01-27 03:57:57 [INFO] Preparing level \"world\"\n2016-01-27 03:57:57 [INFO] Enabling Glifcos-p v1.0.0\n2016-01-27 03:57:57 [INFO] [Glifcos-p] Datasync sent to webserver.\n2016-01-27 03:57:58 [INFO] Starting GS4 status listener\n2016-01-27 03:57:58 [INFO] Setting query port to 19145\n2016-01-27 03:57:58 [INFO] Query running on 0.0.0.0:19145\n2016-01-27 03:57:58 [INFO] Default game type: SURVIVAL\n2016-01-27 03:57:58 [INFO] Done (1.108s)! For help, type \"help\" or \"?\"\n2016-01-27 03:58:03 [INFO] CONSOLE: Stopping the server...\n2016-01-27 03:58:03 [INFO] Disabling DevTools v1.10.0\n2016-01-27 03:58:03 [INFO] Disabling Glifcos-p v1.0.0\n2016-01-27 03:58:03 [INFO] [Glifcos-p] Datasync sent to webserver.\n2016-01-27 03:58:03 [INFO] Unloading level \"world\"\n2016-01-27 03:58:03 [INFO] Stopping other threads\n2016-01-27 04:02:11 [INFO] Starting Minecraft: PE server version v0.10.5 alpha\n2016-01-27 04:02:11 [INFO] Loading pocketmine.yml...\n2016-01-27 04:02:11 [INFO] Loading server properties...\n2016-01-27 04:02:11 [INFO] Starting Minecraft PE server on 0.0.0.0:19145\n2016-01-27 04:02:11 [INFO] This server is running PocketMine-MP version 1.4.1-980 \"\u7d76\u597d(Zekkou)\u30b1\u30fc\u30ad(Cake)\" (API 1.11.0)\n2016-01-27 04:02:11 [INFO] PocketMine-MP is distributed under the LGPL License\n2016-01-27 04:02:11 [INFO] Loading DevTools v1.10.0\n2016-01-27 04:02:12 [INFO] Enabling DevTools v1.10.0\n2016-01-27 04:02:12 [INFO] Loading source plugin Glifcos-p v1.0.0\n2016-01-27 04:02:12 [INFO] [DevTools] Registered folder plugin loader\n2016-01-27 04:02:12 [INFO] Preparing level \"world\"\n2016-01-27 04:02:12 [INFO] Enabling Glifcos-p v1.0.0\n2016-01-27 04:02:12 [INFO] [Glifcos-p] Datasync sent to webserver.\n2016-01-27 04:02:12 [INFO] Starting GS4 status listener\n2016-01-27 04:02:12 [INFO] Setting query port to 19145\n2016-01-27 04:02:12 [INFO] Query running on 0.0.0.0:19145\n2016-01-27 04:02:12 [INFO] Default game type: SURVIVAL\n2016-01-27 04:02:12 [INFO] Done (1.044s)! For help, type \"help\" or \"?\"\n2016-01-27 04:03:05 [INFO] CONSOLE: Stopping the server...\n2016-01-27 04:03:05 [INFO] Disabling DevTools v1.10.0\n2016-01-27 04:03:05 [INFO] Disabling Glifcos-p v1.0.0\n2016-01-27 04:03:05 [INFO] [Glifcos-p] Datasync sent to webserver.\n2016-01-27 04:03:06 [INFO] Unloading level \"world\"\n2016-01-27 04:03:06 [INFO] Stopping other threads\n2016-01-27 04:03:20 [INFO] Starting Minecraft: PE server version v0.10.5 alpha\n2016-01-27 04:03:20 [INFO] Loading pocketmine.yml...\n2016-01-27 04:03:20 [INFO] Loading server properties...\n2016-01-27 04:03:20 [INFO] Starting Minecraft PE server on 0.0.0.0:19145\n2016-01-27 04:03:20 [INFO] This server is running PocketMine-MP version 1.4.1-980 \"\u7d76\u597d(Zekkou)\u30b1\u30fc\u30ad(Cake)\" (API 1.11.0)\n2016-01-27 04:03:20 [INFO] PocketMine-MP is distributed under the LGPL License\n2016-01-27 04:03:20 [INFO] Loading DevTools v1.10.0\n2016-01-27 04:03:20 [INFO] Loading Specter v0.2\n2016-01-27 04:03:20 [INFO] Enabling DevTools v1.10.0\n2016-01-27 04:03:20 [INFO] Loading source plugin Glifcos-p v1.0.0\n2016-01-27 04:03:20 [INFO] [DevTools] Registered folder plugin loader\n2016-01-27 04:03:21 [INFO] Preparing level \"world\"\n2016-01-27 04:03:21 [INFO] Enabling Specter v0.2\n2016-01-27 04:03:21 [INFO] Enabling Glifcos-p v1.0.0\n2016-01-27 04:03:21 [INFO] [Glifcos-p] Datasync sent to webserver.\n2016-01-27 04:03:21 [INFO] Starting GS4 status listener\n2016-01-27 04:03:21 [INFO] Setting query port to 19145\n2016-01-27 04:03:21 [INFO] Query running on 0.0.0.0:19145\n2016-01-27 04:03:21 [INFO] Default game type: SURVIVAL\n2016-01-27 04:03:21 [INFO] Done (1.027s)! For help, type \"help\" or \"?\"\n2016-01-27 04:15:30 [NOTICE] Player data not found for \"testman\", creating new profile\n2016-01-27 04:15:30 [INFO] TestMan[\/SPECTER:19133] logged in with entity id 1 at (world, 128, 64, 128)\n2016-01-27 04:15:30 [INFO] TestMan joined the game\n2016-01-27 04:15:30 [INFO] [Specter] To TestMan: TestMan joined the game\n2016-01-27 04:15:30 [INFO] Session started.\n2016-01-27 04:18:07 [INFO] CONSOLE: Stopping the server...\n2016-01-27 04:18:07 [INFO] Disabling DevTools v1.10.0\n2016-01-27 04:18:07 [INFO] Disabling Specter v0.2\n2016-01-27 04:18:07 [INFO] Disabling Glifcos-p v1.0.0\n2016-01-27 04:18:07 [INFO] [Glifcos-p] Datasync sent to webserver.\n2016-01-27 04:18:07 [INFO] TestMan has left the game\n2016-01-27 04:18:07 [INFO] TestMan[\/SPECTER:19133] logged out due to Server closed\n2016-01-27 04:18:07 [INFO] Unloading level \"world\"\n2016-01-27 04:18:07 [INFO] Stopping other threads\n2016-01-27 04:18:10 [INFO] Starting Minecraft: PE server version v0.10.5 alpha\n2016-01-27 04:18:10 [INFO] Loading pocketmine.yml...\n2016-01-27 04:18:10 [INFO] Loading server properties...\n2016-01-27 04:18:10 [INFO] Starting Minecraft PE server on 0.0.0.0:19145\n2016-01-27 04:18:10 [INFO] This server is running PocketMine-MP version 1.4.1-980 \"\u7d76\u597d(Zekkou)\u30b1\u30fc\u30ad(Cake)\" (API 1.11.0)\n2016-01-27 04:18:10 [INFO] PocketMine-MP is distributed under the LGPL License\n2016-01-27 04:18:10 [INFO] Loading DevTools v1.10.0\n2016-01-27 04:18:10 [INFO] Loading Specter v0.2\n2016-01-27 04:18:10 [INFO] Enabling DevTools v1.10.0\n2016-01-27 04:18:10 [INFO] Loading source plugin Glifcos-p v1.0.0\n2016-01-27 04:18:10 [INFO] [DevTools] Registered folder plugin loader\n2016-01-27 04:18:10 [INFO] Preparing level \"world\"\n2016-01-27 04:18:10 [INFO] Enabling Specter v0.2\n2016-01-27 04:18:10 [INFO] Enabling Glifcos-p v1.0.0\n2016-01-27 04:18:11 [INFO] [Glifcos-p] Datasync sent to webserver.\n2016-01-27 04:18:11 [INFO] Starting GS4 status listener\n2016-01-27 04:18:11 [INFO] Setting query port to 19145\n2016-01-27 04:18:11 [INFO] Query running on 0.0.0.0:19145\n2016-01-27 04:18:11 [INFO] Default game type: SURVIVAL\n2016-01-27 04:18:11 [INFO] Done (1.171s)! For help, type \"help\" or \"?\"\n2016-01-27 04:18:19 [INFO] TestMan[\/SPECTER:19133] logged in with entity id 1 at (world, 128, 64, 128)\n2016-01-27 04:18:19 [INFO] TestMan joined the game\n2016-01-27 04:18:19 [INFO] [Specter] To TestMan: TestMan joined the game\n2016-01-27 04:18:19 [INFO] Session started.\n2016-01-27 04:18:23 [INFO] CONSOLE: Stopping the server...\n2016-01-27 04:18:23 [INFO] Disabling DevTools v1.10.0\n2016-01-27 04:18:23 [INFO] Disabling Specter v0.2\n2016-01-27 04:18:23 [INFO] Disabling Glifcos-p v1.0.0\n2016-01-27 04:18:23 [INFO] [Glifcos-p] Datasync sent to webserver.\n2016-01-27 04:18:23 [INFO] TestMan has left the game\n2016-01-27 04:18:23 [INFO] TestMan[\/SPECTER:19133] logged out due to Server closed\n2016-01-27 04:18:23 [INFO] Unloading level \"world\"\n2016-01-27 04:18:23 [INFO] Stopping other threads\n2016-01-27 04:20:25 [INFO] Starting Minecraft: PE server version v0.10.5 alpha\n2016-01-27 04:20:25 [INFO] Loading pocketmine.yml...\n2016-01-27 04:20:25 [INFO] Loading server properties...\n2016-01-27 04:20:25 [INFO] Starting Minecraft PE server on 0.0.0.0:19145\n2016-01-27 04:20:25 [INFO] This server is running PocketMine-MP version 1.4.1-980 \"\u7d76\u597d(Zekkou)\u30b1\u30fc\u30ad(Cake)\" (API 1.11.0)\n2016-01-27 04:20:25 [INFO] PocketMine-MP is distributed under the LGPL License\n2016-01-27 04:20:25 [INFO] Loading DevTools v1.10.0\n2016-01-27 04:20:25 [INFO] Loading Specter v0.2\n2016-01-27 04:20:25 [INFO] Enabling DevTools v1.10.0\n2016-01-27 04:20:25 [INFO] Loading source plugin Glifcos-p v1.0.0\n2016-01-27 04:20:25 [INFO] [DevTools] Registered folder plugin loader\n2016-01-27 04:20:25 [INFO] Preparing level \"world\"\n2016-01-27 04:20:25 [INFO] Enabling Specter v0.2\n2016-01-27 04:20:25 [INFO] Enabling Glifcos-p v1.0.0\n2016-01-27 04:20:26 [INFO] [Glifcos-p] Datasync sent to webserver.\n2016-01-27 04:20:26 [INFO] Starting GS4 status listener\n2016-01-27 04:20:26 [INFO] Setting query port to 19145\n2016-01-27 04:20:26 [INFO] Query running on 0.0.0.0:19145\n2016-01-27 04:20:26 [INFO] Default game type: SURVIVAL\n2016-01-27 04:20:26 [INFO] Done (1.013s)! For help, type \"help\" or \"?\"\n2016-01-27 04:20:36 [NOTICE] Player data not found for \"tesetman\", creating new profile\n2016-01-27 04:20:36 [INFO] TesetMan[\/SPECTER:19133] logged in with entity id 1 at (world, 128, 64, 128)\n2016-01-27 04:20:36 [INFO] TesetMan joined the game\n2016-01-27 04:20:36 [INFO] [Specter] To TesetMan: TesetMan joined the game\n2016-01-27 04:20:36 [INFO] Session started.\n2016-01-27 04:21:15 [NOTICE] Player data not found for \"hotfireydeath\", creating new profile\n2016-01-27 04:21:15 [INFO] HotFireyDeath[\/SPECTER:19133] logged in with entity id 2 at (world, 128, 64, 128)\n2016-01-27 04:21:15 [INFO] HotFireyDeath joined the game\n2016-01-27 04:21:15 [INFO] [Specter] To TesetMan: HotFireyDeath joined the game\n2016-01-27 04:21:15 [INFO] [Specter] To HotFireyDeath: HotFireyDeath joined the game\n2016-01-27 04:21:15 [INFO] Session started.\n2016-01-27 04:24:13 [INFO] CONSOLE: Stopping the server...\n2016-01-27 04:24:13 [INFO] [Specter] To HotFireyDeath: [CONSOLE: Stopping the server...]\n2016-01-27 04:24:13 [INFO] Disabling DevTools v1.10.0\n2016-01-27 04:24:13 [INFO] Disabling Specter v0.2\n2016-01-27 04:24:13 [INFO] Disabling Glifcos-p v1.0.0\n2016-01-27 04:24:13 [INFO] [Glifcos-p] Datasync sent to webserver.\n2016-01-27 04:24:13 [INFO] TesetMan has left the game\n2016-01-27 04:24:13 [INFO] [Specter] To HotFireyDeath: TesetMan has left the game\n2016-01-27 04:24:13 [INFO] TesetMan[\/SPECTER:19133] logged out due to Server closed\n2016-01-27 04:24:13 [INFO] HotFireyDeath has left the game\n2016-01-27 04:24:13 [INFO] HotFireyDeath[\/SPECTER:19133] logged out due to Server closed\n2016-01-27 04:24:13 [INFO] Unloading level \"world\"\n2016-01-27 04:24:13 [INFO] Stopping other threads\n2016-01-27 04:24:14 [INFO] Starting Minecraft: PE server version v0.10.5 alpha\n2016-01-27 04:24:14 [INFO] Loading pocketmine.yml...\n2016-01-27 04:24:14 [INFO] Loading server properties...\n2016-01-27 04:24:14 [INFO] Starting Minecraft PE server on 0.0.0.0:19145\n2016-01-27 04:24:14 [INFO] This server is running PocketMine-MP version 1.4.1-980 \"\u7d76\u597d(Zekkou)\u30b1\u30fc\u30ad(Cake)\" (API 1.11.0)\n2016-01-27 04:24:14 [INFO] PocketMine-MP is distributed under the LGPL License\n2016-01-27 04:24:15 [INFO] Loading DevTools v1.10.0\n2016-01-27 04:24:15 [INFO] Loading Specter v0.2\n2016-01-27 04:24:15 [INFO] Enabling DevTools v1.10.0\n2016-01-27 04:24:15 [INFO] Loading source plugin Glifcos-p v1.0.0\n2016-01-27 04:24:15 [INFO] [DevTools] Registered folder plugin loader\n2016-01-27 04:24:15 [INFO] Preparing level \"world\"\n2016-01-27 04:24:15 [INFO] Enabling Specter v0.2\n2016-01-27 04:24:15 [INFO] Enabling Glifcos-p v1.0.0\n2016-01-27 04:24:15 [INFO] [Glifcos-p] Datasync sent to webserver.\n2016-01-27 04:24:15 [INFO] Starting GS4 status listener\n2016-01-27 04:24:15 [INFO] Setting query port to 19145\n2016-01-27 04:24:15 [INFO] Query running on 0.0.0.0:19145\n2016-01-27 04:24:15 [INFO] Default game type: SURVIVAL\n2016-01-27 04:24:15 [INFO] Done (1.009s)! For help, type \"help\" or \"?\"\n2016-01-27 04:25:01 [INFO] CONSOLE: Stopping the server...\n2016-01-27 04:25:01 [INFO] Disabling DevTools v1.10.0\n2016-01-27 04:25:01 [INFO] Disabling Specter v0.2\n2016-01-27 04:25:01 [INFO] Disabling Glifcos-p v1.0.0\n2016-01-27 04:25:01 [INFO] [Glifcos-p] Datasync sent to webserver.\n2016-01-27 04:25:02 [INFO] Unloading level \"world\"\n2016-01-27 04:25:02 [INFO] Stopping other threads\n2016-01-27 04:25:03 [INFO] Starting Minecraft: PE server version v0.10.5 alpha\n2016-01-27 04:25:03 [INFO] Loading pocketmine.yml...\n2016-01-27 04:25:03 [INFO] Loading server properties...\n2016-01-27 04:25:04 [INFO] Starting Minecraft PE server on 0.0.0.0:19145\n2016-01-27 04:25:04 [INFO] This server is running PocketMine-MP version 1.4.1-980 \"\u7d76\u597d(Zekkou)\u30b1\u30fc\u30ad(Cake)\" (API 1.11.0)\n2016-01-27 04:25:04 [INFO] PocketMine-MP is distributed under the LGPL License\n2016-01-27 04:25:04 [INFO] Loading DevTools v1.10.0\n2016-01-27 04:25:04 [INFO] Loading Specter v0.2\n2016-01-27 04:25:04 [INFO] Enabling DevTools v1.10.0\n2016-01-27 04:25:04 [INFO] Loading source plugin Glifcos-p v1.0.0\n2016-01-27 04:25:04 [INFO] [DevTools] Registered folder plugin loader\n2016-01-27 04:25:04 [INFO] Preparing level \"world\"\n2016-01-27 04:25:04 [INFO] Enabling Specter v0.2\n2016-01-27 04:25:04 [INFO] Enabling Glifcos-p v1.0.0\n2016-01-27 04:25:05 [INFO] [Glifcos-p] Datasync sent to webserver.\n2016-01-27 04:25:05 [INFO] Starting GS4 status listener\n2016-01-27 04:25:05 [INFO] Setting query port to 19145\n2016-01-27 04:25:05 [INFO] Query running on 0.0.0.0:19145\n2016-01-27 04:25:05 [INFO] Default game type: SURVIVAL\n2016-01-27 04:25:05 [INFO] Done (1.563s)! For help, type \"help\" or \"?\"\n2016-01-27 04:25:18 [INFO] Starting Minecraft: PE server version v0.10.5 alpha\n2016-01-27 04:25:18 [INFO] Loading pocketmine.yml...\n2016-01-27 04:25:18 [INFO] Loading server properties...\n2016-01-27 04:25:18 [INFO] Starting Minecraft PE server on 0.0.0.0:19145\n2016-01-27 04:25:18 [INFO] This server is running PocketMine-MP version 1.4.1-980 \"\u7d76\u597d(Zekkou)\u30b1\u30fc\u30ad(Cake)\" (API 1.11.0)\n2016-01-27 04:25:18 [INFO] PocketMine-MP is distributed under the LGPL License\n2016-01-27 04:25:18 [INFO] Loading DevTools v1.10.0\n2016-01-27 04:25:18 [INFO] Loading Specter v0.2\n2016-01-27 04:25:18 [INFO] Enabling DevTools v1.10.0\n2016-01-27 04:25:18 [INFO] Loading source plugin Glifcos-p v1.0.0\n2016-01-27 04:25:18 [INFO] [DevTools] Registered folder plugin loader\n2016-01-27 04:25:18 [INFO] Preparing level \"world\"\n2016-01-27 04:25:18 [INFO] Enabling Specter v0.2\n2016-01-27 04:25:18 [INFO] Enabling Glifcos-p v1.0.0\n2016-01-27 04:25:19 [INFO] [Glifcos-p] Datasync sent to webserver.\n2016-01-27 04:25:19 [INFO] Starting GS4 status listener\n2016-01-27 04:25:19 [INFO] Setting query port to 19145\n2016-01-27 04:25:19 [INFO] Query running on 0.0.0.0:19145\n2016-01-27 04:25:19 [INFO] Default game type: SURVIVAL\n2016-01-27 04:25:19 [INFO] Done (0.973s)! For help, type \"help\" or \"?\"\n2016-01-27 04:25:22 [INFO] CONSOLE: Stopping the server...\n2016-01-27 04:25:23 [INFO] Disabling DevTools v1.10.0\n2016-01-27 04:25:23 [INFO] Disabling Specter v0.2\n2016-01-27 04:25:23 [INFO] Disabling Glifcos-p v1.0.0\n2016-01-27 04:25:23 [INFO] [Glifcos-p] Datasync sent to webserver.\n2016-01-27 04:25:23 [INFO] Unloading level \"world\"\n2016-01-27 04:25:23 [INFO] Stopping other threads\n2016-01-27 04:50:54 [INFO] Starting Minecraft: PE server version v0.10.5 alpha\n2016-01-27 04:50:54 [INFO] Loading pocketmine.yml...\n2016-01-27 04:50:54 [INFO] Loading server properties...\n2016-01-27 04:50:54 [INFO] Starting Minecraft PE server on 0.0.0.0:19145\n2016-01-27 04:50:54 [INFO] This server is running PocketMine-MP version 1.4.1-980 \"\u7d76\u597d(Zekkou)\u30b1\u30fc\u30ad(Cake)\" (API 1.11.0)\n2016-01-27 04:50:54 [INFO] PocketMine-MP is distributed under the LGPL License\n2016-01-27 04:50:54 [INFO] Loading DevTools v1.10.0\n2016-01-27 04:50:54 [INFO] Loading Specter v0.2\n2016-01-27 04:50:54 [INFO] Enabling DevTools v1.10.0\n2016-01-27 04:50:54 [INFO] Loading source plugin Glifcos-p v1.0.0\n2016-01-27 04:50:54 [INFO] [DevTools] Registered folder plugin loader\n2016-01-27 04:50:54 [INFO] Preparing level \"world\"\n2016-01-27 04:50:54 [INFO] Enabling Specter v0.2\n2016-01-27 04:50:54 [INFO] Enabling Glifcos-p v1.0.0\n2016-01-27 04:50:55 [INFO] [Glifcos-p] Datasync sent to webserver.\n2016-01-27 04:50:55 [INFO] Starting GS4 status listener\n2016-01-27 04:50:55 [INFO] Setting query port to 19145\n2016-01-27 04:50:55 [INFO] Query running on 0.0.0.0:19145\n2016-01-27 04:50:55 [INFO] Default game type: SURVIVAL\n2016-01-27 04:50:55 [INFO] Done (1.128s)! For help, type \"help\" or \"?\"\n2016-01-27 04:52:21 [INFO] CONSOLE: Stopping the server...\n2016-01-27 04:52:21 [INFO] Disabling DevTools v1.10.0\n2016-01-27 04:52:21 [INFO] Disabling Specter v0.2\n2016-01-27 04:52:21 [INFO] Disabling Glifcos-p v1.0.0\n2016-01-27 04:52:21 [INFO] [Glifcos-p] Datasync sent to webserver.\n2016-01-27 04:52:21 [INFO] Unloading level \"world\"\n2016-01-27 04:52:21 [INFO] Stopping other threads\n2016-01-27 04:52:23 [INFO] Starting Minecraft: PE server version v0.10.5 alpha\n2016-01-27 04:52:23 [INFO] Loading pocketmine.yml...\n2016-01-27 04:52:23 [INFO] Loading server properties...\n2016-01-27 04:52:23 [INFO] Starting Minecraft PE server on 0.0.0.0:19145\n2016-01-27 04:52:23 [INFO] This server is running PocketMine-MP version 1.4.1-980 \"\u7d76\u597d(Zekkou)\u30b1\u30fc\u30ad(Cake)\" (API 1.11.0)\n2016-01-27 04:52:23 [INFO] PocketMine-MP is distributed under the LGPL License\n2016-01-27 04:52:23 [INFO] Loading DevTools v1.10.0\n2016-01-27 04:52:23 [INFO] Loading Specter v0.2\n2016-01-27 04:52:23 [INFO] Enabling DevTools v1.10.0\n2016-01-27 04:52:23 [INFO] Loading source plugin Glifcos-p v1.0.0\n2016-01-27 04:52:23 [INFO] [DevTools] Registered folder plugin loader\n2016-01-27 04:52:23 [INFO] Preparing level \"world\"\n2016-01-27 04:52:23 [INFO] Enabling Specter v0.2\n2016-01-27 04:52:23 [INFO] Enabling Glifcos-p v1.0.0\n2016-01-27 04:52:24 [INFO] [Glifcos-p] Datasync sent to webserver.\n2016-01-27 04:52:24 [INFO] Starting GS4 status listener\n2016-01-27 04:52:24 [INFO] Setting query port to 19145\n2016-01-27 04:52:24 [INFO] Query running on 0.0.0.0:19145\n2016-01-27 04:52:24 [INFO] Default game type: SURVIVAL\n2016-01-27 04:52:24 [INFO] Done (1.62s)! For help, type \"help\" or \"?\"\n2016-01-27 05:03:07 [INFO] CONSOLE: Stopping the server...\n2016-01-27 05:03:07 [INFO] Disabling DevTools v1.10.0\n2016-01-27 05:03:07 [INFO] Disabling Specter v0.2\n2016-01-27 05:03:07 [INFO] Disabling Glifcos-p v1.0.0\n2016-01-27 05:03:07 [INFO] [Glifcos-p] Datasync sent to webserver.\n2016-01-27 05:03:07 [INFO] Unloading level \"world\"\n2016-01-27 05:03:07 [INFO] Stopping other threads\n2016-01-27 05:03:09 [INFO] Starting Minecraft: PE server version v0.10.5 alpha\n2016-01-27 05:03:09 [INFO] Loading pocketmine.yml...\n2016-01-27 05:03:09 [INFO] Loading server properties...\n2016-01-27 05:03:09 [INFO] Starting Minecraft PE server on 0.0.0.0:19145\n2016-01-27 05:03:09 [INFO] This server is running PocketMine-MP version 1.4.1-980 \"\u7d76\u597d(Zekkou)\u30b1\u30fc\u30ad(Cake)\" (API 1.11.0)\n2016-01-27 05:03:09 [INFO] PocketMine-MP is distributed under the LGPL License\n2016-01-27 05:03:09 [INFO] Loading DevTools v1.10.0\n2016-01-27 05:03:09 [INFO] Loading Specter v0.2\n2016-01-27 05:03:09 [INFO] Enabling DevTools v1.10.0\n2016-01-27 05:03:09 [INFO] Loading source plugin Glifcos-p v1.0.0\n2016-01-27 05:03:09 [INFO] [DevTools] Registered folder plugin loader\n2016-01-27 05:03:09 [INFO] Preparing level \"world\"\n2016-01-27 05:03:09 [INFO] Enabling Specter v0.2\n2016-01-27 05:03:09 [INFO] Enabling Glifcos-p v1.0.0\n2016-01-27 05:03:10 [INFO] [Glifcos-p] Datasync sent to webserver.\n2016-01-27 05:03:10 [INFO] Starting GS4 status listener\n2016-01-27 05:03:10 [INFO] Setting query port to 19145\n2016-01-27 05:03:10 [INFO] Query running on 0.0.0.0:19145\n2016-01-27 05:03:10 [INFO] Default game type: SURVIVAL\n2016-01-27 05:03:10 [INFO] Done (1.098s)! For help, type \"help\" or \"?\"\n2016-01-27 05:09:29 [INFO] CONSOLE: Stopping the server...\n2016-01-27 05:09:29 [INFO] Disabling DevTools v1.10.0\n2016-01-27 05:09:29 [INFO] Disabling Specter v0.2\n2016-01-27 05:09:29 [INFO] Disabling Glifcos-p v1.0.0\n2016-01-27 05:09:29 [INFO] [Glifcos-p] Datasync sent to webserver.\n2016-01-27 05:09:29 [INFO] Unloading level \"world\"\n2016-01-27 05:09:29 [INFO] Stopping other threads\n2016-01-27 05:11:57 [INFO] Starting Minecraft: PE server version v0.10.5 alpha\n2016-01-27 05:11:57 [INFO] Loading pocketmine.yml...\n2016-01-27 05:11:57 [INFO] Loading server properties...\n2016-01-27 05:11:57 [INFO] Starting Minecraft PE server on 0.0.0.0:19145\n2016-01-27 05:11:57 [INFO] This server is running PocketMine-MP version 1.4.1-980 \"\u7d76\u597d(Zekkou)\u30b1\u30fc\u30ad(Cake)\" (API 1.11.0)\n2016-01-27 05:11:57 [INFO] PocketMine-MP is distributed under the LGPL License\n2016-01-27 05:11:57 [INFO] Loading DevTools v1.10.0\n2016-01-27 05:11:57 [INFO] Loading Specter v0.2\n2016-01-27 05:11:57 [INFO] Enabling DevTools v1.10.0\n2016-01-27 05:11:57 [INFO] Loading source plugin Glifcos-p v1.0.0\n2016-01-27 05:11:57 [INFO] [DevTools] Registered folder plugin loader\n2016-01-27 05:11:57 [INFO] Preparing level \"world\"\n2016-01-27 05:11:57 [INFO] Enabling Specter v0.2\n2016-01-27 05:11:57 [INFO] Enabling Glifcos-p v1.0.0\n2016-01-27 05:11:58 [INFO] [Glifcos-p] Datasync sent to webserver.\n2016-01-27 05:11:58 [INFO] Starting GS4 status listener\n2016-01-27 05:11:58 [INFO] Setting query port to 19145\n2016-01-27 05:11:58 [INFO] Query running on 0.0.0.0:19145\n2016-01-27 05:11:58 [INFO] Default game type: SURVIVAL\n2016-01-27 05:11:58 [INFO] Done (1.501s)! For help, type \"help\" or \"?\"\n2016-01-27 05:12:03 [INFO] CONSOLE: Stopping the server...\n2016-01-27 05:12:03 [INFO] Disabling DevTools v1.10.0\n2016-01-27 05:12:03 [INFO] Disabling Specter v0.2\n2016-01-27 05:12:03 [INFO] Disabling Glifcos-p v1.0.0\n2016-01-27 05:12:03 [INFO] [Glifcos-p] Datasync sent to webserver.\n2016-01-27 05:12:03 [INFO] Unloading level \"world\"\n2016-01-27 05:12:03 [INFO] Stopping other threads\n2016-01-27 12:36:42 [INFO] Starting Minecraft: PE server version v0.10.5 alpha\n2016-01-27 12:36:42 [INFO] Loading pocketmine.yml...\n2016-01-27 12:36:42 [INFO] Loading server properties...\n2016-01-27 12:36:42 [INFO] Starting Minecraft PE server on 0.0.0.0:19145\n2016-01-27 12:36:42 [INFO] This server is running PocketMine-MP version 1.4.1-980 \"\u7d76\u597d(Zekkou)\u30b1\u30fc\u30ad(Cake)\" (API 1.11.0)\n2016-01-27 12:36:42 [INFO] PocketMine-MP is distributed under the LGPL License\n2016-01-27 12:36:42 [INFO] Loading DevTools v1.10.0\n2016-01-27 12:36:42 [INFO] Loading Specter v0.2\n2016-01-27 12:36:43 [INFO] Enabling DevTools v1.10.0\n2016-01-27 12:36:43 [INFO] Loading source plugin Glifcos-p v1.0.0\n2016-01-27 12:36:43 [INFO] [DevTools] Registered folder plugin loader\n2016-01-27 12:36:43 [INFO] Preparing level \"world\"\n2016-01-27 12:36:43 [INFO] Enabling Specter v0.2\n2016-01-27 12:36:43 [INFO] Enabling Glifcos-p v1.0.0\n2016-01-27 12:36:43 [INFO] [Glifcos-p] Datasync sent to webserver.\n2016-01-27 12:36:43 [INFO] Starting GS4 status listener\n2016-01-27 12:36:43 [INFO] Setting query port to 19145\n2016-01-27 12:36:43 [INFO] Query running on 0.0.0.0:19145\n2016-01-27 12:36:43 [INFO] Default game type: SURVIVAL\n2016-01-27 12:36:43 [INFO] Done (1.426s)! For help, type \"help\" or \"?\"\n2016-01-27 12:38:37 [INFO] CONSOLE: Set time to 0\n2016-01-27 12:39:51 [INFO] CONSOLE: Stopping the server...\n2016-01-27 12:39:51 [INFO] Disabling DevTools v1.10.0\n2016-01-27 12:39:51 [INFO] Disabling Specter v0.2\n2016-01-27 12:39:51 [INFO] Disabling Glifcos-p v1.0.0\n2016-01-27 12:39:51 [INFO] [Glifcos-p] Datasync sent to webserver.\n2016-01-27 12:39:56 [INFO] Unloading level \"world\"\n2016-01-27 12:39:56 [INFO] Stopping other threads\n2016-01-27 15:28:47 [INFO] Starting Minecraft: PE server version v0.10.5 alpha\n2016-01-27 15:28:47 [INFO] Loading pocketmine.yml...\n2016-01-27 15:28:47 [INFO] Loading server properties...\n2016-01-27 15:28:47 [INFO] Starting Minecraft PE server on 0.0.0.0:19145\n2016-01-27 15:28:47 [INFO] This server is running PocketMine-MP version 1.4.1-980 \"\u7d76\u597d(Zekkou)\u30b1\u30fc\u30ad(Cake)\" (API 1.11.0)\n2016-01-27 15:28:47 [INFO] PocketMine-MP is distributed under the LGPL License\n2016-01-27 15:28:47 [INFO] Loading DevTools v1.10.0\n2016-01-27 15:28:47 [INFO] Loading Specter v0.2\n2016-01-27 15:28:48 [INFO] Enabling DevTools v1.10.0\n2016-01-27 15:28:48 [INFO] Loading source plugin Glifcos-p v1.0.0\n2016-01-27 15:28:48 [INFO] [DevTools] Registered folder plugin loader\n2016-01-27 15:28:48 [INFO] Preparing level \"world\"\n2016-01-27 15:28:48 [INFO] Enabling Specter v0.2\n2016-01-27 15:28:48 [INFO] Enabling Glifcos-p v1.0.0\n2016-01-27 15:28:48 [INFO] [Glifcos-p] Datasync sent to webserver.\n2016-01-27 15:28:48 [INFO] Starting GS4 status listener\n2016-01-27 15:28:48 [INFO] Setting query port to 19145\n2016-01-27 15:28:48 [INFO] Query running on 0.0.0.0:19145\n2016-01-27 15:28:48 [INFO] Default game type: SURVIVAL\n2016-01-27 15:28:48 [INFO] Done (0.965s)! For help, type \"help\" or \"?\"\n2016-01-27 15:29:12 [INFO] [Glifcos-p] User HotFireyDeath has logged into Glifcos.\n                     IP: 10.240.0.157\n2016-01-27 15:54:57 [CRITICAL] Could not execute task glifcos\\mainw\\synctask: fopen(http:\/\/www.glifcos-hotfireydeath.c9users.io\/glifcos-webserver\/connection.php?type=memsync&cm=27&tm=512): failed to open stream: HTTP request failed! \n2016-01-27 15:54:57 [WARNING] RuntimeException: \"fopen(http:\/\/www.glifcos-hotfireydeath.c9users.io\/glifcos-webserver\/connection.php?type=memsync&cm=27&tm=512): failed to open stream: HTTP request failed! \" (E_WARNING) in \"\/glifcos-plugin\/src\/glifcos\/mainw\/synctask\" at line 43\n2016-01-27 16:31:44 [CRITICAL] Could not execute task glifcos\\mainw\\synctask: fopen(http:\/\/www.glifcos-hotfireydeath.c9users.io\/glifcos-webserver\/connection.php?type=memsync&cm=27&tm=512): failed to open stream: HTTP request failed! \n2016-01-27 16:31:44 [WARNING] RuntimeException: \"fopen(http:\/\/www.glifcos-hotfireydeath.c9users.io\/glifcos-webserver\/connection.php?type=memsync&cm=27&tm=512): failed to open stream: HTTP request failed! \" (E_WARNING) in \"\/glifcos-plugin\/src\/glifcos\/mainw\/synctask\" at line 43\n2016-01-27 16:35:30 [CRITICAL] Could not execute task glifcos\\mainw\\synctask: fopen(http:\/\/www.glifcos-hotfireydeath.c9users.io\/glifcos-webserver\/connection.php?type=memsync&cm=27&tm=512): failed to open stream: HTTP request failed! \n2016-01-27 16:35:30 [WARNING] RuntimeException: \"fopen(http:\/\/www.glifcos-hotfireydeath.c9users.io\/glifcos-webserver\/connection.php?type=memsync&cm=27&tm=512): failed to open stream: HTTP request failed! \" (E_WARNING) in \"\/glifcos-plugin\/src\/glifcos\/mainw\/synctask\" at line 43\n2016-01-27 16:47:06 [INFO] Unknown command. Type \"help\" for help.\n2016-01-27 16:47:06 [INFO] Unknown command. Type \"help\" for help.\n2016-01-27 16:47:06 [INFO] Unknown command. Type \"help\" for help.\n2016-01-27 16:47:08 [INFO] Unknown command. Type \"help\" for help.\n2016-01-27 16:47:10 [INFO] CONSOLE: Stopping the server...\n2016-01-27 16:47:10 [INFO] Disabling DevTools v1.10.0\n2016-01-27 16:47:10 [INFO] Disabling Specter v0.2\n2016-01-27 16:47:10 [INFO] Disabling Glifcos-p v1.0.0\n2016-01-27 16:47:10 [INFO] [Glifcos-p] Datasync sent to webserver.\n2016-01-27 16:47:10 [INFO] Unloading level \"world\"\n2016-01-27 16:47:10 [INFO] Stopping other threads\n2016-01-27 16:47:33 [INFO] Starting Minecraft: PE server version v0.10.5 alpha\n2016-01-27 16:47:33 [INFO] Loading pocketmine.yml...\n2016-01-27 16:47:33 [INFO] Loading server properties...\n2016-01-27 16:47:33 [INFO] Starting Minecraft PE server on 0.0.0.0:19145\n2016-01-27 16:47:33 [INFO] This server is running PocketMine-MP version 1.4.1-980 \"\u7d76\u597d(Zekkou)\u30b1\u30fc\u30ad(Cake)\" (API 1.11.0)\n2016-01-27 16:47:33 [INFO] PocketMine-MP is distributed under the LGPL License\n2016-01-27 16:47:33 [INFO] Loading DevTools v1.10.0\n2016-01-27 16:47:33 [INFO] Loading Specter v0.2\n2016-01-27 16:47:33 [INFO] Enabling DevTools v1.10.0\n2016-01-27 16:47:33 [INFO] Loading source plugin Glifcos-p v1.0.0\n2016-01-27 16:47:33 [INFO] [DevTools] Registered folder plugin loader\n2016-01-27 16:47:33 [INFO] Preparing level \"world\"\n2016-01-27 16:47:33 [INFO] Enabling Specter v0.2\n2016-01-27 16:47:33 [INFO] Enabling Glifcos-p v1.0.0\n2016-01-27 16:47:34 [INFO] [Glifcos-p] Datasync sent to webserver.\n2016-01-27 16:47:34 [INFO] Starting GS4 status listener\n2016-01-27 16:47:34 [INFO] Setting query port to 19145\n2016-01-27 16:47:34 [INFO] Query running on 0.0.0.0:19145\n2016-01-27 16:47:34 [INFO] Default game type: SURVIVAL\n2016-01-27 16:47:34 [INFO] Done (1.145s)! For help, type \"help\" or \"?\"\n2016-01-27 16:47:47 [INFO] [Glifcos-p] User HotFireyDeath has logged into Glifcos.\n                     IP: 10.240.0.156\n2016-01-27 16:48:23 [NOTICE] Player data not found for \"testplayer\", creating new profile\n2016-01-27 16:48:23 [INFO] TestPlayer[\/SPECTER:19133] logged in with entity id 1 at (world, 128, 64, 128)\n2016-01-27 16:48:23 [INFO] TestPlayer joined the game\n2016-01-27 16:48:23 [INFO] [Specter] To TestPlayer: TestPlayer joined the game\n2016-01-27 16:48:23 [INFO] Session started.\n2016-01-27 16:49:55 [INFO] CONSOLE: Stopping the server...\n2016-01-27 16:49:55 [INFO] Disabling DevTools v1.10.0\n2016-01-27 16:49:55 [INFO] Disabling Specter v0.2\n2016-01-27 16:49:55 [INFO] Disabling Glifcos-p v1.0.0\n2016-01-27 16:49:55 [INFO] [Glifcos-p] Datasync sent to webserver.\n2016-01-27 16:49:55 [INFO] TestPlayer has left the game\n2016-01-27 16:49:55 [INFO] TestPlayer[\/SPECTER:19133] logged out due to Server closed\n2016-01-27 16:49:55 [INFO] Unloading level \"world\"\n2016-01-27 16:49:55 [INFO] Stopping other threads\n2016-01-27 16:56:51 [INFO] Starting Minecraft: PE server version v0.10.5 alpha\n2016-01-27 16:56:51 [INFO] Loading pocketmine.yml...\n2016-01-27 16:56:51 [INFO] Loading server properties...\n2016-01-27 16:56:51 [INFO] Starting Minecraft PE server on 0.0.0.0:19145\n2016-01-27 16:56:51 [INFO] This server is running PocketMine-MP version 1.4.1-980 \"\u7d76\u597d(Zekkou)\u30b1\u30fc\u30ad(Cake)\" (API 1.11.0)\n2016-01-27 16:56:51 [INFO] PocketMine-MP is distributed under the LGPL License\n2016-01-27 16:56:52 [INFO] Loading DevTools v1.10.0\n2016-01-27 16:56:52 [INFO] Loading Specter v0.2\n2016-01-27 16:56:52 [INFO] Enabling DevTools v1.10.0\n2016-01-27 16:56:52 [INFO] Loading source plugin Glifcos-p v1.0.0\n2016-01-27 16:56:52 [INFO] [DevTools] Registered folder plugin loader\n2016-01-27 16:56:52 [INFO] Preparing level \"world\"\n2016-01-27 16:56:52 [INFO] Enabling Specter v0.2\n2016-01-27 16:56:52 [INFO] Enabling Glifcos-p v1.0.0\n2016-01-27 16:56:53 [INFO] [Glifcos-p] Datasync sent to webserver.\n2016-01-27 16:56:53 [INFO] Starting GS4 status listener\n2016-01-27 16:56:53 [INFO] Setting query port to 19145\n2016-01-27 16:56:53 [INFO] Query running on 0.0.0.0:19145\n2016-01-27 16:56:53 [INFO] Default game type: SURVIVAL\n2016-01-27 16:56:53 [INFO] Done (1.244s)! For help, type \"help\" or \"?\"\n2016-01-27 17:38:05 [CRITICAL] Could not execute task glifcos\\mainw\\synctask: fopen(http:\/\/www.glifcos-hotfireydeath.c9users.io\/glifcos-webserver\/connection.php?type=memsync&cm=27&tm=512): failed to open stream: HTTP request failed! \n2016-01-27 17:38:05 [WARNING] RuntimeException: \"fopen(http:\/\/www.glifcos-hotfireydeath.c9users.io\/glifcos-webserver\/connection.php?type=memsync&cm=27&tm=512): failed to open stream: HTTP request failed! \" (E_WARNING) in \"\/glifcos-plugin\/src\/glifcos\/mainw\/synctask\" at line 43\n2016-01-27 17:42:12 [CRITICAL] Could not execute task glifcos\\mainw\\synctask: fopen(http:\/\/www.glifcos-hotfireydeath.c9users.io\/glifcos-webserver\/connection.php?type=memsync&cm=27&tm=512): failed to open stream: HTTP request failed! \n2016-01-27 17:42:12 [WARNING] RuntimeException: \"fopen(http:\/\/www.glifcos-hotfireydeath.c9users.io\/glifcos-webserver\/connection.php?type=memsync&cm=27&tm=512): failed to open stream: HTTP request failed! \" (E_WARNING) in \"\/glifcos-plugin\/src\/glifcos\/mainw\/synctask\" at line 43\n2016-01-27 17:53:43 [INFO] [Glifcos-p] User HotFireyDeath has logged into Glifcos.\n                     IP: 10.240.0.94\n2016-01-27 18:17:27 [INFO] Starting Minecraft: PE server version v0.10.5 alpha\n2016-01-27 18:17:27 [INFO] Loading pocketmine.yml...\n2016-01-27 18:17:27 [INFO] Loading server properties...\n2016-01-27 18:17:27 [INFO] Starting Minecraft PE server on 0.0.0.0:19145\n2016-01-27 18:17:27 [INFO] This server is running PocketMine-MP version 1.4.1-980 \"\u7d76\u597d(Zekkou)\u30b1\u30fc\u30ad(Cake)\" (API 1.11.0)\n2016-01-27 18:17:27 [INFO] PocketMine-MP is distributed under the LGPL License\n2016-01-27 18:17:27 [CRITICAL] **** FAILED TO BIND TO 0.0.0.0:19145!\n2016-01-27 18:17:27 [CRITICAL] Perhaps a server is already running on that port?\n2016-01-27 18:17:27 [EMERGENCY] [RakLib Thread #139729693689600] RakLib crashed!\n2016-01-27 18:17:27 [INFO] Loading DevTools v1.10.0\n2016-01-27 18:17:27 [INFO] Loading Specter v0.2\n2016-01-27 18:17:27 [INFO] Enabling DevTools v1.10.0\n2016-01-27 18:17:27 [INFO] Loading source plugin Glifcos-p v1.0.0\n2016-01-27 18:17:27 [INFO] [DevTools] Registered folder plugin loader\n2016-01-27 18:17:28 [INFO] Preparing level \"world\"\n2016-01-27 18:17:28 [INFO] Enabling Specter v0.2\n2016-01-27 18:17:28 [INFO] Enabling Glifcos-p v1.0.0\n2016-01-27 18:17:28 [INFO] [Glifcos-p] Datasync sent to webserver.\n2016-01-27 18:17:28 [INFO] Starting GS4 status listener\n2016-01-27 18:17:28 [INFO] Setting query port to 19145\n2016-01-27 18:17:28 [INFO] Query running on 0.0.0.0:19145\n2016-01-27 18:17:28 [INFO] Default game type: SURVIVAL\n2016-01-27 18:17:28 [INFO] Done (1.005s)! For help, type \"help\" or \"?\"\n2016-01-27 18:17:28 [ERROR] RuntimeException: \"RakLib Thread crashed [raklib\\server\\UDPServerSocket]: socket_bind(): unable to bind address [98]: Address already in use\" (E_ERROR) in \"\/src\/raklib\/server\/UDPServerSocket\" at line 32\n2016-01-27 18:17:28 [EMERGENCY] An unrecoverable error has occurred and the server has crashed. Creating a crash dump\n2016-01-27 18:17:28 [EMERGENCY] Please submit the \"\/home\/ubuntu\/workspace\/testserver\/CrashDump_Wed_Jan_27-18.17.28-UTC_2016.log\" file to the Bug Reporting page. Give as much info as you can.\n2016-01-27 18:19:58 [INFO] Starting Minecraft: PE server version v0.10.5 alpha\n2016-01-27 18:19:58 [INFO] Loading pocketmine.yml...\n2016-01-27 18:19:58 [INFO] Loading server properties...\n2016-01-27 18:19:58 [INFO] Starting Minecraft PE server on 0.0.0.0:19145\n2016-01-27 18:19:58 [INFO] This server is running PocketMine-MP version 1.4.1-980 \"\u7d76\u597d(Zekkou)\u30b1\u30fc\u30ad(Cake)\" (API 1.11.0)\n2016-01-27 18:19:58 [INFO] PocketMine-MP is distributed under the LGPL License\n2016-01-27 18:19:58 [INFO] Loading DevTools v1.10.0\n2016-01-27 18:19:58 [INFO] Loading Specter v0.2\n2016-01-27 18:19:58 [INFO] Enabling DevTools v1.10.0\n2016-01-27 18:19:58 [INFO] Loading source plugin Glifcos-p v1.0.0\n2016-01-27 18:19:58 [INFO] [DevTools] Registered folder plugin loader\n2016-01-27 18:19:59 [INFO] Preparing level \"world\"\n2016-01-27 18:19:59 [INFO] Enabling Specter v0.2\n2016-01-27 18:19:59 [INFO] Enabling Glifcos-p v1.0.0\n2016-01-27 18:19:59 [INFO] [Glifcos-p] Datasync sent to webserver.\n2016-01-27 18:19:59 [INFO] Starting GS4 status listener\n2016-01-27 18:19:59 [INFO] Setting query port to 19145\n2016-01-27 18:19:59 [INFO] Query running on 0.0.0.0:19145\n2016-01-27 18:19:59 [INFO] Default game type: SURVIVAL\n2016-01-27 18:19:59 [INFO] Done (1.583s)! For help, type \"help\" or \"?\"\n2016-01-27 18:20:01 [INFO] CONSOLE: Stopping the server...\n2016-01-27 18:20:01 [INFO] Disabling DevTools v1.10.0\n2016-01-27 18:20:01 [INFO] Disabling Specter v0.2\n2016-01-27 18:20:01 [INFO] Disabling Glifcos-p v1.0.0\n2016-01-27 18:20:01 [INFO] [Glifcos-p] Datasync sent to webserver.\n2016-01-27 18:20:01 [INFO] Unloading level \"world\"\n2016-01-27 18:20:01 [INFO] Stopping other threads\n2016-01-27 18:27:59 [INFO] Starting Minecraft: PE server version v0.10.5 alpha\n2016-01-27 18:27:59 [INFO] Loading pocketmine.yml...\n2016-01-27 18:27:59 [INFO] Loading server properties...\n2016-01-27 18:27:59 [INFO] Starting Minecraft PE server on 0.0.0.0:19145\n2016-01-27 18:27:59 [INFO] This server is running PocketMine-MP version 1.4.1-980 \"\u7d76\u597d(Zekkou)\u30b1\u30fc\u30ad(Cake)\" (API 1.11.0)\n2016-01-27 18:27:59 [INFO] PocketMine-MP is distributed under the LGPL License\n2016-01-27 18:27:59 [INFO] Loading DevTools v1.10.0\n2016-01-27 18:27:59 [INFO] Loading Specter v0.2\n2016-01-27 18:27:59 [INFO] Enabling DevTools v1.10.0\n2016-01-27 18:27:59 [INFO] Loading source plugin Glifcos-p v1.0.0\n2016-01-27 18:27:59 [INFO] [DevTools] Registered folder plugin loader\n2016-01-27 18:28:00 [INFO] Preparing level \"world\"\n2016-01-27 18:28:00 [INFO] Enabling Specter v0.2\n2016-01-27 18:28:00 [INFO] Enabling Glifcos-p v1.0.0\n2016-01-27 18:28:00 [INFO] [Glifcos-p] Datasync sent to webserver.\n2016-01-27 18:28:00 [INFO] Starting GS4 status listener\n2016-01-27 18:28:00 [INFO] Setting query port to 19145\n2016-01-27 18:28:00 [INFO] Query running on 0.0.0.0:19145\n2016-01-27 18:28:00 [INFO] Default game type: SURVIVAL\n2016-01-27 18:28:00 [INFO] Done (0.91s)! For help, type \"help\" or \"?\"\n2016-01-27 18:28:01 [INFO] [Glifcos-p] User HotFireyDeath has logged into Glifcos.\n                     IP: 10.240.0.121\n2016-01-27 18:28:07 [INFO] CONSOLE: Stopping the server...\n2016-01-27 18:28:07 [INFO] Disabling DevTools v1.10.0\n2016-01-27 18:28:07 [INFO] Disabling Specter v0.2\n2016-01-27 18:28:07 [INFO] Disabling Glifcos-p v1.0.0\n2016-01-27 18:28:07 [INFO] [Glifcos-p] Datasync sent to webserver.\n2016-01-27 18:28:07 [INFO] Unloading level \"world\"\n2016-01-27 18:28:07 [INFO] Stopping other threads\n2016-01-27 19:39:31 [INFO] Starting Minecraft: PE server version v0.10.5 alpha\n2016-01-27 19:39:31 [INFO] Loading pocketmine.yml...\n2016-01-27 19:39:31 [INFO] Loading server properties...\n2016-01-27 19:39:31 [INFO] Starting Minecraft PE server on 0.0.0.0:19145\n2016-01-27 19:39:31 [INFO] This server is running PocketMine-MP version 1.4.1-980 \"\u7d76\u597d(Zekkou)\u30b1\u30fc\u30ad(Cake)\" (API 1.11.0)\n2016-01-27 19:39:31 [INFO] PocketMine-MP is distributed under the LGPL License\n2016-01-27 19:39:31 [INFO] Loading DevTools v1.10.0\n2016-01-27 19:39:31 [INFO] Loading Specter v0.2\n2016-01-27 19:39:31 [INFO] Enabling DevTools v1.10.0\n2016-01-27 19:39:31 [INFO] Loading source plugin Glifcos-p v1.0.0\n2016-01-27 19:39:31 [INFO] [DevTools] Registered folder plugin loader\n2016-01-27 19:39:31 [INFO] Preparing level \"world\"\n2016-01-27 19:39:31 [INFO] Enabling Specter v0.2\n2016-01-27 19:39:31 [INFO] Enabling Glifcos-p v1.0.0\n2016-01-27 19:39:32 [INFO] [Glifcos-p] Datasync sent to webserver.\n2016-01-27 19:39:32 [INFO] Starting GS4 status listener\n2016-01-27 19:39:32 [INFO] Setting query port to 19145\n2016-01-27 19:39:32 [INFO] Query running on 0.0.0.0:19145\n2016-01-27 19:39:32 [INFO] Default game type: SURVIVAL\n2016-01-27 19:39:32 [INFO] Done (0.97s)! For help, type \"help\" or \"?\"\n2016-01-27 19:39:33 [INFO] [Glifcos-p] User HotFireyDeath has logged into Glifcos.\n                     IP: 10.240.0.113\n2016-01-27 19:39:50 [INFO] [Server] hi\n2016-01-27 19:40:06 [INFO] CONSOLE: Set time to 0\n2016-01-27 19:40:27 [INFO] CONSOLE: Opped hotfireydeath\n2016-01-27 19:40:38 [INFO] CONSOLE: De-opped hotfireydeath\n2016-01-27 19:47:36 [INFO] CONSOLE: Stopping the server...\n2016-01-27 19:47:36 [INFO] Disabling DevTools v1.10.0\n2016-01-27 19:47:36 [INFO] Disabling Specter v0.2\n2016-01-27 19:47:36 [INFO] Disabling Glifcos-p v1.0.0\n2016-01-27 19:47:36 [INFO] [Glifcos-p] Datasync sent to webserver.\n2016-01-27 19:47:36 [INFO] Unloading level \"world\"\n2016-01-27 19:47:36 [INFO] Stopping other threads\n2016-01-27 19:47:37 [INFO] Starting Minecraft: PE server version v0.10.5 alpha\n2016-01-27 19:47:37 [INFO] Loading pocketmine.yml...\n2016-01-27 19:47:37 [INFO] Loading server properties...\n2016-01-27 19:47:37 [INFO] Starting Minecraft PE server on 0.0.0.0:19145\n2016-01-27 19:47:37 [INFO] This server is running PocketMine-MP version 1.4.1-980 \"\u7d76\u597d(Zekkou)\u30b1\u30fc\u30ad(Cake)\" (API 1.11.0)\n2016-01-27 19:47:37 [INFO] PocketMine-MP is distributed under the LGPL License\n2016-01-27 19:47:37 [INFO] Loading DevTools v1.10.0\n2016-01-27 19:47:37 [INFO] Loading Specter v0.2\n2016-01-27 19:47:37 [INFO] Enabling DevTools v1.10.0\n2016-01-27 19:47:37 [INFO] Loading source plugin Glifcos-p v1.0.0\n2016-01-27 19:47:37 [INFO] [DevTools] Registered folder plugin loader\n2016-01-27 19:47:37 [INFO] Preparing level \"world\"\n2016-01-27 19:47:37 [INFO] Enabling Specter v0.2\n2016-01-27 19:47:37 [INFO] Enabling Glifcos-p v1.0.0\n2016-01-27 19:47:38 [INFO] [Glifcos-p] Datasync sent to webserver.\n2016-01-27 19:47:38 [INFO] Starting GS4 status listener\n2016-01-27 19:47:38 [INFO] Setting query port to 19145\n2016-01-27 19:47:38 [INFO] Query running on 0.0.0.0:19145\n2016-01-27 19:47:38 [INFO] Default game type: SURVIVAL\n2016-01-27 19:47:38 [INFO] Done (0.827s)! For help, type \"help\" or \"?\"\n2016-01-27 19:49:10 [INFO] CONSOLE: Stopping the server...\n2016-01-27 19:49:10 [INFO] Disabling DevTools v1.10.0\n2016-01-27 19:49:10 [INFO] Disabling Specter v0.2\n2016-01-27 19:49:10 [INFO] Disabling Glifcos-p v1.0.0\n2016-01-27 19:49:10 [INFO] [Glifcos-p] Datasync sent to webserver.\n2016-01-27 19:49:10 [INFO] Unloading level \"world\"\n2016-01-27 19:49:10 [INFO] Stopping other threads\n2016-01-27 19:49:44 [INFO] Starting Minecraft: PE server version v0.10.5 alpha\n2016-01-27 19:49:44 [INFO] Loading pocketmine.yml...\n2016-01-27 19:49:44 [INFO] Loading server properties...\n2016-01-27 19:49:44 [INFO] Starting Minecraft PE server on 0.0.0.0:19145\n2016-01-27 19:49:44 [INFO] This server is running PocketMine-MP version 1.4.1-980 \"\u7d76\u597d(Zekkou)\u30b1\u30fc\u30ad(Cake)\" (API 1.11.0)\n2016-01-27 19:49:44 [INFO] PocketMine-MP is distributed under the LGPL License\n2016-01-27 19:49:44 [INFO] Loading DevTools v1.10.0\n2016-01-27 19:49:44 [INFO] Loading Specter v0.2\n2016-01-27 19:49:45 [INFO] Enabling DevTools v1.10.0\n2016-01-27 19:49:45 [INFO] Loading source plugin Glifcos-p v1.0.0\n2016-01-27 19:49:45 [INFO] [DevTools] Registered folder plugin loader\n2016-01-27 19:49:45 [INFO] Preparing level \"world\"\n2016-01-27 19:49:45 [INFO] Enabling Specter v0.2\n2016-01-27 19:49:45 [INFO] Enabling Glifcos-p v1.0.0\n2016-01-27 19:49:45 [INFO] [Glifcos-p] Datasync sent to webserver.\n2016-01-27 19:49:45 [INFO] Starting GS4 status listener\n2016-01-27 19:49:45 [INFO] Setting query port to 19145\n2016-01-27 19:49:45 [INFO] Query running on 0.0.0.0:19145\n2016-01-27 19:49:45 [INFO] Default game type: SURVIVAL\n2016-01-27 19:49:45 [INFO] Done (0.714s)! For help, type \"help\" or \"?\"\n2016-01-27 19:57:50 [INFO] CONSOLE: Stopping the server...\n2016-01-27 19:57:50 [INFO] Disabling DevTools v1.10.0\n2016-01-27 19:57:50 [INFO] Disabling Specter v0.2\n2016-01-27 19:57:50 [INFO] Disabling Glifcos-p v1.0.0\n2016-01-27 19:57:50 [INFO] [Glifcos-p] Datasync sent to webserver.\n2016-01-27 19:57:50 [INFO] Unloading level \"world\"\n2016-01-27 19:57:50 [INFO] Stopping other threads\n2016-01-27 19:57:52 [INFO] Starting Minecraft: PE server version v0.10.5 alpha\n2016-01-27 19:57:52 [INFO] Loading pocketmine.yml...\n2016-01-27 19:57:52 [INFO] Loading server properties...\n2016-01-27 19:57:52 [INFO] Starting Minecraft PE server on 0.0.0.0:19145\n2016-01-27 19:57:52 [INFO] This server is running PocketMine-MP version 1.4.1-980 \"\u7d76\u597d(Zekkou)\u30b1\u30fc\u30ad(Cake)\" (API 1.11.0)\n2016-01-27 19:57:52 [INFO] PocketMine-MP is distributed under the LGPL License\n2016-01-27 19:57:52 [INFO] Loading DevTools v1.10.0\n2016-01-27 19:57:52 [INFO] Loading Specter v0.2\n2016-01-27 19:57:52 [INFO] Enabling DevTools v1.10.0\n2016-01-27 19:57:52 [INFO] Loading source plugin Glifcos-p v1.0.0\n2016-01-27 19:57:52 [INFO] [DevTools] Registered folder plugin loader\n2016-01-27 19:57:52 [INFO] Preparing level \"world\"\n2016-01-27 19:57:52 [INFO] Enabling Specter v0.2\n2016-01-27 19:57:52 [INFO] Enabling Glifcos-p v1.0.0\n2016-01-27 19:57:53 [INFO] [Glifcos-p] Datasync sent to webserver.\n2016-01-27 19:57:53 [INFO] Starting GS4 status listener\n2016-01-27 19:57:53 [INFO] Setting query port to 19145\n2016-01-27 19:57:53 [INFO] Query running on 0.0.0.0:19145\n2016-01-27 19:57:53 [INFO] Default game type: SURVIVAL\n2016-01-27 19:57:53 [INFO] Done (1.127s)! For help, type \"help\" or \"?\"\n2016-01-27 19:58:07 [INFO] CONSOLE: Stopping the server...\n2016-01-27 19:58:07 [INFO] Disabling DevTools v1.10.0\n2016-01-27 19:58:07 [INFO] Disabling Specter v0.2\n2016-01-27 19:58:07 [INFO] Disabling Glifcos-p v1.0.0\n2016-01-27 19:58:07 [INFO] [Glifcos-p] Datasync sent to webserver.\n2016-01-27 19:58:08 [INFO] Unloading level \"world\"\n2016-01-27 19:58:08 [INFO] Stopping other threads\n2016-01-27 19:59:41 [INFO] Starting Minecraft: PE server version v0.10.5 alpha\n2016-01-27 19:59:41 [INFO] Loading pocketmine.yml...\n2016-01-27 19:59:41 [INFO] Loading server properties...\n2016-01-27 19:59:41 [INFO] Starting Minecraft PE server on 0.0.0.0:19145\n2016-01-27 19:59:41 [INFO] This server is running PocketMine-MP version 1.4.1-980 \"\u7d76\u597d(Zekkou)\u30b1\u30fc\u30ad(Cake)\" (API 1.11.0)\n2016-01-27 19:59:41 [INFO] PocketMine-MP is distributed under the LGPL License\n2016-01-27 19:59:42 [INFO] Loading DevTools v1.10.0\n2016-01-27 19:59:42 [INFO] Loading Specter v0.2\n2016-01-27 19:59:42 [INFO] Enabling DevTools v1.10.0\n2016-01-27 19:59:42 [INFO] Loading source plugin Glifcos-p v1.0.0\n2016-01-27 19:59:42 [INFO] [DevTools] Registered folder plugin loader\n2016-01-27 19:59:42 [INFO] Preparing level \"world\"\n2016-01-27 19:59:42 [INFO] Enabling Specter v0.2\n2016-01-27 19:59:42 [INFO] Enabling Glifcos-p v1.0.0\n2016-01-27 19:59:42 [INFO] [Glifcos-p] Datasync sent to webserver.\n2016-01-27 19:59:43 [INFO] Starting GS4 status listener\n2016-01-27 19:59:43 [INFO] Setting query port to 19145\n2016-01-27 19:59:43 [INFO] Query running on 0.0.0.0:19145\n2016-01-27 19:59:43 [INFO] Default game type: SURVIVAL\n2016-01-27 19:59:43 [INFO] Done (1.226s)! For help, type \"help\" or \"?\"\n2016-01-27 20:00:29 [INFO] CONSOLE: Stopping the server...\n2016-01-27 20:00:29 [INFO] Disabling DevTools v1.10.0\n2016-01-27 20:00:29 [INFO] Disabling Specter v0.2\n2016-01-27 20:00:29 [INFO] Disabling Glifcos-p v1.0.0\n2016-01-27 20:00:29 [INFO] [Glifcos-p] Datasync sent to webserver.\n2016-01-27 20:00:29 [INFO] Unloading level \"world\"\n2016-01-27 20:00:29 [INFO] Stopping other threads\n2016-01-27 20:00:31 [INFO] Starting Minecraft: PE server version v0.10.5 alpha\n2016-01-27 20:00:31 [INFO] Loading pocketmine.yml...\n2016-01-27 20:00:31 [INFO] Loading server properties...\n2016-01-27 20:00:31 [INFO] Starting Minecraft PE server on 0.0.0.0:19145\n2016-01-27 20:00:31 [INFO] This server is running PocketMine-MP version 1.4.1-980 \"\u7d76\u597d(Zekkou)\u30b1\u30fc\u30ad(Cake)\" (API 1.11.0)\n2016-01-27 20:00:31 [INFO] PocketMine-MP is distributed under the LGPL License\n2016-01-27 20:00:31 [INFO] Loading DevTools v1.10.0\n2016-01-27 20:00:31 [INFO] Loading Specter v0.2\n2016-01-27 20:00:31 [INFO] Enabling DevTools v1.10.0\n2016-01-27 20:00:31 [INFO] Loading source plugin Glifcos-p v1.0.0\n2016-01-27 20:00:31 [INFO] [DevTools] Registered folder plugin loader\n2016-01-27 20:00:31 [INFO] Preparing level \"world\"\n2016-01-27 20:00:31 [INFO] Enabling Specter v0.2\n2016-01-27 20:00:31 [INFO] Enabling Glifcos-p v1.0.0\n2016-01-27 20:00:32 [INFO] [Glifcos-p] Datasync sent to webserver.\n2016-01-27 20:00:32 [INFO] Starting GS4 status listener\n2016-01-27 20:00:32 [INFO] Setting query port to 19145\n2016-01-27 20:00:32 [INFO] Query running on 0.0.0.0:19145\n2016-01-27 20:00:32 [INFO] Default game type: SURVIVAL\n2016-01-27 20:00:32 [INFO] Done (0.717s)! For help, type \"help\" or \"?\"\n2016-01-27 20:00:45 [INFO] CONSOLE: Stopping the server...\n2016-01-27 20:00:45 [INFO] Disabling DevTools v1.10.0\n2016-01-27 20:00:45 [INFO] Disabling Specter v0.2\n2016-01-27 20:00:45 [INFO] Disabling Glifcos-p v1.0.0\n2016-01-27 20:00:45 [INFO] [Glifcos-p] Datasync sent to webserver.\n2016-01-27 20:00:45 [INFO] Unloading level \"world\"\n2016-01-27 20:00:45 [INFO] Stopping other threads\n2016-01-27 20:01:49 [INFO] Starting Minecraft: PE server version v0.10.5 alpha\n2016-01-27 20:01:49 [INFO] Loading pocketmine.yml...\n2016-01-27 20:01:49 [INFO] Loading server properties...\n2016-01-27 20:01:49 [INFO] Starting Minecraft PE server on 0.0.0.0:19145\n2016-01-27 20:01:49 [INFO] This server is running PocketMine-MP version 1.4.1-980 \"\u7d76\u597d(Zekkou)\u30b1\u30fc\u30ad(Cake)\" (API 1.11.0)\n2016-01-27 20:01:49 [INFO] PocketMine-MP is distributed under the LGPL License\n2016-01-27 20:01:49 [INFO] Loading DevTools v1.10.0\n2016-01-27 20:01:49 [INFO] Loading Specter v0.2\n2016-01-27 20:01:50 [INFO] Enabling DevTools v1.10.0\n2016-01-27 20:01:50 [INFO] Loading source plugin Glifcos-p v1.0.0\n2016-01-27 20:01:50 [INFO] [DevTools] Registered folder plugin loader\n2016-01-27 20:01:50 [INFO] Preparing level \"world\"\n2016-01-27 20:01:50 [INFO] Enabling Specter v0.2\n2016-01-27 20:01:50 [INFO] Enabling Glifcos-p v1.0.0\n2016-01-27 20:01:50 [INFO] [Glifcos-p] Datasync sent to webserver.\n2016-01-27 20:01:50 [INFO] Starting GS4 status listener\n2016-01-27 20:01:50 [INFO] Setting query port to 19145\n2016-01-27 20:01:50 [INFO] Query running on 0.0.0.0:19145\n2016-01-27 20:01:50 [INFO] Default game type: SURVIVAL\n2016-01-27 20:01:50 [INFO] Done (0.826s)! For help, type \"help\" or \"?\"\n2016-01-27 20:02:29 [INFO] CONSOLE: Stopping the server...\n2016-01-27 20:02:29 [INFO] Disabling DevTools v1.10.0\n2016-01-27 20:02:29 [INFO] Disabling Specter v0.2\n2016-01-27 20:02:29 [INFO] Disabling Glifcos-p v1.0.0\n2016-01-27 20:02:29 [INFO] [Glifcos-p] Datasync sent to webserver.\n2016-01-27 20:02:29 [INFO] Unloading level \"world\"\n2016-01-27 20:02:29 [INFO] Stopping other threads\n2016-01-27 20:03:16 [INFO] Starting Minecraft: PE server version v0.10.5 alpha\n2016-01-27 20:03:16 [INFO] Loading pocketmine.yml...\n2016-01-27 20:03:16 [INFO] Loading server properties...\n2016-01-27 20:03:16 [INFO] Starting Minecraft PE server on 0.0.0.0:19145\n2016-01-27 20:03:16 [INFO] This server is running PocketMine-MP version 1.4.1-980 \"\u7d76\u597d(Zekkou)\u30b1\u30fc\u30ad(Cake)\" (API 1.11.0)\n2016-01-27 20:03:16 [INFO] PocketMine-MP is distributed under the LGPL License\n2016-01-27 20:03:16 [INFO] Loading DevTools v1.10.0\n2016-01-27 20:03:16 [INFO] Loading Specter v0.2\n2016-01-27 20:03:16 [INFO] Enabling DevTools v1.10.0\n2016-01-27 20:03:16 [INFO] Loading source plugin Glifcos-p v1.0.0\n2016-01-27 20:03:16 [INFO] [DevTools] Registered folder plugin loader\n2016-01-27 20:03:16 [INFO] Preparing level \"world\"\n2016-01-27 20:03:16 [INFO] Enabling Specter v0.2\n2016-01-27 20:03:16 [INFO] Enabling Glifcos-p v1.0.0\n2016-01-27 20:03:17 [INFO] [Glifcos-p] Datasync sent to webserver.\n2016-01-27 20:03:17 [INFO] Starting GS4 status listener\n2016-01-27 20:03:17 [INFO] Setting query port to 19145\n2016-01-27 20:03:17 [INFO] Query running on 0.0.0.0:19145\n2016-01-27 20:03:17 [INFO] Default game type: SURVIVAL\n2016-01-27 20:03:17 [INFO] Done (0.865s)! For help, type \"help\" or \"?\"\n2016-01-27 20:03:18 [INFO] [Server] hi\n2016-01-27 20:03:27 [INFO] CONSOLE: Stopping the server...\n2016-01-27 20:03:27 [INFO] Disabling DevTools v1.10.0\n2016-01-27 20:03:27 [INFO] Disabling Specter v0.2\n2016-01-27 20:03:27 [INFO] Disabling Glifcos-p v1.0.0\n2016-01-27 20:03:27 [INFO] [Glifcos-p] Datasync sent to webserver.\n2016-01-27 20:03:27 [INFO] Unloading level \"world\"\n2016-01-27 20:03:27 [INFO] Stopping other threads\n2016-01-27 21:08:44 [INFO] Starting Minecraft: PE server version v0.10.5 alpha\n2016-01-27 21:08:44 [INFO] Loading pocketmine.yml...\n2016-01-27 21:08:44 [INFO] Loading server properties...\n2016-01-27 21:08:44 [INFO] Starting Minecraft PE server on 0.0.0.0:19145\n2016-01-27 21:08:44 [INFO] This server is running PocketMine-MP version 1.4.1-980 \"\u7d76\u597d(Zekkou)\u30b1\u30fc\u30ad(Cake)\" (API 1.11.0)\n2016-01-27 21:08:44 [INFO] PocketMine-MP is distributed under the LGPL License\n2016-01-27 21:08:44 [INFO] Loading DevTools v1.10.0\n2016-01-27 21:08:44 [INFO] Loading Specter v0.2\n2016-01-27 21:08:44 [INFO] Enabling DevTools v1.10.0\n2016-01-27 21:08:44 [INFO] Loading source plugin Glifcos-p v1.0.0\n2016-01-27 21:08:44 [INFO] [DevTools] Registered folder plugin loader\n2016-01-27 21:08:44 [INFO] Preparing level \"world\"\n2016-01-27 21:08:44 [INFO] Enabling Specter v0.2\n2016-01-27 21:08:44 [INFO] Enabling Glifcos-p v1.0.0\n2016-01-27 21:08:45 [INFO] [Glifcos-p] Datasync sent to webserver.\n2016-01-27 21:08:45 [INFO] Starting GS4 status listener\n2016-01-27 21:08:45 [INFO] Setting query port to 19145\n2016-01-27 21:08:45 [INFO] Query running on 0.0.0.0:19145\n2016-01-27 21:08:45 [INFO] Default game type: SURVIVAL\n2016-01-27 21:08:45 [INFO] Done (1.093s)! For help, type \"help\" or \"?\"\n2016-01-27 21:08:46 [INFO] [Glifcos-p] User HotFireyDeath has logged into Glifcos.\n                     IP: 10.240.0.157\n2016-01-27 21:09:16 [INFO] [Glifcos-p] User HotFireyDeath has logged into Glifcos.\n                     IP: 10.240.0.189\n2016-01-27 21:09:34 [INFO] Unknown command. Type \"help\" for help.\n2016-01-27 21:13:34 [INFO] Unknown command. Type \"help\" for help.\n2016-01-27 21:14:09 [INFO] Unknown command. Type \"help\" for help.\n2016-01-27 21:14:31 [INFO] Unknown command. Type \"help\" for help.\n2016-01-27 21:14:36 [INFO] Unknown command. Type \"help\" for help.\n2016-01-27 21:14:40 [INFO] [Server] hi\n2016-01-27 21:14:49 [INFO] [Server] hi\n2016-01-27 21:14:55 [INFO] [Server] hello\n2016-01-27 21:15:24 [INFO] Unknown command. Type \"help\" for help.\n2016-01-27 21:15:28 [INFO] Unknown command. Type \"help\" for help.\n2016-01-27 21:16:14 [INFO] Unknown command. Type \"help\" for help.\n2016-01-27 21:16:21 [INFO] [Server] hi\n2016-01-27 21:16:29 [INFO] CONSOLE: Set time to 0\n2016-01-27 21:22:27 [INFO] CONSOLE: Stopping the server...\n2016-01-27 21:22:27 [INFO] Disabling DevTools v1.10.0\n2016-01-27 21:22:27 [INFO] Disabling Specter v0.2\n2016-01-27 21:22:27 [INFO] Disabling Glifcos-p v1.0.0\n2016-01-27 21:22:27 [INFO] [Glifcos-p] Datasync sent to webserver.\n2016-01-27 21:22:33 [INFO] Unloading level \"world\"\n2016-01-27 21:22:33 [INFO] Stopping other threads\n2016-01-27 21:22:35 [INFO] Starting Minecraft: PE server version v0.10.5 alpha\n2016-01-27 21:22:35 [INFO] Loading pocketmine.yml...\n2016-01-27 21:22:35 [INFO] Loading server properties...\n2016-01-27 21:22:35 [INFO] Starting Minecraft PE server on 0.0.0.0:19145\n2016-01-27 21:22:35 [INFO] This server is running PocketMine-MP version 1.4.1-980 \"\u7d76\u597d(Zekkou)\u30b1\u30fc\u30ad(Cake)\" (API 1.11.0)\n2016-01-27 21:22:35 [INFO] PocketMine-MP is distributed under the LGPL License\n2016-01-27 21:22:35 [INFO] Loading DevTools v1.10.0\n2016-01-27 21:22:35 [INFO] Loading Specter v0.2\n2016-01-27 21:22:35 [INFO] Enabling DevTools v1.10.0\n2016-01-27 21:22:35 [INFO] Loading source plugin Glifcos-p v1.0.0\n2016-01-27 21:22:35 [INFO] [DevTools] Registered folder plugin loader\n2016-01-27 21:22:35 [INFO] Preparing level \"world\"\n2016-01-27 21:22:35 [INFO] Enabling Specter v0.2\n2016-01-27 21:22:35 [INFO] Enabling Glifcos-p v1.0.0\n2016-01-27 21:22:36 [INFO] [Glifcos-p] Datasync sent to webserver.\n2016-01-27 21:22:36 [INFO] Starting GS4 status listener\n2016-01-27 21:22:36 [INFO] Setting query port to 19145\n2016-01-27 21:22:36 [INFO] Query running on 0.0.0.0:19145\n2016-01-27 21:22:36 [INFO] Default game type: SURVIVAL\n2016-01-27 21:22:36 [INFO] Done (1.038s)! For help, type \"help\" or \"?\"\n2016-01-27 21:22:37 [CRITICAL] Could not execute task glifcos\\mainw\\synctask: Array to string conversion\n2016-01-27 21:22:37 [NOTICE] RuntimeException: \"Array to string conversion\" (E_NOTICE) in \"\/src\/pocketmine\/utils\/Utils\" at line 387\n2016-01-27 21:22:39 [CRITICAL] Could not execute task glifcos\\mainw\\synctask: Array to string conversion\n2016-01-27 21:22:39 [NOTICE] RuntimeException: \"Array to string conversion\" (E_NOTICE) in \"\/src\/pocketmine\/utils\/Utils\" at line 387\n2016-01-27 21:22:40 [CRITICAL] Could not execute task glifcos\\mainw\\synctask: Array to string conversion\n2016-01-27 21:22:40 [NOTICE] RuntimeException: \"Array to string conversion\" (E_NOTICE) in \"\/src\/pocketmine\/utils\/Utils\" at line 387\n2016-01-27 21:22:41 [CRITICAL] Could not execute task glifcos\\mainw\\synctask: Array to string conversion\n2016-01-27 21:22:41 [NOTICE] RuntimeException: \"Array to string conversion\" (E_NOTICE) in \"\/src\/pocketmine\/utils\/Utils\" at line 387\n2016-01-27 21:22:44 [CRITICAL] Could not execute task glifcos\\mainw\\synctask: Array to string conversion\n2016-01-27 21:22:44 [NOTICE] RuntimeException: \"Array to string conversion\" (E_NOTICE) in \"\/src\/pocketmine\/utils\/Utils\" at line 387\n2016-01-27 21:22:46 [CRITICAL] Could not execute task glifcos\\mainw\\synctask: Array to string conversion\n2016-01-27 21:22:46 [NOTICE] RuntimeException: \"Array to string conversion\" (E_NOTICE) in \"\/src\/pocketmine\/utils\/Utils\" at line 387\n2016-01-27 21:22:47 [CRITICAL] Could not execute task glifcos\\mainw\\synctask: Array to string conversion\n2016-01-27 21:22:47 [NOTICE] RuntimeException: \"Array to string conversion\" (E_NOTICE) in \"\/src\/pocketmine\/utils\/Utils\" at line 387\n2016-01-27 21:22:48 [CRITICAL] Could not execute task glifcos\\mainw\\synctask: Array to string conversion\n2016-01-27 21:22:48 [NOTICE] RuntimeException: \"Array to string conversion\" (E_NOTICE) in \"\/src\/pocketmine\/utils\/Utils\" at line 387\n2016-01-27 21:22:49 [CRITICAL] Could not execute task glifcos\\mainw\\synctask: Array to string conversion\n2016-01-27 21:22:49 [NOTICE] RuntimeException: \"Array to string conversion\" (E_NOTICE) in \"\/src\/pocketmine\/utils\/Utils\" at line 387\n2016-01-27 21:22:50 [CRITICAL] Could not execute task glifcos\\mainw\\synctask: Array to string conversion\n2016-01-27 21:22:50 [NOTICE] RuntimeException: \"Array to string conversion\" (E_NOTICE) in \"\/src\/pocketmine\/utils\/Utils\" at line 387\n2016-01-27 21:22:51 [CRITICAL] Could not execute task glifcos\\mainw\\synctask: Array to string conversion\n2016-01-27 21:22:51 [NOTICE] RuntimeException: \"Array to string conversion\" (E_NOTICE) in \"\/src\/pocketmine\/utils\/Utils\" at line 387\n2016-01-27 21:22:52 [CRITICAL] Could not execute task glifcos\\mainw\\synctask: Array to string conversion\n2016-01-27 21:22:52 [NOTICE] RuntimeException: \"Array to string conversion\" (E_NOTICE) in \"\/src\/pocketmine\/utils\/Utils\" at line 387\n2016-01-27 21:22:53 [CRITICAL] Could not execute task glifcos\\mainw\\synctask: Array to string conversion\n2016-01-27 21:22:53 [NOTICE] RuntimeException: \"Array to string conversion\" (E_NOTICE) in \"\/src\/pocketmine\/utils\/Utils\" at line 387\n2016-01-27 21:22:54 [CRITICAL] Could not execute task glifcos\\mainw\\synctask: Array to string conversion\n2016-01-27 21:22:54 [NOTICE] RuntimeException: \"Array to string conversion\" (E_NOTICE) in \"\/src\/pocketmine\/utils\/Utils\" at line 387\n2016-01-27 21:22:55 [CRITICAL] Could not execute task glifcos\\mainw\\synctask: Array to string conversion\n2016-01-27 21:22:55 [NOTICE] RuntimeException: \"Array to string conversion\" (E_NOTICE) in \"\/src\/pocketmine\/utils\/Utils\" at line 387\n2016-01-27 21:22:56 [CRITICAL] Could not execute task glifcos\\mainw\\synctask: Array to string conversion\n2016-01-27 21:22:56 [NOTICE] RuntimeException: \"Array to string conversion\" (E_NOTICE) in \"\/src\/pocketmine\/utils\/Utils\" at line 387\n2016-01-27 21:22:57 [CRITICAL] Could not execute task glifcos\\mainw\\synctask: Array to string conversion\n2016-01-27 21:22:57 [NOTICE] RuntimeException: \"Array to string conversion\" (E_NOTICE) in \"\/src\/pocketmine\/utils\/Utils\" at line 387\n2016-01-27 21:22:58 [CRITICAL] Could not execute task glifcos\\mainw\\synctask: Array to string conversion\n2016-01-27 21:22:58 [NOTICE] RuntimeException: \"Array to string conversion\" (E_NOTICE) in \"\/src\/pocketmine\/utils\/Utils\" at line 387\n2016-01-27 21:22:59 [CRITICAL] Could not execute task glifcos\\mainw\\synctask: Array to string conversion\n2016-01-27 21:22:59 [NOTICE] RuntimeException: \"Array to string conversion\" (E_NOTICE) in \"\/src\/pocketmine\/utils\/Utils\" at line 387\n2016-01-27 21:23:00 [CRITICAL] Could not execute task glifcos\\mainw\\synctask: Array to string conversion\n2016-01-27 21:23:00 [NOTICE] RuntimeException: \"Array to string conversion\" (E_NOTICE) in \"\/src\/pocketmine\/utils\/Utils\" at line 387\n2016-01-27 21:23:01 [CRITICAL] Could not execute task glifcos\\mainw\\synctask: Array to string conversion\n2016-01-27 21:23:01 [NOTICE] RuntimeException: \"Array to string conversion\" (E_NOTICE) in \"\/src\/pocketmine\/utils\/Utils\" at line 387\n2016-01-27 21:23:02 [CRITICAL] Could not execute task glifcos\\mainw\\synctask: Array to string conversion\n2016-01-27 21:23:02 [NOTICE] RuntimeException: \"Array to string conversion\" (E_NOTICE) in \"\/src\/pocketmine\/utils\/Utils\" at line 387\n2016-01-27 21:23:03 [CRITICAL] Could not execute task glifcos\\mainw\\synctask: Array to string conversion\n2016-01-27 21:23:03 [NOTICE] RuntimeException: \"Array to string conversion\" (E_NOTICE) in \"\/src\/pocketmine\/utils\/Utils\" at line 387\n2016-01-27 21:23:04 [CRITICAL] Could not execute task glifcos\\mainw\\synctask: Array to string conversion\n2016-01-27 21:23:04 [NOTICE] RuntimeException: \"Array to string conversion\" (E_NOTICE) in \"\/src\/pocketmine\/utils\/Utils\" at line 387\n2016-01-27 21:23:05 [CRITICAL] Could not execute task glifcos\\mainw\\synctask: Array to string conversion\n2016-01-27 21:23:05 [NOTICE] RuntimeException: \"Array to string conversion\" (E_NOTICE) in \"\/src\/pocketmine\/utils\/Utils\" at line 387\n2016-01-27 21:23:06 [CRITICAL] Could not execute task glifcos\\mainw\\synctask: Array to string conversion\n2016-01-27 21:23:06 [NOTICE] RuntimeException: \"Array to string conversion\" (E_NOTICE) in \"\/src\/pocketmine\/utils\/Utils\" at line 387\n2016-01-27 21:23:07 [CRITICAL] Could not execute task glifcos\\mainw\\synctask: Array to string conversion\n2016-01-27 21:23:07 [NOTICE] RuntimeException: \"Array to string conversion\" (E_NOTICE) in \"\/src\/pocketmine\/utils\/Utils\" at line 387\n2016-01-27 21:23:08 [CRITICAL] Could not execute task glifcos\\mainw\\synctask: Array to string conversion\n2016-01-27 21:23:08 [NOTICE] RuntimeException: \"Array to string conversion\" (E_NOTICE) in \"\/src\/pocketmine\/utils\/Utils\" at line 387\n2016-01-27 21:23:09 [CRITICAL] Could not execute task glifcos\\mainw\\synctask: Array to string conversion\n2016-01-27 21:23:09 [NOTICE] RuntimeException: \"Array to string conversion\" (E_NOTICE) in \"\/src\/pocketmine\/utils\/Utils\" at line 387\n2016-01-27 21:23:10 [CRITICAL] Could not execute task glifcos\\mainw\\synctask: Array to string conversion\n2016-01-27 21:23:10 [NOTICE] RuntimeException: \"Array to string conversion\" (E_NOTICE) in \"\/src\/pocketmine\/utils\/Utils\" at line 387\n2016-01-27 21:23:11 [CRITICAL] Could not execute task glifcos\\mainw\\synctask: Array to string conversion\n2016-01-27 21:23:11 [NOTICE] RuntimeException: \"Array to string conversion\" (E_NOTICE) in \"\/src\/pocketmine\/utils\/Utils\" at line 387\n2016-01-27 21:23:12 [CRITICAL] Could not execute task glifcos\\mainw\\synctask: Array to string conversion\n2016-01-27 21:23:12 [NOTICE] RuntimeException: \"Array to string conversion\" (E_NOTICE) in \"\/src\/pocketmine\/utils\/Utils\" at line 387\n2016-01-27 21:23:13 [CRITICAL] Could not execute task glifcos\\mainw\\synctask: Array to string conversion\n2016-01-27 21:23:13 [NOTICE] RuntimeException: \"Array to string conversion\" (E_NOTICE) in \"\/src\/pocketmine\/utils\/Utils\" at line 387\n2016-01-27 21:23:14 [CRITICAL] Could not execute task glifcos\\mainw\\synctask: Array to string conversion\n2016-01-27 21:23:14 [NOTICE] RuntimeException: \"Array to string conversion\" (E_NOTICE) in \"\/src\/pocketmine\/utils\/Utils\" at line 387\n2016-01-27 21:23:15 [CRITICAL] Could not execute task glifcos\\mainw\\synctask: Array to string conversion\n2016-01-27 21:23:15 [NOTICE] RuntimeException: \"Array to string conversion\" (E_NOTICE) in \"\/src\/pocketmine\/utils\/Utils\" at line 387\n2016-01-27 21:23:16 [CRITICAL] Could not execute task glifcos\\mainw\\synctask: Array to string conversion\n2016-01-27 21:23:16 [NOTICE] RuntimeException: \"Array to string conversion\" (E_NOTICE) in \"\/src\/pocketmine\/utils\/Utils\" at line 387\n2016-01-27 21:23:17 [CRITICAL] Could not execute task glifcos\\mainw\\synctask: Array to string conversion\n2016-01-27 21:23:17 [NOTICE] RuntimeException: \"Array to string conversion\" (E_NOTICE) in \"\/src\/pocketmine\/utils\/Utils\" at line 387\n2016-01-27 21:23:18 [CRITICAL] Could not execute task glifcos\\mainw\\synctask: Array to string conversion\n2016-01-27 21:23:18 [NOTICE] RuntimeException: \"Array to string conversion\" (E_NOTICE) in \"\/src\/pocketmine\/utils\/Utils\" at line 387\n2016-01-27 21:23:19 [CRITICAL] Could not execute task glifcos\\mainw\\synctask: Array to string conversion\n2016-01-27 21:23:19 [NOTICE] RuntimeException: \"Array to string conversion\" (E_NOTICE) in \"\/src\/pocketmine\/utils\/Utils\" at line 387\n2016-01-27 21:23:20 [CRITICAL] Could not execute task glifcos\\mainw\\synctask: Array to string conversion\n2016-01-27 21:23:20 [NOTICE] RuntimeException: \"Array to string conversion\" (E_NOTICE) in \"\/src\/pocketmine\/utils\/Utils\" at line 387\n2016-01-27 21:23:21 [CRITICAL] Could not execute task glifcos\\mainw\\synctask: Array to string conversion\n2016-01-27 21:23:21 [NOTICE] RuntimeException: \"Array to string conversion\" (E_NOTICE) in \"\/src\/pocketmine\/utils\/Utils\" at line 387\n2016-01-27 21:23:22 [CRITICAL] Could not execute task glifcos\\mainw\\synctask: Array to string conversion\n2016-01-27 21:23:22 [NOTICE] RuntimeException: \"Array to string conversion\" (E_NOTICE) in \"\/src\/pocketmine\/utils\/Utils\" at line 387\n2016-01-27 21:23:23 [CRITICAL] Could not execute task glifcos\\mainw\\synctask: Array to string conversion\n2016-01-27 21:23:23 [NOTICE] RuntimeException: \"Array to string conversion\" (E_NOTICE) in \"\/src\/pocketmine\/utils\/Utils\" at line 387\n2016-01-27 21:23:24 [CRITICAL] Could not execute task glifcos\\mainw\\synctask: Array to string conversion\n2016-01-27 21:23:24 [NOTICE] RuntimeException: \"Array to string conversion\" (E_NOTICE) in \"\/src\/pocketmine\/utils\/Utils\" at line 387\n2016-01-27 21:23:25 [CRITICAL] Could not execute task glifcos\\mainw\\synctask: Array to string conversion\n2016-01-27 21:23:25 [NOTICE] RuntimeException: \"Array to string conversion\" (E_NOTICE) in \"\/src\/pocketmine\/utils\/Utils\" at line 387\n2016-01-27 21:23:26 [CRITICAL] Could not execute task glifcos\\mainw\\synctask: Array to string conversion\n2016-01-27 21:23:26 [NOTICE] RuntimeException: \"Array to string conversion\" (E_NOTICE) in \"\/src\/pocketmine\/utils\/Utils\" at line 387\n2016-01-27 21:23:27 [CRITICAL] Could not execute task glifcos\\mainw\\synctask: Array to string conversion\n2016-01-27 21:23:27 [NOTICE] RuntimeException: \"Array to string conversion\" (E_NOTICE) in \"\/src\/pocketmine\/utils\/Utils\" at line 387\n2016-01-27 21:23:28 [CRITICAL] Could not execute task glifcos\\mainw\\synctask: Array to string conversion\n2016-01-27 21:23:28 [NOTICE] RuntimeException: \"Array to string conversion\" (E_NOTICE) in \"\/src\/pocketmine\/utils\/Utils\" at line 387\n2016-01-27 21:23:29 [CRITICAL] Could not execute task glifcos\\mainw\\synctask: Array to string conversion\n2016-01-27 21:23:29 [NOTICE] RuntimeException: \"Array to string conversion\" (E_NOTICE) in \"\/src\/pocketmine\/utils\/Utils\" at line 387\n2016-01-27 21:23:30 [CRITICAL] Could not execute task glifcos\\mainw\\synctask: Array to string conversion\n2016-01-27 21:23:30 [NOTICE] RuntimeException: \"Array to string conversion\" (E_NOTICE) in \"\/src\/pocketmine\/utils\/Utils\" at line 387\n2016-01-27 21:23:31 [CRITICAL] Could not execute task glifcos\\mainw\\synctask: Array to string conversion\n2016-01-27 21:23:31 [NOTICE] RuntimeException: \"Array to string conversion\" (E_NOTICE) in \"\/src\/pocketmine\/utils\/Utils\" at line 387\n2016-01-27 21:23:32 [CRITICAL] Could not execute task glifcos\\mainw\\synctask: Array to string conversion\n2016-01-27 21:23:32 [NOTICE] RuntimeException: \"Array to string conversion\" (E_NOTICE) in \"\/src\/pocketmine\/utils\/Utils\" at line 387\n2016-01-27 21:23:33 [CRITICAL] Could not execute task glifcos\\mainw\\synctask: Array to string conversion\n2016-01-27 21:23:33 [NOTICE] RuntimeException: \"Array to string conversion\" (E_NOTICE) in \"\/src\/pocketmine\/utils\/Utils\" at line 387\n2016-01-27 21:23:34 [CRITICAL] Could not execute task glifcos\\mainw\\synctask: Array to string conversion\n2016-01-27 21:23:34 [NOTICE] RuntimeException: \"Array to string conversion\" (E_NOTICE) in \"\/src\/pocketmine\/utils\/Utils\" at line 387\n2016-01-27 21:23:34 [INFO] CONSOLE: Stopping the server...\n2016-01-27 21:23:34 [INFO] Disabling DevTools v1.10.0\n2016-01-27 21:23:34 [INFO] Disabling Specter v0.2\n2016-01-27 21:23:34 [INFO] Disabling Glifcos-p v1.0.0\n2016-01-27 21:23:34 [INFO] [Glifcos-p] Datasync sent to webserver.\n2016-01-27 21:23:34 [INFO] Unloading level \"world\"\n2016-01-27 21:23:34 [INFO] Stopping other threads\n2016-01-27 21:24:36 [INFO] Starting Minecraft: PE server version v0.10.5 alpha\n2016-01-27 21:24:36 [INFO] Loading pocketmine.yml...\n2016-01-27 21:24:36 [INFO] Loading server properties...\n2016-01-27 21:24:36 [INFO] Starting Minecraft PE server on 0.0.0.0:19145\n2016-01-27 21:24:36 [INFO] This server is running PocketMine-MP version 1.4.1-980 \"\u7d76\u597d(Zekkou)\u30b1\u30fc\u30ad(Cake)\" (API 1.11.0)\n2016-01-27 21:24:36 [INFO] PocketMine-MP is distributed under the LGPL License\n2016-01-27 21:24:36 [INFO] Loading DevTools v1.10.0\n2016-01-27 21:24:36 [INFO] Loading Specter v0.2\n2016-01-27 21:24:36 [INFO] Enabling DevTools v1.10.0\n2016-01-27 21:24:36 [INFO] Loading source plugin Glifcos-p v1.0.0\n2016-01-27 21:24:36 [INFO] [DevTools] Registered folder plugin loader\n2016-01-27 21:24:36 [INFO] Preparing level \"world\"\n2016-01-27 21:24:36 [INFO] Enabling Specter v0.2\n2016-01-27 21:24:36 [INFO] Enabling Glifcos-p v1.0.0\n2016-01-27 21:24:37 [INFO] [Glifcos-p] Datasync sent to webserver.\n2016-01-27 21:24:37 [INFO] Starting GS4 status listener\n2016-01-27 21:24:37 [INFO] Setting query port to 19145\n2016-01-27 21:24:37 [INFO] Query running on 0.0.0.0:19145\n2016-01-27 21:24:37 [INFO] Default game type: SURVIVAL\n2016-01-27 21:24:37 [INFO] Done (1.058s)! For help, type \"help\" or \"?\"\n2016-01-27 21:24:39 [CRITICAL] Could not execute task glifcos\\mainw\\synctask: Array to string conversion\n2016-01-27 21:24:39 [NOTICE] RuntimeException: \"Array to string conversion\" (E_NOTICE) in \"\/src\/pocketmine\/utils\/Utils\" at line 387\n2016-01-27 21:24:40 [CRITICAL] Could not execute task glifcos\\mainw\\synctask: Array to string conversion\n2016-01-27 21:24:40 [NOTICE] RuntimeException: \"Array to string conversion\" (E_NOTICE) in \"\/src\/pocketmine\/utils\/Utils\" at line 387\n2016-01-27 21:24:40 [INFO] CONSOLE: Stopping the server...\n2016-01-27 21:24:40 [INFO] Disabling DevTools v1.10.0\n2016-01-27 21:24:40 [INFO] Disabling Specter v0.2\n2016-01-27 21:24:40 [INFO] Disabling Glifcos-p v1.0.0\n2016-01-27 21:24:40 [INFO] [Glifcos-p] Datasync sent to webserver.\n2016-01-27 21:24:40 [INFO] Unloading level \"world\"\n2016-01-27 21:24:40 [INFO] Stopping other threads\n2016-01-27 21:24:47 [INFO] Starting Minecraft: PE server version v0.10.5 alpha\n2016-01-27 21:24:47 [INFO] Loading pocketmine.yml...\n2016-01-27 21:24:47 [INFO] Loading server properties...\n2016-01-27 21:24:47 [INFO] Starting Minecraft PE server on 0.0.0.0:19145\n2016-01-27 21:24:47 [INFO] This server is running PocketMine-MP version 1.4.1-980 \"\u7d76\u597d(Zekkou)\u30b1\u30fc\u30ad(Cake)\" (API 1.11.0)\n2016-01-27 21:24:47 [INFO] PocketMine-MP is distributed under the LGPL License\n2016-01-27 21:24:47 [INFO] Loading DevTools v1.10.0\n2016-01-27 21:24:47 [INFO] Loading Specter v0.2\n2016-01-27 21:24:47 [INFO] Enabling DevTools v1.10.0\n2016-01-27 21:24:47 [INFO] Loading source plugin Glifcos-p v1.0.0\n2016-01-27 21:24:47 [INFO] [DevTools] Registered folder plugin loader\n2016-01-27 21:24:47 [INFO] Preparing level \"world\"\n2016-01-27 21:24:47 [INFO] Enabling Specter v0.2\n2016-01-27 21:24:47 [INFO] Enabling Glifcos-p v1.0.0\n2016-01-27 21:24:48 [INFO] [Glifcos-p] Datasync sent to webserver.\n2016-01-27 21:24:48 [INFO] Starting GS4 status listener\n2016-01-27 21:24:48 [INFO] Setting query port to 19145\n2016-01-27 21:24:48 [INFO] Query running on 0.0.0.0:19145\n2016-01-27 21:24:48 [INFO] Default game type: SURVIVAL\n2016-01-27 21:24:48 [INFO] Done (1.004s)! For help, type \"help\" or \"?\"\n2016-01-27 21:24:52 [INFO] CONSOLE: Stopping the server...\n2016-01-27 21:24:52 [INFO] Disabling DevTools v1.10.0\n2016-01-27 21:24:52 [INFO] Disabling Specter v0.2\n2016-01-27 21:24:52 [INFO] Disabling Glifcos-p v1.0.0\n2016-01-27 21:24:52 [INFO] [Glifcos-p] Datasync sent to webserver.\n2016-01-27 21:24:52 [INFO] Unloading level \"world\"\n2016-01-27 21:24:52 [INFO] Stopping other threads\n2016-01-27 21:25:43 [INFO] Starting Minecraft: PE server version v0.10.5 alpha\n2016-01-27 21:25:43 [INFO] Loading pocketmine.yml...\n2016-01-27 21:25:43 [INFO] Loading server properties...\n2016-01-27 21:25:43 [INFO] Starting Minecraft PE server on 0.0.0.0:19145\n2016-01-27 21:25:43 [INFO] This server is running PocketMine-MP version 1.4.1-980 \"\u7d76\u597d(Zekkou)\u30b1\u30fc\u30ad(Cake)\" (API 1.11.0)\n2016-01-27 21:25:43 [INFO] PocketMine-MP is distributed under the LGPL License\n2016-01-27 21:25:43 [INFO] Loading DevTools v1.10.0\n2016-01-27 21:25:43 [INFO] Loading Specter v0.2\n2016-01-27 21:25:43 [INFO] Enabling DevTools v1.10.0\n2016-01-27 21:25:43 [INFO] Loading source plugin Glifcos-p v1.0.0\n2016-01-27 21:25:43 [INFO] [DevTools] Registered folder plugin loader\n2016-01-27 21:25:43 [INFO] Preparing level \"world\"\n2016-01-27 21:25:43 [INFO] Enabling Specter v0.2\n2016-01-27 21:25:43 [INFO] Enabling Glifcos-p v1.0.0\n2016-01-27 21:25:44 [INFO] [Glifcos-p] Datasync sent to webserver.\n2016-01-27 21:25:44 [INFO] Starting GS4 status listener\n2016-01-27 21:25:44 [INFO] Setting query port to 19145\n2016-01-27 21:25:44 [INFO] Query running on 0.0.0.0:19145\n2016-01-27 21:25:44 [INFO] Default game type: SURVIVAL\n2016-01-27 21:25:44 [INFO] Done (1.201s)! For help, type \"help\" or \"?\"\n2016-01-27 21:26:19 [INFO] CONSOLE: Stopping the server...\n2016-01-27 21:26:19 [INFO] Disabling DevTools v1.10.0\n2016-01-27 21:26:19 [INFO] Disabling Specter v0.2\n2016-01-27 21:26:19 [INFO] Disabling Glifcos-p v1.0.0\n2016-01-27 21:26:19 [INFO] [Glifcos-p] Datasync sent to webserver.\n2016-01-27 21:26:19 [INFO] Unloading level \"world\"\n2016-01-27 21:26:19 [INFO] Stopping other threads\n2016-01-27 21:26:21 [INFO] Starting Minecraft: PE server version v0.10.5 alpha\n2016-01-27 21:26:21 [INFO] Loading pocketmine.yml...\n2016-01-27 21:26:21 [INFO] Loading server properties...\n2016-01-27 21:26:21 [INFO] Starting Minecraft PE server on 0.0.0.0:19145\n2016-01-27 21:26:21 [INFO] This server is running PocketMine-MP version 1.4.1-980 \"\u7d76\u597d(Zekkou)\u30b1\u30fc\u30ad(Cake)\" (API 1.11.0)\n2016-01-27 21:26:21 [INFO] PocketMine-MP is distributed under the LGPL License\n2016-01-27 21:26:21 [INFO] Loading DevTools v1.10.0\n2016-01-27 21:26:21 [INFO] Loading Specter v0.2\n2016-01-27 21:26:21 [INFO] Enabling DevTools v1.10.0\n2016-01-27 21:26:21 [INFO] Loading source plugin Glifcos-p v1.0.0\n2016-01-27 21:26:21 [INFO] [DevTools] Registered folder plugin loader\n2016-01-27 21:26:21 [INFO] Preparing level \"world\"\n2016-01-27 21:26:21 [INFO] Enabling Specter v0.2\n2016-01-27 21:26:21 [INFO] Enabling Glifcos-p v1.0.0\n2016-01-27 21:26:22 [INFO] [Glifcos-p] Datasync sent to webserver.\n2016-01-27 21:26:22 [INFO] Starting GS4 status listener\n2016-01-27 21:26:22 [INFO] Setting query port to 19145\n2016-01-27 21:26:22 [INFO] Query running on 0.0.0.0:19145\n2016-01-27 21:26:22 [INFO] Default game type: SURVIVAL\n2016-01-27 21:26:22 [INFO] Done (1.174s)! For help, type \"help\" or \"?\"\n2016-01-27 21:28:37 [CRITICAL] Could not execute task glifcos\\mainw\\synctask: fopen(http:\/\/www.glifcos-hotfireydeath.c9users.io\/glifcos-webserver\/connection.php?type=memsync&cm=27&tm=512): failed to open stream: HTTP request failed! \n2016-01-27 21:28:37 [WARNING] RuntimeException: \"fopen(http:\/\/www.glifcos-hotfireydeath.c9users.io\/glifcos-webserver\/connection.php?type=memsync&cm=27&tm=512): failed to open stream: HTTP request failed! \" (E_WARNING) in \"\/glifcos-plugin\/src\/glifcos\/mainw\/synctask\" at line 43\n2016-01-27 21:32:45 [CRITICAL] Could not execute task glifcos\\mainw\\synctask: fopen(http:\/\/www.glifcos-hotfireydeath.c9users.io\/glifcos-webserver\/connection.php?type=memsync&cm=27&tm=512): failed to open stream: HTTP request failed! \n2016-01-27 21:32:45 [WARNING] RuntimeException: \"fopen(http:\/\/www.glifcos-hotfireydeath.c9users.io\/glifcos-webserver\/connection.php?type=memsync&cm=27&tm=512): failed to open stream: HTTP request failed! \" (E_WARNING) in \"\/glifcos-plugin\/src\/glifcos\/mainw\/synctask\" at line 43\n2016-01-27 21:38:53 [CRITICAL] Could not execute task glifcos\\mainw\\synctask: fopen(http:\/\/www.glifcos-hotfireydeath.c9users.io\/glifcos-webserver\/connection.php?type=cpu&s=6.88): failed to open stream: HTTP request failed! \n2016-01-27 21:38:53 [WARNING] RuntimeException: \"fopen(http:\/\/www.glifcos-hotfireydeath.c9users.io\/glifcos-webserver\/connection.php?type=cpu&s=6.88): failed to open stream: HTTP request failed! \" (E_WARNING) in \"\/glifcos-plugin\/src\/glifcos\/mainw\/synctask\" at line 81\n2016-01-27 21:43:00 [CRITICAL] Could not execute task glifcos\\mainw\\synctask: fopen(http:\/\/www.glifcos-hotfireydeath.c9users.io\/glifcos-webserver\/connection.php?type=cpu&s=3.06): failed to open stream: HTTP request failed! \n2016-01-27 21:43:00 [WARNING] RuntimeException: \"fopen(http:\/\/www.glifcos-hotfireydeath.c9users.io\/glifcos-webserver\/connection.php?type=cpu&s=3.06): failed to open stream: HTTP request failed! \" (E_WARNING) in \"\/glifcos-plugin\/src\/glifcos\/mainw\/synctask\" at line 81\n2016-01-27 22:01:45 [CRITICAL] Could not execute task glifcos\\mainw\\synctask: fopen(http:\/\/www.glifcos-hotfireydeath.c9users.io\/glifcos-webserver\/connection.php?type=memsync&cm=27&tm=512): failed to open stream: HTTP request failed! \n2016-01-27 22:01:45 [WARNING] RuntimeException: \"fopen(http:\/\/www.glifcos-hotfireydeath.c9users.io\/glifcos-webserver\/connection.php?type=memsync&cm=27&tm=512): failed to open stream: HTTP request failed! \" (E_WARNING) in \"\/glifcos-plugin\/src\/glifcos\/mainw\/synctask\" at line 43\n2016-01-27 22:03:51 [CRITICAL] Could not execute task glifcos\\mainw\\synctask: fopen(http:\/\/www.glifcos-hotfireydeath.c9users.io\/glifcos-webserver\/connection.php?type=cpu&s=2.7): failed to open stream: HTTP request failed! \n2016-01-27 22:03:51 [WARNING] RuntimeException: \"fopen(http:\/\/www.glifcos-hotfireydeath.c9users.io\/glifcos-webserver\/connection.php?type=cpu&s=2.7): failed to open stream: HTTP request failed! \" (E_WARNING) in \"\/glifcos-plugin\/src\/glifcos\/mainw\/synctask\" at line 81\n2016-01-27 22:14:25 [CRITICAL] Could not execute task glifcos\\mainw\\synctask: fopen(http:\/\/www.glifcos-hotfireydeath.c9users.io\/glifcos-webserver\/connection.php?type=cpu&s=2.73): failed to open stream: HTTP request failed! \n2016-01-27 22:14:25 [WARNING] RuntimeException: \"fopen(http:\/\/www.glifcos-hotfireydeath.c9users.io\/glifcos-webserver\/connection.php?type=cpu&s=2.73): failed to open stream: HTTP request failed! \" (E_WARNING) in \"\/glifcos-plugin\/src\/glifcos\/mainw\/synctask\" at line 81\n2016-01-27 22:30:55 [CRITICAL] Could not execute task glifcos\\mainw\\synctask: fopen(http:\/\/www.glifcos-hotfireydeath.c9users.io\/glifcos-webserver\/connection.php?type=memsync&cm=27&tm=512): failed to open stream: HTTP request failed! \n2016-01-27 22:30:55 [WARNING] RuntimeException: \"fopen(http:\/\/www.glifcos-hotfireydeath.c9users.io\/glifcos-webserver\/connection.php?type=memsync&cm=27&tm=512): failed to open stream: HTTP request failed! \" (E_WARNING) in \"\/glifcos-plugin\/src\/glifcos\/mainw\/synctask\" at line 43\n2016-01-27 22:37:55 [CRITICAL] Could not execute task glifcos\\mainw\\synctask: fopen(http:\/\/www.glifcos-hotfireydeath.c9users.io\/glifcos-webserver\/connection.php?type=memsync&cm=27&tm=512): failed to open stream: HTTP request failed! \n2016-01-27 22:37:55 [WARNING] RuntimeException: \"fopen(http:\/\/www.glifcos-hotfireydeath.c9users.io\/glifcos-webserver\/connection.php?type=memsync&cm=27&tm=512): failed to open stream: HTTP request failed! \" (E_WARNING) in \"\/glifcos-plugin\/src\/glifcos\/mainw\/synctask\" at line 43\n2016-01-27 22:57:49 [CRITICAL] Could not execute task glifcos\\mainw\\synctask: fopen(http:\/\/www.glifcos-hotfireydeath.c9users.io\/glifcos-webserver\/connection.php?type=cpu&s=3.82): failed to open stream: HTTP request failed! \n2016-01-27 22:57:49 [WARNING] RuntimeException: \"fopen(http:\/\/www.glifcos-hotfireydeath.c9users.io\/glifcos-webserver\/connection.php?type=cpu&s=3.82): failed to open stream: HTTP request failed! \" (E_WARNING) in \"\/glifcos-plugin\/src\/glifcos\/mainw\/synctask\" at line 81\n2016-01-27 23:38:28 [CRITICAL] Could not execute task glifcos\\mainw\\synctask: fopen(http:\/\/www.glifcos-hotfireydeath.c9users.io\/glifcos-webserver\/connection.php?type=memsync&cm=27&tm=512): failed to open stream: HTTP request failed! \n2016-01-27 23:38:28 [WARNING] RuntimeException: \"fopen(http:\/\/www.glifcos-hotfireydeath.c9users.io\/glifcos-webserver\/connection.php?type=memsync&cm=27&tm=512): failed to open stream: HTTP request failed! \" (E_WARNING) in \"\/glifcos-plugin\/src\/glifcos\/mainw\/synctask\" at line 43\n2016-01-27 23:48:55 [CRITICAL] Could not execute task glifcos\\mainw\\synctask: fopen(http:\/\/www.glifcos-hotfireydeath.c9users.io\/glifcos-webserver\/connection.php?type=cpu&s=3.54): failed to open stream: HTTP request failed! \n2016-01-27 23:48:55 [WARNING] RuntimeException: \"fopen(http:\/\/www.glifcos-hotfireydeath.c9users.io\/glifcos-webserver\/connection.php?type=cpu&s=3.54): failed to open stream: HTTP request failed! \" (E_WARNING) in \"\/glifcos-plugin\/src\/glifcos\/mainw\/synctask\" at line 81\n2016-01-28 00:48:24 [CRITICAL] Could not execute task glifcos\\mainw\\synctask: fopen(http:\/\/www.glifcos-hotfireydeath.c9users.io\/glifcos-webserver\/connection.php?type=cpu&s=3.4): failed to open stream: HTTP request failed! \n2016-01-28 00:48:24 [WARNING] RuntimeException: \"fopen(http:\/\/www.glifcos-hotfireydeath.c9users.io\/glifcos-webserver\/connection.php?type=cpu&s=3.4): failed to open stream: HTTP request failed! \" (E_WARNING) in \"\/glifcos-plugin\/src\/glifcos\/mainw\/synctask\" at line 81\n2016-01-28 01:34:13 [CRITICAL] Could not execute task glifcos\\mainw\\synctask: fopen(http:\/\/www.glifcos-hotfireydeath.c9users.io\/glifcos-webserver\/connection.php?type=cpu&s=3.88): failed to open stream: HTTP request failed! \n2016-01-28 01:34:13 [WARNING] RuntimeException: \"fopen(http:\/\/www.glifcos-hotfireydeath.c9users.io\/glifcos-webserver\/connection.php?type=cpu&s=3.88): failed to open stream: HTTP request failed! \" (E_WARNING) in \"\/glifcos-plugin\/src\/glifcos\/mainw\/synctask\" at line 81\n2016-01-28 01:41:54 [CRITICAL] Could not execute task glifcos\\mainw\\synctask: fopen(http:\/\/www.glifcos-hotfireydeath.c9users.io\/glifcos-webserver\/connection.php?type=cpu&s=7.35): failed to open stream: HTTP request failed! \n2016-01-28 01:41:54 [WARNING] RuntimeException: \"fopen(http:\/\/www.glifcos-hotfireydeath.c9users.io\/glifcos-webserver\/connection.php?type=cpu&s=7.35): failed to open stream: HTTP request failed! \" (E_WARNING) in \"\/glifcos-plugin\/src\/glifcos\/mainw\/synctask\" at line 81\n2016-01-28 01:48:52 [CRITICAL] Could not execute task glifcos\\mainw\\synctask: fopen(http:\/\/www.glifcos-hotfireydeath.c9users.io\/glifcos-webserver\/connection.php?type=cpu&s=2.41): failed to open stream: HTTP request failed! \n2016-01-28 01:48:52 [WARNING] RuntimeException: \"fopen(http:\/\/www.glifcos-hotfireydeath.c9users.io\/glifcos-webserver\/connection.php?type=cpu&s=2.41): failed to open stream: HTTP request failed! \" (E_WARNING) in \"\/glifcos-plugin\/src\/glifcos\/mainw\/synctask\" at line 81\n2016-01-28 01:54:57 [CRITICAL] Could not execute task glifcos\\mainw\\synctask: fopen(http:\/\/www.glifcos-hotfireydeath.c9users.io\/glifcos-webserver\/connection.php?type=cpu&s=4.17): failed to open stream: HTTP request failed! \n2016-01-28 01:54:57 [WARNING] RuntimeException: \"fopen(http:\/\/www.glifcos-hotfireydeath.c9users.io\/glifcos-webserver\/connection.php?type=cpu&s=4.17): failed to open stream: HTTP request failed! \" (E_WARNING) in \"\/glifcos-plugin\/src\/glifcos\/mainw\/synctask\" at line 81\n2016-01-28 01:59:08 [CRITICAL] Could not execute task glifcos\\mainw\\synctask: fopen(http:\/\/www.glifcos-hotfireydeath.c9users.io\/glifcos-webserver\/connection.php?type=memsync&cm=27&tm=512): failed to open stream: HTTP request failed! \n2016-01-28 01:59:08 [WARNING] RuntimeException: \"fopen(http:\/\/www.glifcos-hotfireydeath.c9users.io\/glifcos-webserver\/connection.php?type=memsync&cm=27&tm=512): failed to open stream: HTTP request failed! \" (E_WARNING) in \"\/glifcos-plugin\/src\/glifcos\/mainw\/synctask\" at line 43\n2016-01-28 02:27:42 [CRITICAL] Could not execute task glifcos\\mainw\\synctask: fopen(http:\/\/www.glifcos-hotfireydeath.c9users.io\/glifcos-webserver\/connection.php?type=memsync&cm=27&tm=512): failed to open stream: HTTP request failed! \n2016-01-28 02:27:42 [WARNING] RuntimeException: \"fopen(http:\/\/www.glifcos-hotfireydeath.c9users.io\/glifcos-webserver\/connection.php?type=memsync&cm=27&tm=512): failed to open stream: HTTP request failed! \" (E_WARNING) in \"\/glifcos-plugin\/src\/glifcos\/mainw\/synctask\" at line 43\n2016-01-28 02:29:50 [CRITICAL] Could not execute task glifcos\\mainw\\synctask: fopen(http:\/\/www.glifcos-hotfireydeath.c9users.io\/glifcos-webserver\/connection.php?type=cpu&s=3.4): failed to open stream: HTTP request failed! \n2016-01-28 02:29:50 [WARNING] RuntimeException: \"fopen(http:\/\/www.glifcos-hotfireydeath.c9users.io\/glifcos-webserver\/connection.php?type=cpu&s=3.4): failed to open stream: HTTP request failed! \" (E_WARNING) in \"\/glifcos-plugin\/src\/glifcos\/mainw\/synctask\" at line 81\n2016-01-28 02:53:27 [CRITICAL] Could not execute task glifcos\\mainw\\synctask: fopen(http:\/\/www.glifcos-hotfireydeath.c9users.io\/glifcos-webserver\/connection.php?type=cpu&s=2.71): failed to open stream: HTTP request failed! \n2016-01-28 02:53:27 [WARNING] RuntimeException: \"fopen(http:\/\/www.glifcos-hotfireydeath.c9users.io\/glifcos-webserver\/connection.php?type=cpu&s=2.71): failed to open stream: HTTP request failed! \" (E_WARNING) in \"\/glifcos-plugin\/src\/glifcos\/mainw\/synctask\" at line 81\n2016-01-28 03:18:21 [CRITICAL] Could not execute task glifcos\\mainw\\synctask: fopen(http:\/\/www.glifcos-hotfireydeath.c9users.io\/glifcos-webserver\/connection.php?type=cpu&s=4.01): failed to open stream: HTTP request failed! \n2016-01-28 03:18:21 [WARNING] RuntimeException: \"fopen(http:\/\/www.glifcos-hotfireydeath.c9users.io\/glifcos-webserver\/connection.php?type=cpu&s=4.01): failed to open stream: HTTP request failed! \" (E_WARNING) in \"\/glifcos-plugin\/src\/glifcos\/mainw\/synctask\" at line 81\n2016-01-28 03:25:07 [CRITICAL] Could not execute task glifcos\\mainw\\synctask: fopen(http:\/\/www.glifcos-hotfireydeath.c9users.io\/glifcos-webserver\/connection.php?type=cpu&s=2.64): failed to open stream: HTTP request failed! \n2016-01-28 03:25:07 [WARNING] RuntimeException: \"fopen(http:\/\/www.glifcos-hotfireydeath.c9users.io\/glifcos-webserver\/connection.php?type=cpu&s=2.64): failed to open stream: HTTP request failed! \" (E_WARNING) in \"\/glifcos-plugin\/src\/glifcos\/mainw\/synctask\" at line 81\n2016-01-28 03:39:10 [CRITICAL] Could not execute task glifcos\\mainw\\synctask: fopen(http:\/\/www.glifcos-hotfireydeath.c9users.io\/glifcos-webserver\/connection.php?type=memsync&cm=27&tm=512): failed to open stream: HTTP request failed! \n2016-01-28 03:39:10 [WARNING] RuntimeException: \"fopen(http:\/\/www.glifcos-hotfireydeath.c9users.io\/glifcos-webserver\/connection.php?type=memsync&cm=27&tm=512): failed to open stream: HTTP request failed! \" (E_WARNING) in \"\/glifcos-plugin\/src\/glifcos\/mainw\/synctask\" at line 43\n2016-01-28 03:48:32 [CRITICAL] Could not execute task glifcos\\mainw\\synctask: fopen(http:\/\/www.glifcos-hotfireydeath.c9users.io\/glifcos-webserver\/connection.php?type=memsync&cm=27&tm=512): failed to open stream: HTTP request failed! \n2016-01-28 03:48:32 [WARNING] RuntimeException: \"fopen(http:\/\/www.glifcos-hotfireydeath.c9users.io\/glifcos-webserver\/connection.php?type=memsync&cm=27&tm=512): failed to open stream: HTTP request failed! \" (E_WARNING) in \"\/glifcos-plugin\/src\/glifcos\/mainw\/synctask\" at line 43\n2016-01-28 03:52:02 [CRITICAL] Could not execute task glifcos\\mainw\\synctask: fopen(http:\/\/www.glifcos-hotfireydeath.c9users.io\/glifcos-webserver\/connection.php?type=cpu&s=4.94): failed to open stream: HTTP request failed! \n2016-01-28 03:52:02 [WARNING] RuntimeException: \"fopen(http:\/\/www.glifcos-hotfireydeath.c9users.io\/glifcos-webserver\/connection.php?type=cpu&s=4.94): failed to open stream: HTTP request failed! \" (E_WARNING) in \"\/glifcos-plugin\/src\/glifcos\/mainw\/synctask\" at line 81\n2016-01-28 03:55:15 [CRITICAL] Could not execute task glifcos\\mainw\\synctask: fopen(http:\/\/www.glifcos-hotfireydeath.c9users.io\/glifcos-webserver\/connection.php?type=memsync&cm=27&tm=512): failed to open stream: HTTP request failed! \n2016-01-28 03:55:15 [WARNING] RuntimeException: \"fopen(http:\/\/www.glifcos-hotfireydeath.c9users.io\/glifcos-webserver\/connection.php?type=memsync&cm=27&tm=512): failed to open stream: HTTP request failed! \" (E_WARNING) in \"\/glifcos-plugin\/src\/glifcos\/mainw\/synctask\" at line 43\n2016-01-28 04:07:13 [INFO] CONSOLE: Stopping the server...\n2016-01-28 04:07:13 [INFO] Disabling DevTools v1.10.0\n2016-01-28 04:07:13 [INFO] Disabling Specter v0.2\n2016-01-28 04:07:13 [INFO] Disabling Glifcos-p v1.0.0\n2016-01-28 04:07:13 [INFO] [Glifcos-p] Datasync sent to webserver.\n2016-01-28 04:07:13 [INFO] Unloading level \"world\"\n2016-01-28 04:07:13 [INFO] Stopping other threads\n2016-01-28 04:36:24 [INFO] Starting Minecraft: PE server version v0.10.5 alpha\n2016-01-28 04:36:24 [INFO] Loading pocketmine.yml...\n2016-01-28 04:36:24 [INFO] Loading server properties...\n2016-01-28 04:36:24 [INFO] Starting Minecraft PE server on 0.0.0.0:19145\n2016-01-28 04:36:24 [INFO] This server is running PocketMine-MP version 1.4.1-980 \"\u7d76\u597d(Zekkou)\u30b1\u30fc\u30ad(Cake)\" (API 1.11.0)\n2016-01-28 04:36:24 [INFO] PocketMine-MP is distributed under the LGPL License\n2016-01-28 04:36:24 [INFO] Loading DevTools v1.10.0\n2016-01-28 04:36:24 [INFO] Loading Specter v0.2\n2016-01-28 04:36:24 [INFO] Enabling DevTools v1.10.0\n2016-01-28 04:36:24 [INFO] Loading source plugin Glifcos-p v1.0.0\n2016-01-28 04:36:24 [INFO] [DevTools] Registered folder plugin loader\n2016-01-28 04:36:24 [INFO] Preparing level \"world\"\n2016-01-28 04:36:24 [INFO] Enabling Specter v0.2\n2016-01-28 04:36:24 [INFO] Enabling Glifcos-p v1.0.0\n2016-01-28 04:36:25 [INFO] [Glifcos-p] Datasync sent to webserver.\n2016-01-28 04:36:25 [INFO] Starting GS4 status listener\n2016-01-28 04:36:25 [INFO] Setting query port to 19145\n2016-01-28 04:36:25 [INFO] Query running on 0.0.0.0:19145\n2016-01-28 04:36:25 [INFO] Default game type: SURVIVAL\n2016-01-28 04:36:25 [INFO] Done (1.154s)! For help, type \"help\" or \"?\"\n2016-01-28 04:36:44 [INFO] [Glifcos-p] User HotFireyDeath has logged into Glifcos.\n                     IP: 10.240.0.156\n2016-01-28 04:57:21 [INFO] CONSOLE: Stopping the server...\n2016-01-28 04:57:21 [INFO] Disabling DevTools v1.10.0\n2016-01-28 04:57:21 [INFO] Disabling Specter v0.2\n2016-01-28 04:57:21 [INFO] Disabling Glifcos-p v1.0.0\n2016-01-28 04:57:21 [INFO] [Glifcos-p] Datasync sent to webserver.\n2016-01-28 04:57:21 [INFO] Unloading level \"world\"\n2016-01-28 04:57:21 [INFO] Stopping other threads\n2016-01-28 04:57:22 [INFO] Starting Minecraft: PE server version v0.10.5 alpha\n2016-01-28 04:57:22 [INFO] Loading pocketmine.yml...\n2016-01-28 04:57:22 [INFO] Loading server properties...\n2016-01-28 04:57:23 [INFO] Starting Minecraft PE server on 0.0.0.0:19145\n2016-01-28 04:57:23 [INFO] This server is running PocketMine-MP version 1.4.1-980 \"\u7d76\u597d(Zekkou)\u30b1\u30fc\u30ad(Cake)\" (API 1.11.0)\n2016-01-28 04:57:23 [INFO] PocketMine-MP is distributed under the LGPL License\n2016-01-28 04:57:23 [INFO] Loading DevTools v1.10.0\n2016-01-28 04:57:23 [INFO] Loading Specter v0.2\n2016-01-28 04:57:23 [INFO] Enabling DevTools v1.10.0\n2016-01-28 04:57:23 [INFO] Loading source plugin Glifcos-p v1.0.0\n2016-01-28 04:57:23 [INFO] [DevTools] Registered folder plugin loader\n2016-01-28 04:57:23 [INFO] Preparing level \"world\"\n2016-01-28 04:57:23 [INFO] Enabling Specter v0.2\n2016-01-28 04:57:23 [INFO] Enabling Glifcos-p v1.0.0\n2016-01-28 04:57:23 [INFO] [Glifcos-p] Datasync sent to webserver.\n2016-01-28 04:57:23 [INFO] Starting GS4 status listener\n2016-01-28 04:57:23 [INFO] Setting query port to 19145\n2016-01-28 04:57:23 [INFO] Query running on 0.0.0.0:19145\n2016-01-28 04:57:23 [INFO] Default game type: SURVIVAL\n2016-01-28 04:57:23 [INFO] Done (1.034s)! For help, type \"help\" or \"?\"\n2016-01-28 04:57:26 [INFO] Disabling Specter v0.2\n2016-01-28 04:57:44 [INFO] Enabling Specter v0.2\n2016-01-28 04:58:45 [INFO] Disabling Specter v0.2\n2016-01-28 04:59:15 [INFO] Enabling Specter v0.2\n2016-01-28 05:00:10 [INFO] Disabling DevTools v1.10.0\n"}